number,progress,title,like,contents,answer,category,sday,eday,proponent
588033,청원종료,"강력한 사회적거리두기 운영제한 업종(종교, 학원, 실내체육시설 등등) 임대료 면제 정책 촉구",427,"안녕하세요...어린이스포츠클럽을 운영하고 있는 개인사업자입니다.
현재 코로나19라는 바이러스로 거의 대부분의 국민들이 어려움을 호소하고 있는 상황이라는거 잘 알고있습니다.
그 와중에 너무도 많은 피해와 함께 납득이 되지 않는 부분들이 있어 이렇게 청원을 합니다.

강력한 사회적거리두기가 1차로 가장 중요한 시점이라하여 정세균총리의 담화와 함께 시작되었습니다.
그 담화 내용중 몇가지 업종들이 콕 집어 발표되었는데 종교시설, 학원, 실내체육시설 등등이 포함되어 있고 저희 어린이스포츠클럽도 실내체육시설이라 생각되어 적극 동참하고 있습니다.
강력권고사항...이 업종들에서 권고사항을 지키지 않고 운영하다가 코로나 확진자가 발생한다면 다양한 방법으로 조치를 취한다고 하였습니다.
위험을 감수하고 마음을 졸이며 운영에 나선 업주들도 있겠지만 상당수는 권고에 따르고 있을꺼라 생각합니다.
2주간의 시간이 흐르고 다시 운영을 준비하고 있던차에 2주간의 연장이 발표되었습니다.
또 이번 2주간이 중요하다고 합니다. 이 2주간의 기간이 지켜지지 않으면 모든 노력이 물거품이 된다고 합니다.

현재까지 업을 중단하고 권고사항에 잘 따르고 있는 업주들과 직원들은 점점 불안감이 커지고 있습니다. 언제까지 일까? 문을 닫고 기다린다고 해서 이 상황이 정부 말대로 종식되는건가? 해외 입국자들은 왜 자꾸 들어와서 문제를 만드나? 아침 10시 일일코로나 확진자수만 떨리는 마음으로 지켜보고 있습니다.

저와같은 어린이스포츠클럽은 사회적거리두기를 권고하던 2월 마지막주부터 대부분 정부정책에 적극 협조하는 차원에서 문을 닫았습니다. 3월부터는 매출액이 15%,50% 줄어든게 아니라 그냥 ""0""입니다. 따라서 임대료, 관리비, 금융비, 일부 급여 등 마이너스 요인이 되어 그 피해가 막심합니다.
운영을 했다면 그 적자폭을 줄이거나 적자를 면할수도 있었겠지만  권고사항에 콕 찝어 포함된 업종인만큼 운영할 수 없었습니다.

현 코로나상황은 이미 장기적인 관점으로 바라봐야 한다고 여러 전문가들이 연일 매스컴에서 얘기하고 있습니다. 강력한사회적거리두기에 포함되어 운영을 포기해야 하는 업종들은 그만큼 정부의 특별하고 세심한 지원이 필요한건 당연한거 아닌가요? 언제까지 지속될지 아무도 모르는 상황이기 때문에 더욱 그렇습니다.
또한 3월부터 현재까지 운영을 전혀 하지 못한 상황에서 가장 걱정이 큰 부분은 임대료입니다. 
열심히 일해서 수익이 있는 만큼 세금을 내고 수익이 없으면 적자를 보는건 당연합니다.
하지만 지금은 열심히 일 하지 않아 수익이 없어서 적자를 보는 그런 당연한 상황이 아니라 코로나라는 바이러스에 대응하는 정부의 정책에 따라 영업제한 권고가 내려진 업종입니다.
자영업자, 개인사업자이지만 자율적인 판단에 의해 업의 중단 또는 개시를 할 수 있는게 아니라 자율성을 일부 침해당한 상황이라는 생각이 듭니다. 말이 강력권고지 운영하다 확진자라도 나왔을때 조치를 보면 권고가 아니라 운영하지 말라는 겁니다.
전국민이 코로나19 바이러스와 싸우고 있는 현 상황에서 강력한 사회적 거리두기는 상황이 나아질때까지 계속되어야 한다고 생각합니다.
하지만 그런 정책때문에 직접적인 어려움을 겪고있는 업종들에 대한 세심한 지원책 마련을 촉구합니다.
임대료는 대표적인 불로소득입니다.
정말 답답한게 착한임대료 캠페인이라 하여 임대료를 낮춰준 사람들의 예를 들어 미화하는 기사들을 봅니다. 아주 좋은 일이라 생각합니다만 착한임대인이 그렇게 많을까요?
오히려 임대인에게 하소연하고 조금이라도 깎아줄것을 얘기했다가 몇달 후 갱신계약때 임대료 인상을 생각하고 있다는 말을 들었습니다.
임대료 밀리지 않게 내는거 너무나 당연한것 같았지만 이제는 의문이 듭니다.
자영업자들, 개인사업자들은 강력권고로 영업의 권한을 침해당하며 운영을 중단해야 하고 직원들을 해고해야 하며 일부 보조해주는 고용유지지원금을 받으려 그 많은 자료 만드는데 며칠을 소모하고 30분씩 기다려도 받지않는 전화를 계속 해대야 하는건지요....왜 대출은 접수만 되고 진행이 안되는 건지요...그 대출은 그냥 누가 주는 돈이랍니까? 결국 갚아야 하는 돈 아닌가요?
하지만 임대인은 코로나로 사람이 죽든말든 임차인이 영업을 하든 말든 나라의 권고가 있든말든 임대료는 기간 맞춰 잘 납부해주세요~입니다...
열심히 일하는 사람은 모든부분에서 연결되어 함께 이 어려움을 연대하며 온몸으로 버텨내고 있는데 왜 임대료는 이런 상황에서도 우리 임대인이 착한임대인 이기만을 바래야 하는지요...안그래도 어려운 상황인데 임대인에게 전화하여 읍소하는 처지가 되어버립니다.
임대료 자체가 잘못되었다는 말이 아닙니다. 현 정부 정책으로 운영제한에 포함된 업종들 중 잘 참여하고 있는 자영업자들, 개인사업자들은 임대료만이라도 면제해 주는 정책을 논의해 주세요...코로나 상황이 더 길어져도 정부정책에 국민으로써 긍정적인 마음으로 참여할 수 있게 말이죠....카드단말기 매출액보면 쉽게 확인할 수 있습니다. 정부권고에 협조한 업체의 매출은 3월부터 현재까지 매출 ""0""입니다.
아니면 착한임대인 캠페인 하지마시고 임대인들에게도 강력권고 해 주세요...강력한사회적거리두기 기간동안 운영제한된 업종 임차인 임대료는 해당 기간 만큼 제하라고...
반드시 ""강력한사회적거리두기""로 인한 운영제한업종들은 운영중단기간동안 임대료 면제하는 정책이 필요합니다.
부동산이 사유제산이라 침범할 수 없다면 일반 자영업, 개인사업자들의 운영권한도 마찬가지라고 생각합니다.
그래야 코로나19 상황이 더 연장되더라도 버틸 수 있고 정부정책을 신뢰하며 따를 수 있습니다.",NaN,보건복지,2020-04-13,2020-05-13,naver
588036,청원종료,국민 고용보험 도입을 청원합니다!,769,"국민 고용보험 도입을 청원합니다!


1. 고용보험을 아십니까?

 고용보험에 가입된 노동자는 아이를 낳으면 출산휴가급여 600만원을 받고, 육아휴직을 하면 임금의 80%를 받습니다. 직장을 잃으면 최대 8개월 실업급여를 받구요. 돈이 필요할 때는 이율 1.5%로 근로복지공단 소액 대출을 받을 수 있습니다. 처우개선이 필요하면 노동조합을 만들어 사장을 협상장에 불러낼 수 있고, 상사가 성희롱을 하면 직장 내 성희롱으로 처벌시킬 수 있습니다.


2. 국민고용보험은 코로나19와 같은 위기 상황에 빛을 발할 것입니다.

 세계적 재난에도 한국은 국민건강보험이라는 안전망이 있기에 의료비 걱정을 하지 않습니다. 하지만 일자리 걱정은 큽니다. 가게가 파산할까 걱정이고 생계유지가 걱정입니다. 배달노동자, 강사, 보험설계사, 예술인, 자영업자 일하는 사람이면 누구나 가입할 수 있는 고용보험이 있다는 상상을 해봅니다. 직장을 잃어도 든든한 버팀목이 될 거에요. 일회성 재난생계비를 넘어서 수개월동안 실업급여를 받을 수 있을 테니까요.


3. 물론 보완이 필요합니다.

 먼저, 새로운 전국민 고용보험 제도를 도입할 때는 취약계층에 대한 사각지대를 없애야 합니다. 현재 고용보험 제도는 정규직, 무기계약직 노동자들에게만 온전한 혜택을 줍니다. 단시간, 기간제 노동자에게는 제약이 너무 많아요.
 그리고 고소득자에게는 더 많은 보험료를 내게 해야 합니다. 소득수준에 따라 근로소득세율이 다른 것처럼요.
 세 번째, 적은 금액의 소득이 발생할 경우에는 부분적으로 실업급여를 지급해야 합니다. 지금은 부분 실업급여가 없어, 아예 소득활동을 포기하게 만드는 부작용도 있으니까요.


4. 전 국민 고용보험을 도입해봅시다.

 코로나 대응 의료정책에서만 자랑스러워할 건가요? 예술인이든, 강사든 가리지 않고 임금을 보전해주고 실업급여를 주는 유럽과 캐나다를 언제까지 부러워만 할 건가요? 우리보다 코로나를 빨리 접한 중국이나 늦게 접한 유럽, 캐나다는 노동자들의 임금을 대부분 보전해주고 있습니다. 기업이 파산해도 정부가 생계를 책임집니다. 그들은 생계 걱정을 하지 않아요. 안전장치가 있으니까요.

 사실 국민 고용보험은 새로운 주장이 아닙니다. 예술인 고용보험, 건설노동자 노동보험... 그동안 각자 산발적으로 주장해왔을 뿐입니다. 이제 그 목소리를 하나로 모아야 합니다.

 전 국민 고용보험은 코로나가 불러올 경제위기와 생계곤란을 대비하는 효과적인 안전망입니다. 
 국민 고용보험을 도입해주십시오.",NaN,일자리,2020-04-13,2020-05-13,naver
588072,청원종료,신분당선 지하상가 임대료를 인하해주실것을 요청합니다.(서울지하철2호선 강남역 지하상가임대료를 인하한 것처럼),134,"1. 저희는 지하철 신분당선강남역 지하상가 11평짜리 매장에서 자영업을 운영해오고 있습니다. 처음부터 높게 책정 된 임대료로 인해서 수익을 내지 못했지만, 함께 일하는 직원들과 정이 들었고,  그들이 꿈을 키우기 위해 머물다 가는 곳이 되어 주었으며, 직원들의 일자리를 쉽게 뺏앗을 수 없어 지체하다보니 여기까지 왔습니다.                                                                    2. 지난달에는 유동인구가 급감해서 매출액이 추락하여 임대료와 같았습니다. 우선 직원들의 월급을 주었고 임대료는 낼 수도 없었습니다. 코로나19가 장기화 될 전망이라는 보도에 절망을 느낍니다. 월 1,2천만원의 임대료를 몇 달동안 못내어 쌓이게 된다는 것이 아찔합니다. 이 세계적인 재난인 코로나19로 인해 지하철 신분당선강남역 지하상가 자영업자들이 임대료에 깔려 죽게 되었습니다.                                                                                                                                                                                                               3. 답답한 마음에 *** 관계자들도 만나고 심정을 얘기했지만 그들도 힘없는 직원들이었습니다. ***는 *****과 계약을 맺었고, *****은 신분당선주식회사와 계약을 맺었고, 신분당선주식회사는 국토부의 철도교통개발과와 계약을 맺고 있습니다. 계약자의 규모는 개인자영업자가 맨아래에 있는 역피라미드 구조입니다. 개인자영업자가 거대기업과 정부의 맨 아래에서 어마어마한 임대료를 감당하고 있습니다.                                                                                                                                 4. 대통령님의 착한임대료운동 동참요청에 서울시를 비롯한 정부기관, 공기업, 지자체, 대기업, 개인임대사업자들까지도 쓰러져가는 자영업자들을 위해 착한 임대료운동에 적극 호응하고 있습니다. 대구메트로는 지하상가 임대료를 50%인하했습니다. 서울 메트로도 지하철2호선 강남역 지하상가의 임대료를 50% 인하해주어 자영업자들이 살길을 열어주었습니다.                                                                                                                                                                                                      5. 그런데 신분당선주식회사는 강남역내의 같은 지하공간에 있는 신분당선 소규모매장의 매출이 평균70%이상 감소했음에도 불구하고, 적자라는 이유로 착한임대료운동에 대해 대화상대조차 해주지 않고  있습니다. 갑을병정 중 갑의 위치에 있는 신분당선주식회사가 정의 위치에 있는 자영업자들에게 혜택이 가도록, 직접적으로 임대료를 인하해 주도록 해주십시요.                                                                                                                                                                                                       6. 해결방법으로는 신분당선 운영기간을 1년연장해주면 추가된 수익으로 자영업자들에게 임대료를 인하해 주도록 할 수 있습니다. 아니면 매출에 대한 수수료율로 임대료를 반영하는 합리적인 방안도 있습니다.                                                             7. 국토부가 신분당선주식회사와 조율을 해주시면 저희 자영업자들도 좋은 영향을 받게 될 것입니다. 기재부.국토부에 여러번 전화를 걸었지만 반복되어 되돌아 온 답은 부재중입니다.    안타까운 시간을 보내고 있습니다.  제발 도와주십시요.

 [본 게시물의 일부 내용이 국민 청원 요건에 위배되어 관리자에 의해 수정되었습니다]",NaN,교통/건축/국토,2020-04-14,2020-05-14,naver
588087,청원종료,긴급재난지원금은 국민 모두가 공평하게 받아야 합니다.,2029,"긴급재난지원금은 국민 모두가 공평하게 받아야 합니다.


긴급재난지원금을 소득 하위 70% 기준에 맞춰 지급한다는 정부 발표가 있었습니다.
재난은 소득 상위 30%라고 해서 피해 가지 않습니다.
화재, 지진, 홍수, 교통사고, 소득 상위 30%라 하여 재난이 피해 가고 보험 보상금을 받지 못하나요?
물론 가진 사람이 더 많이 낸다는 세금의 기본정책은 이해하지만 재난 기금은 일반적인 복지정책과 그 성격이 다르다고 생각합니다.



정부에서 말하는 소득 하위 70% 기준에 대한 문제입니다.

1) 정확한 기준 없음, 선별로 인한 행정력, 비용, 시간 낭비, 사회적 혼란, 국민 분열 조장

지금 누가 어려운지 정확하게 확인할 수 있는 사람이 있나요?
어떤 기준이 명확하다고 말할 수 있나요?
종합소득세는 지난해 6월 신고한 금액으로 하게 되면 재작년의 소득으로 평가하게 됩니다.
근로소득세를 내는 봉급생활자는 작년에 회사에 다니면서 돈을 잘 벌었는데 올해 실업자가 되면 제대로 지원을 못 받게 됩니다.
작년에 벌이가 좋았다 하더라도 코로나로 인한 실직이나 폐업 등
여러가지 경우의 수가 있는데 이것을 다 고려할 만한 시간과 행정력이 그리고 정확한 기준을 세울수가 있을까요?


세금 혜택을 받은 사람은 또 받고 또 받고
세금을 내는 사람은 혜택 없이 또 내고 또 냅니다.
이미 세금을 많이 내고 있는 사람이 재난기금에서조차 지원을 받지 못한다면
상대적 박탈감은 어떻게 하실 건가요?
소득 상위 30%는 우리나라 국민이 아닌가요? 재난에서조차 양보해야 하는 건가요?
선택형 복지는 국민을 분열시킵니다.




2) 지급기준에 대한 형평성의 문제

재난기금을 건강보험료를 기준으로 하면 직장가입자와 지역가입자의 형평성에 문제가 있습니다.
현재에도 직장가입자와 지역가입자의 불평등에 관한 이야기가 많습니다.
아직 해결되지 못한 불평등한 기준이 재난기금의 기준이 되어서는 안됩니다.


건강보험료를 기준으로 했을 때 직장가입자와 지역가입자의 보험료 차이가 크게 납니다.
직장가입자는 월소득만을 기준으로 하고 재산이 포함되지 않습니다.
지역가입자는 소득 외로 집값, 자동차 등 재산이 포함됩니다.
대부분의 서민들은 월급의 대부분을 집값 대출금을 갚는데 씁니다.
대출금을 생각하지 않고 오직 공시지가를 기준으로 판단할 수 있나요?


지금 당장 유통할 수 있는 현금이 없는 게 더 큰 문제 아닌가요?
언제 이 사태가 끝날지 모르는데 가진 부동산을 팔아서 현금을 보유하란 말씀이신가요?
이러한 사정을 고려하지 않고 긴급재난기금의 기준이 건강보험료가 될 수 있을까요?


한평생 일해서 실거주이자 노후대책을 위해 집 한 채가 있고 은퇴하여 소득이 없고 금융자산이 없는데
평생을 일궈서 마련한 집을 포기하라고 하실 건가요?
지원금 경계선에 있는 사람들은 이런 과정을 지켜보고도 경제활동에 열심히 해야겠다는 의지가 생길까요?


코로나 사태로 가장 피해를 보는 사람은 소상공인, 자영업을 하는 사람들입니다.
월급이 보장되는 공무원, 교사의 경우와 맞벌이 하며 가게를 운영하는 사람 중에
코로나로 인해 직접적인 경제적 피해를 본 사람은 누구인가요?
중소기업은 임금 삭감이나 퇴직을 종용하는 경우가 있을 겁니다.
그런 경우는 예외로 별도의 지원금을 마련하는 것이 낫다고 봅니다.


정부에서 발표한 중위소득 150% 경계선에 걸친 사람은
약간의 차이로 지원을 받고 못 받고가 달라집니다.
경계선에 걸친 사람들이 좀 더 열심히 일해 소득 상위 계급에 오르길 바랄까요?
아니면 그 자리에 머무르는 게 낫겠다는 생각이 들까요? 열심히 경제활동을 해야겠다는 의지를 꺾지 말아주세요
소득, 나이에 차등을 두지 말고 전 국민 대상으로 재난기금 마련을 촉구합니다.",NaN,보건복지,2020-04-16,2020-05-16,naver
588097,청원종료,영세어민들도 대한민국 국민입니다,242,"대한민국 정부에 청합니다.

지금 정부에서 코로나19사태로 인해 고통받는 국민들을 위해 고군분투 하며 긴급재난 지원 대책으로 많은 정책들을 펼치고 있는 것으로 알고 있습니다. 

하지만 영세어민들에 대한 지원정책은 없는 실정입니다.
대한민국 삼면의 바다에서 열심히 일해서 가족을 돌보며 생계를 이어가는 영세어민과 그 가족들도 대한민국 국민입니다.
매년 줄어드는 어획량과 경기 침체로 어려운 환경속에 조업을 해오고 있었지만 코로나19 사태라는 직격탄으로
영세어민들도 지금 어려움을 겪고있는 자영업자분들과 다르지 않게 힘든 시간을 버티고 있는 실정입니다. 
1분1초가 긴급한 시기인 만큼 신속하고 차별없는 지원정책으로 소외된 영세어민의 가족들도 이 어려운 시기를 이겨낼수 있도록
도와주시길 바랍니다.

다시한번 정부에 청합니다.
영세어민들의 생계유지 방식 특성상 높은 신용등급을 유지하기가 쉽지 않기에  그런부분에서도 차별적이지 않고 모두가 지원을 받을수 있는 정책을 만들어 주실것을 간절히 청합니다.",NaN,농산어촌,2020-04-16,2020-05-16,kakao
588114,청원종료,대구 추경 1조원증액 취소 청원합니다.,8632,"김부겸의원님이 받아낸 대구 추경 1조원증액 반대합니다.
지금까지 대구시와 대구시장은 정부에서 내려보낸 모든 금액들을 확실히 밝히지도 않고 지급도 잘되고있지않습니다.
그로인해 피해를보는 대구 자영업자들이 늘어나고있는상황에 기존 자금들도 운용을 못하는 시와 시장에게 추가증액은 필요없다 생각합니다.
물론 김부겸의원님이 고생하신건 충분히 알고있습니다.
하지만 그돈이 어디로 어떻게 샐지도 모르는 상황에 증액만이 답은 아니라 생각합니다.",NaN,정치개혁,2020-04-16,2020-05-16,naver
588120,청원종료,20대 청년들의 스타트업 사업 아이템을 강제로 갈취하고 생계를 위협하는 **시 문화재단의 갑질 횡포를 고발합니다.,353,"안녕하세요. 
저는 ** **동에서 친구들과 흑백 셀프 스튜디오를 운영하고있는 20대 자영업자입니다.

저희 스튜디오는 사진작가 없이 포토부스에 들어가서 리모콘을 이용해 촬영을 하는 새로운 개념의 셀프 스튜디오로써 **의 10~30대의 큰 호응을 받고 있습니다.

개업한지 어언 한달 반 째 코로나로 매출이 반토막이 된 와중에 갑자기 시 공무원 두분이 스튜디오로 찾아 오셨습니다.

**시 **문화재단 전통사업부라고 본인들을 소개하더군요.

그분들이 한 얘기는 아래와 같습니다.

1. **동 전통문화관에 이곳과 동일한 셀프 스튜디오를 개관하려 한다.

2. 가격은 이곳보다 쌀 것이며, 타격이 있을까봐 예의상 먼저 알리는 것이 맞을것 같아서 찾아왔다.

3. 스튜디오 설립은 확정이고, 이곳과 500m내에 위치하고있다.

시의 일방적 통보에 저희는 앞이 깜깜해졌습니다.

20대의 ** 청년들이 좋은 아이디어를 실현코자 한푼, 두푼 열심히 모아 어렵게 개업한 셀프 사진관입니다.

국가는 스타트업을 양성하고, 20대 젊은 사업가들을 적극 지원하겠다면서, 뒤로는 신선한 아이디어를 그대로 가져가서 **시라는 거대한 지지기반을 등에 업고 더 낮은 가격으로 소상공인의 삶을 위협하고 있었습니다.

""**시의 셀프스튜디오 설립은 기정 사실이니 예의 상 알려줘야해서 왔다는 것""은 저희에게 ""우리가 미리 알려줬으니 너희들은 폐업준비를 해라"" 라는 말로 밖에 안들렸습니다.

이 셀프 스튜디오는 저희의 피와 땀이 섞인 가게입니다.
저희가 직접 페인트칠하며, 밤새 아르바이트 하며 번 돈으로 세운 청년들의 값진 결과물입니다.

그런데 말로만듣던 ""갑질""을 국가에서 하다니요?

""상생""하는 방안을 찾자던 **문화재단 전통사업부 팀장님, 주임님!

이 셀프스튜디오가 대체 ""전통사업부""와 어떤 연관이 있습니까?

미확정된 사업도 아니고, 확정된 사업을 미리 알려주는 의도가 무엇입니까?

저희에게 폐업을 준비하라는 의미입니까?

""전통사업""을 하기 위해 만들어진 전통사업부에서 전통사업과 전혀 연관성이 없는 셀프스튜디오를 개관하여 힘없는 소상공인의 생계를 위협하는 이유가 대체 뭡니까?

빽없고 힘없는 20대인 저희가 이에 대항할 수 있는 방법은 이렇게 시민여러분들께 청원 동의를 구하는 방법 밖엔 없습니다.

저희는 저희 생계를 위협하고, 아이디어를 갈취해간 **시에 분노를 금할 수가 없고, 저희 친구들의 생계를 위해서라도 1인시위, 언론제보, 청원 등을 통해 기필코 이 사업을 막을 예정입니다.

저희들의 처절한 절규를 제발 귀기울여 주세요.
공감해주시면 정말 감사드리겠습니다. 이상 긴 글 읽어주셔서 정말 감사드립니다..

 [본 게시물의 일부 내용이 국민 청원 요건에 위배되어 관리자에 의해 수정되었습니다]",NaN,기타,2020-04-16,2020-05-16,kakao
588128,청원종료,소상공인 긴급 경영 안전 지원금 사업장과 주민등록이 같지 않다고 지원대상에서 제외 되어 억울합니다.,442,"영세 자영업을 하고 있습니다..
코로나19로 인하여 하루하루가 고난의 연속입니다.

주민등록은 세종으로 되어있고 사업장은 대전입니다.

세종특별자치시: 사업장과 주민등록 모두 등록되어 있는 시민만 지원대상이 된다고 합니다.
대전 유성구:  사업장과 주민등록 모두 등록되어 있는 시민만 지원대상이 된다고 합니다.
지자체 모두 똑 같은 답변만 합니다.

주민등록과 사업장이 따로 되어 있는 국민은 세금도 안내고 사나요?
다 세금내고 사는 국민입니다.

주민등록과 사업장이 따로 있다는 이유로
지원대상에서 제외 된다고 하니 속상하고 억울합니다.
선거 할 때도 주민등록 거주지에서 합니다.
긴급 경영 안전 지원금 관할 거주지에서 받을 수 있도록 간곡히 요청 드리며 호소드립니다.",NaN,보건복지,2020-04-17,2020-05-17,naver
