number,progress,title,like,contents,answer,category,sday,eday,proponent
588165,청원종료,소상공인 코로나 재난 지원금 부당지원,310,"저는 백화점에서 매장을 운영하는 자영업자입니다
지금 코로나 재난 지원금으로 지역마다 소상공인들에게 지원금이 신청되고 있는데
그 대상자가 너무 황당해서 이렇게 글을 올립니다
주민등록 실제 거주지와 사업장 주소가 동일한 경우에만 지원이 된다고 합니다
저는 주소지와 사업장이 다른 지역이라 두 지역 모두 에게서 대장자 제외라고 합니다
세금은 꼬박꼬박 다 받아가면서 이럴때는 주소지 때문에 제외 시킨다면
저의 사업장 세금은 받아가지 말아야 하는게 맞지 않을까요?
금액이 중요한게 아니라 이런 어처구니 없는 행정이 화가 납니다
이렇게 두 지역이 나몰라라 하는 행정이라면
앞으로 주소지가 다른 사업장의 세금은 부과하지 말아 주세요~",NaN,기타,2020-04-19,2020-05-19,kakao
588168,청원종료,특수상권의 자영업자는 두번 죽습니다.,205,아울렛 안에서 음식점업을 하고 있는 소상공자영업자 입니다. 매출이 반토막보다 더한 수준으로 줄어들고 힘든 사정 이지만 국민 모두가 다 힘든데 그래 조금만 더 참고 버텨보자고 버티는 중입니다. 그런데 국가나 지자체에서 주는 재난지원금이 저희같은 특수매장에서는 사용이 되지 않아서 또다시 손님들이 찾지않아 두번 죽이는 상황입니다. 저희 같은 특수매장은 하나하나는 다들 작은 소상공매장인데 수수료를 내는 매장이다보니 아울렛 전체로 취급되어 재난지원금의 사용이 전혀 안되어 또다시 힘든 사정에 처해 있습니다. 대책이 시급합니다.,NaN,보건복지,2020-04-19,2020-05-19,kakao
