number,progress,title,like,contents,answer,category,sday,eday,proponent
588639,청원종료,미성년자 주류판매법 개정 요청,383,"안녕하세요~ 저흰 7년 넘게 한곳에서 레스토랑을 운영하고 있는 자영업자입니다~ 코로나19로 안그래도 매출이 없어 영업손실이 몇천씩 쌓여 힘든 요즘 그래도 버텨보자며 노력 중인데 너무 큰시련을 또주시네요
어제 갑작스럽게 미성년자 주류판매로 경찰이 다녀갔고 저희는 처분을 기다리는 상황이 되었습니다.
저희는 식사 판매가 주이다 보니 오랫동안 장사하면서도 이런경우가 생길 꺼라는 생각도못했었죠
근데 저희가 당하고 나서 검색을 하다보니 정말 많은 자영업자 분들이 당하고 있는거 같더라구요
술마신 사람은 처벌이 없고 모르고 판 영업장은 고스라니 막대한 손실을 봐야하고 누구를 위한 법인지 모르겠네요
신분증검사 직원들에게 교육은 시키지만 정말 바쁠때 누락이 되는 경우도 있고 몰래 껴서 먹는경우 신분증위조, 경쟁업체에서 시켜서 알바하는 친구들, 술먹고 신고 한다며 협박하는 아이들, 본인들이 마시고 신고하는 아이들 이게 청소년 보호법 인가요?
일부러 돈벌려고 아이들에게 술파는 업체가 과연 몇일까요?물론 악의적으로 아이들에게 술파는 업체는 처벌받아야겠지만 대부분 반대인 경우가 많은 듯 합니다. 
술마신 사람이 처벌받을수 있게 본인 아이들이 몰래가서 다른 업장에 피해를 준건 생각 안하고 아이들에게 술팔았다고 신고하는 부모에게도 본인 아이들 관리 못한 죄가 있는거 아닌가요?
몰래와서 술마신 사람은 왜 죄가 없는건지요?
잘못된 청소년보호법으로 생계에 위협받는 자영업자를 위해 법개정을 요청합니다!!",NaN,기타,2020-05-06,2020-06-05,kakao
588672,청원종료,친일 망언 **군수의 주민소환 서명부 정보 강탈을 막아주십시오.,1663,"저는 충북 **군에서 진행되고 있는 주민소환 청구인 대표자입니다.

  친일 망언으로 주민소환 대상자가 된 정** **군수가 **군 선거관리 위원회에 주민소환 서명부 정보 공개를 청구했습니다. 주민소환이 진행되고 있는 지자체장이 자신의 소환에 찬성하는 군민의 정보가 들어있는 서명부를 강탈하겠다는 것이 상식적으로 있을 수 있는 일입니까?  이 서명부가 정** 군수에게 넘겨진다는 것은 **이라는 작은 지역에서 곧바로 ‘블랙리스트’가 되고 ‘살생부’가 된다는 것은 너무나 자명한 일입니다.
  더욱 심각한 일은 이를 당연히 기각하고 **군민들의 정치적 의사표시를 선거행위로 인정하고 공정하게 관리해야할 **군 선관위가 이를 허용하기로 했다는 일입니다. 충북도선관위 또한 정보공개심의 위원회를 열어 공개를 결정한 것도 마찬가지입니다.

  정** **군수의 ‘친일 역사 왜곡 발언과 오만하고 독단적인 불통의 군정과 전시행정으로 인한 예산낭비’등의 이유로, **군민들은 주민소환운동을 진행했습니다. 그 결과로 지난해 12월 16일부터 2월 14일까지의 서명기간 동안  주민소환청구인 4,691명의 서명부를 확보하여 **군 선관위에 제출하였습니다.
  이는 주민소환투표를 진행하기 위한 서명요건 4,415명을 훨씬 넘긴 것으로, ‘소통령’이라 불리는 시골 3선 군수의 절대권력 앞에서 주민주권실현을 위한 **군민들의 용기였으며 민심이 반영된 결과였습니다.
  서명 과정에서 **군민들은 정** 군수의 절대권력을 실감했습니다. **군에 있는 수 십 개의 광고업체는 정** 군수의 직,간접적인 위협으로 눈치보느라 현수막을 제작해주지 않아 그나마 만든 것도 게시허가가 나지 않아 수십개의 현수막이 무용지물이 됐습니다. 이에 반해 정** 군수를 지지 옹호하는 현수막은 **군 곳곳에 걸려서 마치 **군민들은 주민소환을 반대하는 듯한 여론몰이가 진행됐습니다.
  이뿐만이 아닙니다. 보조금을 받는 관변단체들이 정**군수 주민소환을 반대하는 집회를 열어 단체장이 삭발까지 하며 주민소환운동에 찬물을 끼얹는 행위를 자행했습니다. 면장이 서명을 받는 수임인에게 ‘**군에서 앞으로 살기 힘들 거다’라며 협박하였습니다. 마을이장이 주민소환서명부에 서명하지 말라는 방송을 하고, 서명한 어르신들을 대상으로 서명철회를 종용하는 등 조직적 방해를 계속하였습니다. 정** 군수를 지지한다는 불법적 서명으로 방해하거나, 읍명별로 군수를 지지하는 단체의 이름으로 릴레이 광고를 게재하였습니다. 이렇게 3선 군수의 절대 권력과 지방토호세력, 일부 관변단체와 공무원, 마을이장 등은 동원하여 주민주권을 침해하는 행위가 이뤄졌습니다.
  이러한 온갖 방해 속에서 **군민들의 주권 행사를 위해 무보수의 수임인들의 헌신적인 노력으로 서명이 진행되었습니다. 추운 겨울 2달 동안 **군 250여 마을 집집마다 방문하며, 발바닥이 갈라지고 때로는 화상을 입어도 쉬지 못하고 수만 걸음을 걷고 또 걸어서 4,691명의 서명을 받아 제출했습니다. 

  그런데, 소환대상자로서 주권자인 군민들의 의사로 표시된 주민소환의 정치적 의미를 인식하고 반성해야야 할 정** 군수는 코로나19 극복을 위해 온 국민이 힘을 모았던 지난 2월, 주민소환 서명부 일체의 정보공개를 청구하는 비상식적인 행태를 보인 것입니다.
  이에 충북도선거관리위원회 정보공개심의위원회는 지난 3월 ‘개인 신상이 드러날 경우 주민소환투표에 영향을 미치게 되기 때문에 읍면별로 이름만 공개하는 것’으로 결정했습니다. 그러나 **군은 이름만 대면 다 아는 좁은 지역사회로 읍면별로 성명을 공개하는 것은 개인 신상이 모두 드러날 수밖에 없습니다. **군은 재정자립도 전국 최하위로 농업인은 군보조금에 의존도가 높으며, 자영업자와 사업체들은 군을 등지고 영업하기 힘들고, 공공형 일자리에 생존권이 달린 주민도 많습니다. 
  더구나 주민소환청구 서명은 자신의 정치적 견해가 이미 드러난 것으로 이는 헌법이 보장한 정치적 자유를 심각하게 훼손하는 것이며, 주민소환제도 자체를 를 심각하게 훼손하는 행위입니다.
  **군민들은 위안부 피해자 이옥선 할머님이 ‘나라가 힘이 없어 일본한테 당했다. 학생들이 잘 배워야 한다’며 평생 아껴 모았던 2천만원을 장학금으로 기부하시는 할머님의 눈물을 기억하고 있습니다. 그러나 전국재정자립도 최하위에서도 임기동안 200일 넘게 해외연수를 다녀오고, 건축물마다 기념식수와 심지어 2m가 넘는 기념비에 정** 군수 이름 새기기, 무분별한 토목공사로 인한 예산낭비 등을 계속되어 왔습니다.

  친일역사를 청산하고 정치개혁과 주민주권을 실현하기 위해 용기 내어 주민소환운동을 벌이고 있는데, 주민소환법 맹점을 이용해 서명부 열람을 넘어 소환 당사자에게 서명명단 전체를 공개한다는 어처구니없는 일이 발생했습니다.
  좁은 지역사회에서 서명부 열람과 공개는 단체장에게 살생부를 주는 것과 다를 바 없습니다. 군수를 반대한다는 이유로 온갖 불이익과 협박, 회유가 벌어질 것입니다. 이로 인해 지역사회와 지역민들 사이에 불화와 분열, 갈등과 혼란이 이어질 것입니다. 
  주민소환 서명부는 단순한 개인 정보가 아니라 주권자인 군민의 정치적 의사가 표시된 중요한 정보입니다. 당연히 공개될 경우 국민의 생명, 신체 및 재산의 보호에 현저한 지장을 초래할 우려가 있다고 인정되는 정보’에 해당되어 당연히 비공개되어야 할 것입니다. 서명부 정보 공개는 군민들의 신성한 주권 행사에 대한 심각한 도전이며, 주민소환제도가 추구하는 주민주권을 훼손하는 것입니다. 이러한 주권 침해행위가 허용된다면 주권자의 헌법정신을 지키기 위한 저항에 당면할 것입니다.

  따라서 우리는 다음과 같은 주장을 청원합니다. 

1. 정** **군수는 주민소환 서명부 정보공개 신청을 즉각 철회하고, 주민소환 투표에 임해야한다.

1. **군선관위는 정보공개 결정을 즉각 취소하고 공정한 주민투표 업무를 진행해야한다.

1. 충북도선관위는 정보공개심의위원회 공개결정을 취소하고 **군민에게 사과해야한다.

1. 중앙선관위는 우리가 신청한 행정심판과 업무정지 신청을 즉시 인용해야한다.

1. 정부와 국회는 위헌의 소지가 있는 서명부 열람 규정을 포함하여 주민소환법을 개정해야한다.

 [본 게시물의 일부 내용이 국민 청원 요건에 위배되어 관리자에 의해 수정되었습니다]",NaN,정치개혁,2020-05-07,2020-06-06,naver
588676,청원종료,배은망덕한 ** 웹툰작가 최**을 **시켜주세요,2904,"최**은 **에서 불법인 한국영화 시청 유포 및 자영업등의 범죄를 저지르고 **했지만, 대한민국은 받아주었습니다. 그리고 국민세금으로 정착하게 도와줬고 자유롭게 살게 해주었습니다. 하지만 최**은
고마운줄도 모르고 최고 존엄을 모욕하고 전두환 치욕 동상의 얼굴과 바꿔치기까지 하면서 문재인 대통령의 명예를 훼손하였습니다. 만약 김정은에게 그렇게 했다면, 어떤 대접을 받겠습니까? 이런자는 다시 **시켜 숙청되게 해야합니다. 그래서 대한민국이 얼마나 정의롭고 감사한 나라였는지 깨닫기를 바라는 바입니다.

 [본 게시물의 일부 내용이 국민 청원 요건에 위배되어 관리자에 의해 수정되었습니다]",NaN,외교/통일/국방,2020-05-07,2020-06-06,facebook
588683,청원종료,어려운 시기에 준 '도움'에 돌아오는 것은 '전과자' 딱지? 사실을 말해도 처벌이 되는 이상한 법과 이를 악용하는 사람들,229,"요약: 

(1) 어려움에 처한 H를 돕고자 1년 이상의 월세, 각종 공과금 등 모든 돈을 대납하며 주거 공간을 제공

(2) 이 시기에 H는 불장난을 하다가 화재를 내고, 물건을 고장내고, 절도를 당하는 등 선의로 빌려준 공간을 함부로 이용함. 추가로 이에 대한 어떠한 사과나 보상도 없었음

(3) H와 1:1 대화를 하면서 오히려 적반하장의 태도를 보여, '지금 하고 있는 말 행동들이 객관적으로 사람들이 널리 이해할 수 있는 수준인지 생각하고 말해'라는 메시지와 함께 둘의 대화 내용 중 일부를 동기생 카톡 방에 공유

(4) H는 해당 사실을 다른 사람에게 알린 것에 대하여 고소를 함

결론: 명예훼손죄는 '사실'을 공유해도 처벌을 가능하게 하는 법으로, 악용하는 사람들에게는 자신의 잘못에 대해서 입막음을 하고 반대로 피해자를 범법자로 만드는 수단으로 활용되는 경우가 있음, (H도 잦은 고소를 경험했고, 동일한 행동을 보임) 위와 같은 경우는 행정력 낭비 및 사회 전체적으로 악영향을 끼쳐 일부 수정이 필요하다고 생각


전체글:
H라는 대학교 동기가 있었습니다. 저는 해외 취업을 하며 나가게 되고, H는 구직을 하며 고시원에서 지내고 있었습니다. H가 취업도 안되고 자살을 운운하던 어려운 시기에, 저는 도움을 주고자 저는 1년 이상 월세, 각종 공과금(전기세, 수도세, 가스비, TV, 인터넷 등)을 모두 내주며 H에게 주거 공간을 제공 하였습니다.

저도 당시 나이는 20대 중반으로 어려운 상황이었지만 친구를 도와주고 싶은 마음에 여러 선택지 중 이와 같은 행동을 하였습니다.

그런데 H는 제가 해외에 나가있는 동안 비상식적인 행동을 하였습니다. 제 물건을 본인 마음에 들지 않는 다고 마음대로 버리고, 각종 물건(전기 자전거, 세탁기, TV 등)을 고장 내고, 방에서 불장난을 하다가 바닥을 태우고, 집에 도둑맞아 제가 아끼던 물건을 잃게 하였습니다. H는 이에 대한 사과나 보상도 없었지만, 좋게 시작한 일인 만큼 그냥 '조심 좀 하지'하고 넘어갔습니다.

이후 다시 한국으로 돌아와 제가 거주하고 H는 나갔을 때, 집에 올 때마다 잊어버린 물건, 바닥에 불타있는 장판, 고장 난 물건을 보며 기분이 좋지 않았습니다. 더구나 H는 제 개인 연락은 잘되지 않으면서도, 졸업 동기 단체 채팅에서는 활발한 활동을 보이며 상반된 행동을 보였습니다.

그러던 중 2019년 2월, 저는 화가 난 나머지 H에게 1:1 메시지를 보냈습니다. 근데 H는 너무 뻔뻔한  적반하장의 말들을 하였습니다. 그래서 '지금 하고 있는 말 행동들이 객관적으로 사람들이 널리 이해할 수 있는 수준인지 생각하고 말해'라는 메시지와 함께 둘의 대화 내용 중 일부를 졸업 동기생 카톡 방에 공유 하였습니다.

그리고 다른 친구들이 중재를 해주는 과정에서, 그 자체가 너무 스트레스이기도 하고 그래도 친구였던 애를 마음속에 증오하는 것이 결국 자기한테도 상처가 되어 돌아온 다는 것을 깨닫고 다시 가슴에 묻고 지내왔습니다.

그러던 중 1년이 지나 2020년 3월, 회의 중에 경찰서로부터 전화를 받게 됩니다. H가 저를 동기생 단체 카톡에 공유했던 대화 공유로 명예훼손 고소를 했다고 합니다.

이번 사건으로 알게 되었지만, 한국에는 '사실'에 해당하는 내용을 다른 사람에게 공유해도 전과자가 되는 이상한 법이 있습니다. 명예훼손은 허위사실을 말할 때뿐만 아니라, 사실 자체를 다른 사람들에게 공유해도 전과자로 만들어 버리는 이상한 법입니다.

- 이하 나무위키 내용 중 발췌
명예훼손죄의 가장 큰 문제점은 위에서 언급했듯이 말 한번 잘못하면 다 걸린다는 것, 즉 형법의 가벌범위를 지나치게 확장한다는 점이다. 범죄 경력이 있는 사람의 실제 범죄 경력이나 과거의 악행들을 거론했다는 이유로 명예훼손으로 기소 당할 수도 있다는 것이다. 외국의 경우 해당 조항이 있는 경우에도 법리적, 윤리적 이유 등으로 해당 조항이 현재 생활 실정에 맞지 않아 사문화되거나 폐지하는 추세인 것에 반하여, 한국에서는 현재도 여전히 명예훼손을 실정법으로 엄격하게 처벌하고 있다.

-

특히나 H는 법을 악용해 고소한 경력을 다수 가지고 있는 것 같습니다. 아래와 같이 인터넷 커뮤니티에 자신의 고소 경험을 희화화하며, 전문가인냥 행동하는 모습을 볼 수 있습니다.

          H가 남긴 댓글(2019년 03월):
Q: 남자들은 뭐 좋아해?
A:  보통 고소장 좋아하지 않나요?? 받자마자 연락오고 말도 많던데

          H가 남긴 글(2019년 03월):
자영업이나 사업하는 사람은 딱히 벌금형 나오는거 안무서워함. 안좋게 흐르면 벌금 받게하고 소송준비해야할지 모름. 대신 백퍼 승소라서 직접 해도 할만함. 시간이 걸려서 글치 쫌생이이면 싸게합의 볼라그럴거고, 돈이면 다된다는 사람이면 아마 후하게 쳐줄지 모름. 다만 위에처럼 벌금받고 만다 하면 소송해야함


          H가 남긴 글(2019년 12월):
서류 바로바로 낸다는 조건하에 6~10개월 걸리든데, 전 모욕으로 고소해서 이새리들이 합의안하고 배째서, 벌금령 떨어진 뒤에 민사소송하고 민사소송 후에도 돈 잘 안갚길래 추심까지 한상황이라 1년 넘게 걸렸어요. 아직돈도 다 못받음 한 여자는 신불자라서 또 배째라는중


법은 다수의 상식이 통하는 사회를 만들어가는 장치로 알고 있습니다. 위와 같이 잘못한 사람이 오히려 떳떳하게, 은혜를 원수로 갚는 장치가 되어서는 안된다고 생각합니다.

위와 같은 법과 그 악용 사례가 많아지면 국가적인 행정력 낭비와 사회적 부작용을 불러오지 않을까요?
허위 사실에 대한 처벌은 엄격해야 하겠지만, 자신이 잘못한 사실에 조차도 입을 막아버리는 법이 과연 공공의 상식에 맞는 것인지 여쭙고 싶습니다.

이 글을 읽으시면서 무언가가 잘못되었다고 생각하신다면 동참해주십시오.",NaN,기타,2020-05-08,2020-06-07,naver
