number,progress,title,like,contents,answer,category,sday,eday,proponent
589163,청원종료,유치원 어린이집 특별활동 강사 수업 할 수 있게 해주세요.,141,"문화센터, 유치원, 어린이집 대상으로 강사를 파견하는 업체를 운영하고 있습니다.
휴교령, 휴원령이 내려지기 전부터 
각 시에서 강사를 외부인이라 하여 출입을 금하게 하여 3월도 아닌 
2월부터 수업을 못하여 어려움을 겪고 있습니다.
강사를 파견하는 저희와 같은 업체가 시마다 50여개 이상이 되고 그 속에 속한 강사들은 500명이상입니다.
전국에 얼마나 많은 사람들이 어려움에 처했겠습니까?
식당이나 타 자영업자들처럼 매출이 20% 30% 50% 줄은 것이 아니라 
저희는 갑자기 하루아침에 매출이 정말 0!!!!! %이며 강사들 또한 직장을 잃고 멈춰져 있습니다.
모든 수업재료 미리 준비하고 손해보며 쓰레기가 되어버리고 
보유한 물품 창고가 어마어마합니다.
많은 월세들... 또 준비하는 재료들 ... 유지하며 버텨 온 시간이 너무나 힙겹습니다.
개학을 하면서 또다시 준비하고 있는 시점에 하나둘 수업을 할 수 있도록 정상화 되려고 협의중인데...
정부에서 강사를 외부인이라 하여 출입을 막아버리는 공문이 내려오면 
지금껏 힘겹게 벼텨온 시간을 어떻게 하라는 겁니까?
강사를 외부인으로 지명하지 말아주세요. 
잡상인이 아니지 않습니까?
유치원 어린이집 교사들은 대중교통 이용하는 분들이  80%이상이고
저희 강사들은 자차가 없으면 일을 할 수 없습니다. 그래서 대중교통은 누구도 이용하지 않습니다.
또한 어린 아이들을 키우는 엄마로 살아가는 강사가 90%이상입니다.
얼마나 외출자제, 외부접촉을 가리며 살아가겠습니까?
여행다니고 식당에 사람 가득하고 
대중교통 타고 다니는 많은 사람들이 살아가는 지금!
지자체에서도 소비해야 경제가 살아난다고 하는 지금!
많은 강사들의 생계를 막아버리며 
저희의 출입을 금하는 것은 너무 합니다.
아이들의 안전 너무나 중요하고 가장 우선시 되어야 하는 것은 당연한 것입니다.
저희들 안전수칙, 사회적거리두기 열심히 최선을 다해 합니다!
아이들을 교육하는 사람들로서 무엇보다 누구보다 최선을 다합니다.
수업전 손소독, 마스크착용 수업, 열체크, 교구소독 증거자료 제시 등 
강한 안전수칙을 달아주시더라도 제발 아예 출입도 못하게 막지 말아 주세요.
공문이 내려와 버리면 저희는 정말 아무것도 할 수가 없으며 
더이상 버틸 수가 없고 너무나 많은 것을 잃습니다.
강사들중에는 여자이지만 집안에 아이들의 삶을 책임질 가장인 사람도 있습니다!
너무나 많은 회사와 강사들이 사각지대에 도움도 못받고 
무작정 기다리고 있습니다. 
매출 0% 무급무직이 된 강사파견 업체와 강사들을 제발 살려 주세요.
어린이집과 계약하고 몇년전부터 만나왔던 아이들의 선생님을 
외부인이라 칭하는 것은 너무합니다. 부디 도와 주세요.
부탁드립니다.",NaN,일자리,2020-05-25,2020-06-24,naver
589177,청원종료,코로나로 힘든 우리도 대힌민국 국민입니다.,1530,"안녕하세요  저는 코인노래방 운영중인  자영업자 입니다.
많은 자영업자들이  코로나로  힘들고  타격을 입고 있습니다 
저또한 그중 한명이며  또 이사업장으로  두어린 딸래미를 
키우며 생계를 유지하는 한사람입니다.  코로나바이러스 종식을 위해  2개월전부터  하루에도 수십번씩  나가는손님 방마다 
손껍질이 벗겨질정도로 소독을하고  명부작성을하며   미친듯이
청소를 하고있습니다.  어쩔땐 개인정보유출 아니냐며 
따져대는 손님들과 싸움까지 합니다
그렇게 미친듯이 노력하면서  적자를 감당하면서    유지하고 있습니다.  2주만 버티면 괜찮아지겟지..조금만 버티면 
괜찮아지겟지....  그렇게 스트레스로 인한  위장약을 먹어가며 밤마다 쓰라리고 아픈 손을 만져가며  살고있습니다.
하지만 코로나 종식을 막기위해  감당해야하는거라면 
우리가게 찾아오는 손님을위해   나를위해  또 우리가족을위해
기꺼이  이정도 고생쯤이야    하겠다는 마음으로 불만불평없이 열심히 했습니다.
하지만 정부와 언론은  코인노래방에서 코로나가 생긴거마냥 
방송을하고있고   국민들의 눈과 귀를 종용하고 있습니다.
애초에  해외유학생들 및 외국인들  막으면 끝날것을 막지않고 유입되는 인구들을 다받아준 정부는  아무죄가 없으십니까?   
자가격리된 사람들만 철저하게 관리해주셧다면 이렇게 
되었을까요??  
자가격리해야 하는사람들이   몰래 돌아다니고  확진자가 생기고  코로나가 끝나지 않고 있음에도...이모든것들이   코인노래방 피씨방 탓입니까??
정부지원금을 주시고부터  사람들은  그지원금 몇개월내로  쓰겟다고  길거리 술집   호프집 고기집 커피숍 음식점 등   줄을서서들 먹고있습니다. 마스크를 안쓰고 술잔에 짠하면서.. 메뉴1개시켜서 여럿이서 잘도 먹고있습니다
그가게들이  장담컨데  노래방 피씨방보다 소독을 잘할거라 생각드십니까??   음식을 다루는곳이라 함부로 소독을 할수없겟죠  그소독약은  상당히 인체에 해로워서  방역복을 입고 뿌려야할정도로  독하니까요  하지만 저희들은 
하루에도 몇번씩 소독약을 들고있기에   방역복도 입지않은채
소독약을 뿌리며 그약을 온전히 마시고 살고있습니다.
저희가 그렇게.노력하고 사는거  정부나 언론에서 아십니까? 
한번이라도 저희입장에대해 생각해보셧습니까?  
인천 코인노래방  2주동안 영업정지 다시키고  클럽들 2주 영업 정지 시키면  더이상 안늘어날거같습니까???   
정부지침에  영향을 받고  있지않는 업소들이 위험합니다.
영업정지를 시키실거면  특정 어디라고 지정하지마시고 
고기집 술집 커피숍  백화점  마트 할거없이  기간을 정해넣고  영업정지할것을 권고합니다  가 아니구...    확실하게   모두 영업정지 시키시는게 옳다고 생각듭니다 .
또 특정 지역말고   영업정지한다고  그어떤것도 보상해주시는것도 없으시면서  전부 다해주는거마냥 언론에서 
말하는데  기가차고  코가찹니다
지인들이 물어봅니다  
""  문닫으면 나라에서  다지원 해준다며""
도대체 누가 뭘지원받았습니까??   
노래방 피씨방 장사하시는 자영업자분들도  대한민국에서 사는  국민이고   한가정에  아버지이며    형제들입니다
우린 대한민국에서  버림받은 국민들입니까?? 
대책을 새워주시길 바랍니다.",NaN,문화/예술/체육/언론,2020-05-25,2020-06-24,naver
589179,청원종료,** 및 ** 등 자영업자 등쳐먹는 플랫폼 세무조사 요청요,182,"일명 ** 및 **등 자영업자 (기술직)
일 창출을 목적으로 수수료 를 일정 받고 영업하는 플랫폼을 고발합니다.
고객에겐 무료 견적이랍시고 업자들에게 일정 최대(5~10곳) 견적 참가를 유료로 하고 수수료를 챙겨갑니다 일이 성사가 안되도 참가업체 에겐 그대로 수수료 를 물리는 악행을 하고 있습니다 .
공정거래위원회 등 세무조사를 해주시고 자영업자를 등쳐먹는 이런 업체를 엄벌해 주시길 바랍니다.
상생을 목적으로 본인들은 1푼도 손해 안보고 자영업자 에겐 아무런 소득도 없이 입찰비용만 받아 챙기는 업자들에게 가이드를 제시 해 주시고 불공정한 부분에 꼭 엄벌을 할 수 있도록 제도적으로 보완해주세요

 [본 게시물의 일부 내용이 국민 청원 요건에 위배되어 관리자에 의해 수정되었습니다]",NaN,일자리,2020-05-25,2020-06-24,kakao
589226,청원종료,"코로나19 사태에 따른 가정학습(현장체험학습 일수 연장), 등교선택권을 보장해주세요",2089,"안녕하세요.

초등학교 1학년생의 학부모입니다.

**요약**
1. 각 지자체별로 상이한 현장체험학습 일수를 교육부 차원에서 통제하여 가정학습이 가능하도록 보장해주세요.
    * 코로나19 심각, 경계단계 시로 한정
2. 학원들에 대한 방역대책도 좀 더 면밀히 정해주고 현장에대한 점검을 강화해주세요.
3. 학교에서 코로나19가 퍼지게되면 학생뿐만이 아니라 가정의 경제를 책임지는 부모들도 감염 될 수 있고 이는 또 다른
     문제가 발생될 수 있으며, 이에 대한 방역대책을 강화해주세요.
4. 기저질환으로 인한 등교중지에 대한 출석인정 범위를 늘려주세요.
5. 따라서 가정학습이 잘 이루지고 있는지 확인 할 수 있는 수단(보고서 제출)을 강구하여 가정학습을 보장해주세요.

지난 주 고등학교 3학년 개학 이후 각 지역별로 확진자가 발생함에 따라서 등교금지 후 온라인 수업으로 전환사례들이
발생되고 있습니다. 코로나19 방역을 위해 정부차원의 강도높은 방역시스템이 작동하고 있음에도 불구하고 
현재 지역감염사례들이 지속적으로 나오는 상태입니다. 특히, 학교는 집단감염 발병 위험이 높은 고위험군입니다.

일선 학교선생님들과 각 시도 교육청 담당자들과의 오랜 통화에서도 교육부에서 지침이 명확하지 않고 국민들에게 발표 후
본인들이 알게되어 업무상의 혼란이 가중되고 있으며, 특히 학교 선생님들은 방역지침에 따른 학생 통제 지침 등을 만들고 
시행하고 관리 감독 및 학업에 신경을 써야하다보니 업무가 가중되고 이로 인해 업무 공백이 발생되고 있습니다.
교육부에서 매번 지침을 바꾸니 이에 일선 현장의 혼란은 더욱 가중되고 있는 것이 현실입니다.

또한, 학원들의 경우 학교보다도 방역지침이 지켜지지 않는 곳들이 보이며, 관리 또한 어려운 실정입니다.

그럼에도 불구하교 교육부 관계자는 민원관련 통화시 제대로된 답변 보다는 등교 후 학교의 방역을 통제할 수 있다라고 이야기하며 원론적인 이야기들만 하고 있습니다. 이에 관련하여 몇가지 사항에 대해 요청드립니다.

ㅇ코로나19 심각, 경계단계일 경우 현장체험학습을 사용하여 가정학습이 가능한 것으로 확인되었는데 내용이 지자체별로
    많이 상이합니다. 서울은 32일, 경기도는 20일, 대구는 59일 등으로 정해져 있는데 기준이 없습니다.
    제가 통화한 많은 담당자들은 어떤기준으로 이렇게 정했는지에 대한 근거를 제시하지 못했습니다.
    27일에 개학을 하는데 등교지침을 25일 11:00에 알게되었습니다. 매일등교를 한다고 합니다.
    경기도 기준 20일이면, 4주면 가정학습을 할 수 있는 일 수를 모두 사용하게됩니다.

    특히, 초등학교 저학년의 경우 가정에서 가정학습을 통해서 학교교육을 이어나갈 수 있습니다.
    EBS에서도 일단 1학기는 온라인학습이 가능하도록 방송이 편성되어 있으며, 추가적으로 가정에서 준비한 교육들을 
    할 수 있는 여건이 됩니다. 다만 맞벌이 가정, 개인적인 사정으로 가정학습이 어려운 가정도 있습니다. 때문에 이에대한
    선택권을 가정에게 보장을 해줘야 할 것입니다.

    학교에서 코로나19를 100% 방역한다는 것은 불가능한 것이고, 앞으로도 등교금지가 되는 학교는 온라인수업으로
    전환이되며,  EBS라는 대안이 있는 상태에서 학교의 정상운영이 쉽지 않으면 그만큼 가정에서도 책임을 자발적으로 
    지겠다고 하는 학부모들이 있는 것인데  목소리에 귀 기울여 가정학습이 가능하도록 해주시길 간절히 바랍니다.

    교육부에서는 지레 부작용에 대해서 말씀을 하시는데 공교육의 공백이 생길 수 있는 만큼 코로나19 감염으로 인한
    어린이 괴질, 가정의 경제적 손실 등에 대해서도 함께 따지고 헤아려 정책결정이 이루어져야 할 것입니다.

ㅇ학원들에 대한 방역을 더욱 철저히 하고 확인을 부탁합니다.
    학원의 경우 학교처럼 체계적일 수 없으며 방역여부에 대한 현장 확인이 적을 수밖에 없는 환경으로 원장 개인의 역량에
    따라서 방역의 온도차가 너무나 크게 나는 경우가 많습니다. 학원에서 방역이 무너지면 이는 분명 학교까지 이어지게되고
    집단 감염의 위험이 점점 커지게 되는점 확인을 부탁드립니다.

ㅇ학교에서 집단감염시 이는 각 가정으로의 감염 역시 막을 수 없기 때문에 이에 대한 대책이 필요합니다.
    각 가정에서는 실제 마스크를 끼고 생활하는 경우가 거의 없습니다. 아이가 걸리면 자영업, 직장을 다니는 경제적 주체인 
    부모들이 감염되고 이는 코로나19로 어려운 가정경제에 큰 타격을 줄 수 밖에 없는 것이 현실입니다.
    현재도 학원 강사를 통해 6차 감염자까지 나온 시점에서 준비되지 않은 학교의 개학은 국민으로 하여금 두려움을 줍니다.

ㅇ현재는 코로나19 확진 및 자가격리자, 해외여행력, 국내 집단발생과 역학적 연관성이 있는 경우, 발열 또는 호흡기 질환이 
    있는자 기저질환(천식, 호흡기질환 등)의 고위험군에 대해서 등교를 중지하고 출석을 인정해주고 있습니다.
    허나 피부질환(아토피) 등으로 열에 민감한 아이들의 경우 제한된 학교의 에어컨 가동 및 마스크 착용등으로 아토피로
    민감한 학생들의 경우 학업을 이어가는데 많은 문제가 발생할 수 있습니다. 이러한 부분에 있어서도 학부모들의 의견을 
    적극 반영하여 등교중지의 범위를 확대할 필요성이 있다고 보여집니다.

ㅇ교외체험학습의 경우 계획서 작성 및 보고서 작성등으로 학교장의 확인을 득해야만 인정받고 있습니다.
    코로나19로 인한 가정학습역시 주단위 계획서 작성, 보고서를 작성하여 학교에 제출, 확인을 받을 수 있도록 하고 
    추가적인 공공교육의 공백이 발생되지 안도록 통제대책을 마련하면 가정교육과 학교교육이 병행되어 좀 더 유연하고 
    코로나19에 대한 대응이 되지 않을까합니다.

전 세계가 코로나19로 고통받고 방역에 있어서 그 어떠한 나라들 보다도 성공적으로 방역에 대응하고 있는 우리나라가
자랑스럽습니다.

우리 아이들도 각각의 가정환경에 맞게 학습이 이루어질 수 있도록 의견에 귀 기울여주시면 감사하겠습니다.",NaN,육아/교육,2020-05-25,2020-06-24,naver
589231,청원종료,이래서 미용실 운영할 수 있겠습니까?,269,"저는 20년 가까이 미용실을 운영하고 있는 사람입니다.
요즘 젊은이들이 노동청에 사업주를 고발해서 한방에 거액을 뜯어내는 것이 유행처럼 번지고 있습니다.
3년을 교육해주고 편히 일하게 해준 댓가가 이렇다니  억울할 따름입니다.
너무 근로자편만 드는 법 앞에서 정말 무너져버립니다.
일의 개요는 3년을 일한 직원이 퇴직금(중간정산)과 급여를 받는 동시에 무단퇴사했습니다.
그 뒤로 같이 1년간 일한 남자직원이 마찬가지로 퇴직금과 급여일 다음날 무단퇴사하였고
또 그뒤로 다들 나가도 본인은 열심히 하겠다던 3년 일한 직원이 퇴직금과 급여일 다음날 무단퇴사했습니다.
공교롭게도 모두 3월이 급여일과 퇴직금중간정산일이었습니다.
그리고 이중 3년을 일한 직원 2명이 노동청에 고발을 하였고 수천만원대의 급여를 요구하고 있습니다.
저희 미용실은 다른 브랜드 미용실과 비교하여 급여를 항상 10만원씩 더 주었던 미용실이었고
본인들도 그렇게 인정하면서 3년이란 세월이 흘렀겠죠~~~
하지만 미용의 특성상 일을 배우면서 먹고 살아가는 기술을 가르쳐주니 타업종 보다는 급여가 작다는 것은 인정하고
또 근로자들도 그렇게 인정하고 들어와서 일을 합니다. 하지만 예전에 비해서는 급여가 엄청 올라간것은 사실입니다.
이렇게 가족처럼 지내면서 기술까지 정말 잘 가르쳐줬는데....
심지어 본인의 어머니와 이모가 분당에서 미용실을 운영하고 있고 또 다른 아이 역시 어머니가 피부미용실을 운영하고 있습니다. 다들 미용계통에서 일하시는 분들이라 더욱 믿었던 것도 있습니다.
그런데 그렇게 가르쳐준것은 법 앞에서는 무용지물이었습니다.
삼성이라는 큰 회사의 기준과 저희 소상공인 특히 기술을 가르쳐주는 미용의 기준이 똑같다고 합니다.
참 어이가 없는 근로복지법입니다. 그렇다면 어느 누가 스텝을 채용해서 일을 시키겠습니까?
예전부터 계속 민원을 넣고 있지만 지금 실현이 안되고 있는 미용인들을 위한 근로법...
이제 정해져야합니다. 많은 미용업을 하시는 소상공 자영업분들 이게는 우리가 힘을 합쳐야 합니다.
펌 와인딩 조차 못하는 스텝 
와인딩하는 스텝
볼륨매직까지 하는 스텝 
컷트치는 인턴
단계별로 급여를 책정해야하며
평생 먹고 살 수 있는 기술을 가르쳐주는 것에 대한 공증부분도 확실히 있어야합니다.",NaN,행정,2020-05-26,2020-06-25,naver
