number,progress,title,like,contents,answer,category,sday,eday,proponent
589494,청원종료,갑질하는건물주 도와주세요,324,"안녕하세요.
저는 안산시 **동에서 작은 닭발집을 운영하고 있는 자영업자입니다.
저희 건물주가 얼마나 악랄하고.. 잔인한지..

제가 코로나 여파로 가게 장사가 어려워지면서, 가게를 급매로 내놓았습니다.
그러던 중 저희 매장에서 치킨집을 하고 싶다는 분이 계셔서 매장을 넘기려고 하는데..
제가 건물주와 통화를 하고, 치킨집을 주어도 되냐고 물으니 그건 안된다고 하네요..
저도 음식점을 운영했고, 새로 오시는 분도 음식점인데 무조건 안된다고 말하는 이유를 알 수 없었습니다.
건물주는 치킨집이 들어오면 하수구가 막혀서 치킨집 세를 줄 수 없다는 말이었습니다.

그런데 건물주가 임대하고 있는 주소지 1층에는 총 3곳이 현재 임대중이며,
공인중개사, 저희닭발집, 옆 김밥집 입니다.
총 3곳중에서 음식점을 임대하고 있는 건물주가 새로운 치킨집은 계약이 어렵다고 하니,
너무 어처구니가 없는 상황입니다.
건물주가 말하는 하수관이 자주 막히니, 하수관을 새로 들어오는 임차인과 제가 새롭게 배관설치를 해주기로하고
계약서를 써달라고 하니, 이 무슨 경우인가요..? 
저희는 매출이 점점 감소하고 있는 상황에서 제 사비로 50만원이상 들지 않으면 설치를 해주고 나가려고 했는데,
이번에는 또.. 앞으로 하수배관을 안뺀다고 계약서를 못 써준다고 하시네요..
지금 저에게 큰 공사를 요청하실 계획이신가봅니다. 제 기준에서는 그렇게 생각을 할 수 밖에 없는 상황입니다.

아니.. 20년이 넘은 노후된 건물에 하수배관을 처음부터 다시 공사하라는 식입니다.
그게 제가 해야 하는 공사인가요? 건물주가 노후된 건물의 보완을 하셔야 하는 것을 왜 저에게 떠넘기는지 알 수 없습니다.
그리고 동일한 음식점에서 다른 음식점으로 계약을 하낟는데 왜 못하게 하시는지 알 수 없습니다.
제가 요청하는 부분에 응하지 않자 건물주는 계약서를 못 써준다고 으름장을 놓고 있는 상황입니다.

그리고 또 계약당시 이 가게는 빈 공실이었으며, 제가 다 손수 가게를 꾸미고 들어왔습니다.
그런데도 불구하고 건물주는 저에게 바닥권리금이라는 것을 요구하며 700만원의 바닥권리금도 챙겨가셨습니다.
또한 제가 워세를 1개월이상 연체시 가산금 7%를 부과한다고 계약서에 특약사항을 달았습니다.

정말 지금처럼 힘든시기에 저희같이 돈없는 사람은 죽으라고 하는 갑질..
건물주좀 제발 응징해주세요..
제가 어떻게 해야할 지 몰라 국민신문고에 문의드립니다.
제가 지금 법적으로 건물주 동의없이는 계약을 할 수 없는 것이지요?
그렇다면 제가 할 수 있는건.. 무엇인가요..?
제발 도와주세요..

 [본 게시물의 일부 내용이 국민 청원 요건에 위배되어 관리자에 의해 수정되었습니다]",NaN,기타,2020-06-05,2020-07-05,naver
589532,청원종료,사업부도와 국세행정,116,"안녕 하세요. 격무에 노고가 많으십니다.
저는 1951년  8월 15일생 최**(******-1******) 라고 합니다.
현 거주지는 경기도 포천시 산내림 **길**에 거주 중 이며, 본인은 1975년 특전 사령부 3년만기 전역자 입니다.
군 전역 후 영업용 택시와 시내버스등 운수업에 종사와 1980년 초부터 **건설 입사 5년째 근무 후 1985년 6월
**걸설 사직 후 자영업 차량행상과 식료품가게와 각종 요식업 식자재 납품 등으로 마포구와 용산구에서 슈퍼마켓과 중식집을 (1990년) 운영 하며 정착을 하여 자리를 잡아 운영 하던 중 1991년부터 저의 친목계원 이었던 지인(5인)들의 부실회사(종합주류 도매업) 경영에 참여토록 집요한 권유로 3년여 거절 해 오던(1990년 초) 종합주류 대표이사로 취임하게 되었습니다. 2011년 말까지 종합주류 대표이사로 재직 운영 중 대기업의 갑질과 횡포로 인한 거래처 침탈로 인해 사업포기 2011년말 부도를 내기에 이르러 현재에 도달 했는바 부도시기 국세금융권 부채 등으로
모든 부동산 및 재산을 경매 후 정리하게 되었습니다. 그 후 본인은 신불자 신분이 되었습니다.
다름이 아니오라. 제산경매 매각은 감수 하겠습니다. 하지만 제 아내가 어떻게든 살아 보겠다고 동네에서 조그마한 분식집을 소자본(대여금)으로 운영 하던 중 본인이 운영하던 회사에 아내의 허락없이 이사도 등재를 했던 것이 문제가 되어 법인 2차 채무자가 되었던 것 입니다. 2차 채무자라는 이유로 아내가 운영하던 분식집 카드 단말기와 계좌에 압류를 하여 분식집 마저 못하게 되어 아내와 저의 관계는 악화되어 같이 살던 본가에서 나와 본인 혼자 경기 포천시(현 거주지)에 거처를 옮겨 기거 중 입니다.
제 아내 역시 2차 채무자라는 명분으로 하루아침에 신불자가 되었습니다.
저 역시 아내에게 면목이 없어 면식을 못한 채 말년을 살아가야 하는 실정 입니다..
여기 까지는 본인의 신세 한탄 이었습니다.
본인은 진정코 바라건데 그래도 70평생을 살아오면서 중년까지는 열심히 살았고, 나름 사회에 한때는 성실 납세자로 기여 하였다고 자부 합니다.
1989년 주택은행에 청약저축(3,000,000)에 가입 할 당시에 남매를 가진 가장으로서 자식에세 집한 채 마련 해 줄 원대한 꿈을 가지고 청약저축에 가입을 했던 것 입니다. 그런데 몇일 전(2020년 4월 18일) 통장 정리차 은행에 방문 하였더니 국세청에서 강제추심으로 청약저축이 해약 되었다는 청천벽력과 같은 말을 듣고 너무나 기가 막히고 세상이 깜깜 했습니다. 다른 부동산과 모든 재산을 몽땅 경매 몰수 하였어도 감수 했습니다. 
그러나 군전역 후 무일푼으로 사회에 참여 갖은 피나는 노력을  영위 하면서 장차 자식을 위해 원대한 희망과 꿈으로 가입했던 청약저축인데 그것도 30여년 동안 꿈을 안고 기대했던 꿈마저 짓밟는 국세 행정이 진정 옳은 것 인지 개탄을 하면서 이 글을 올립니다.
본인의 경영미숙 이었던 타인에 의해서 잘못 되었던 애초에 본인이 선택한 길이기에 후회든 누구의 원망도 하지 않겠습니다. 법인체 대표이사를 지냈던 신분이라 실업수당도 해당이 되지 않고. 고령으로 인한 취업도 사실상 어렵고
살아갈 길이 막막한 실정 입니다.
향후 국세행정에 저와 같은 사례가 나오지 않도록 선처를 바라오며 그래도 한때는 미약하나마 사회 발전에 기여 하였기에 말년은 사외의 보장을 받을 수 있기를 기원 하며 이 글을 마칩니다.


2020년 05월 20일 
진정인: 최 **

 [본 게시물의 일부 내용이 국민 청원 요건에 위배되어 관리자에 의해 수정되었습니다]",NaN,행정,2020-06-08,2020-07-08,naver
589537,청원종료,1년 미만 근로자에게 퇴직금 지급하라는 법 철회 요구합니다.,11468,"저는 편의점을 운영하고 있는 자영업자입니다.
최근 국회에 민주당 이수진 의원님께서 1년 미만 근무자에게 퇴직금을 지금하자라는 법안을 국회에 입법하셨다는 기사를 접하고 이렇게 글을 올립니다.
먼저 묻습니다.
국회의원님들은 자영업에 대해서 얼마나 알고 계십니까?
그럼 자영업을 해보신 적이 있으십니까?
아마도 없으실겁니다.
선거철만 되면 시장에 장사하는 상인 만나서 악수하며 사진 한번 찍으시는게 전부이실겁니다.
자영업자들의 고충을 알기나 아십니까?
요즘 코로나19로 인해 매출이 90% 이상 떨어져 그나마 있던 직원들마저 내보내고 있고 
언제 좋아질지도 모르는 기약없는 경제상황을 지켜보며 슬퍼하고 있을 자영업자들의 마음을 헤아려주셨음 합니다.
만약 이 법을 통과시키시면 자영업을 할수가 없습니다.
지금도 높은 최저시급에 우리나라랑 터키만 있다는 주휴수당만 하더라도 이미 1년 미만 아르바이트생들을 위한 혜택은 충분하다고 생각합니다.
아 맞다 
요즘은 1개월만 일해도 4대보험 넣으라고 통지서 보내는데 이런 법은 저희같이 하루하루 벌어 먹고 사는 자영업자들에게는 정말 악법입니다.
1개월만 일하고 그만두는 아르바이트생에게도  퇴직금을 지급하라고요?
대기업이나 중소기업도 안하는 거를 왜 자영업자들이 해야합니까?
이 법은 정말 자영업자들을 두번 세번 죽이는 겁니다.
자영업자들을 위하신다면 이 법 철회하십시오
이 법 발의하신 국회의원님은 의원직 내려놓으시고 저희처럼 자영업 한번 해보십시오
자영업이 얼마나 힘들고 더러운지 한번 해보시라구요!!!!",NaN,일자리,2020-06-08,2020-07-08,naver
589568,청원종료,갑물주의 위대 함,249,"안녕하십니까

저는 10여년 동안 서울시내에서 치킨 집을 운영한 소상공인 자영업자 입니다. 

저는 이모부가 운영하시던 가게를 권리금 1억에 인수 받아 어머니와 함께 운영하던 중 3년이 조금 넘은 시점 건물이 다른 사람에게 매매되어 새로 온 집주인 최** 과 계약서상 (13년 09월01일 자로) 임대차 계약을 체결하게 되었습니다

이 과정에서 장사를 유지하는 조건으로 금전(8천 만원) 을 요구하며 정신적으로 참기 힘든 압박과 모멸감을 받았습니다

어느날 관리인(이** 씨)이 찾아와 새로운 건물주가 면담을 요구한다며 사무실로 불렀고. 그 곳에서 명도 소송에 대해서 언급했습니다. 계약기간도 1년 정도 시간이 남았고 보통은 계약서만 다시 작성하거나 그냥 남은 기간 동안 이어가는 것이 일반적인 사례였기에 어머니와 저는 뜬금없는 면담의도를 전혀 알지 못했습니다. 

전 건물주는 자기 영향력을 과시하고 압박하며, 명도 소송에 대해 이야기하며 판결이 진행되면 집달리 변호사를 시켜 깡패들이 찾아 와 안나가 곤 못 버틴다. 재판도 돈으로 하는거고 우리가 이기면 니들이 우리 변호사등 일체 비용을 부담 해야 된다고 하며 본인은 재판도 많이 해봤다 이런 건 일도 아니다 다 돈으로 하는거다 하며 자기말에 따르라며 호통을 치며 심리적 압박을 해왔습니다. 

저희는 약자였기에 싫은 소리 한마디 못했고 모든 걸 다 잃고 나갈순 없었기에 비참하지만 녹녹치 못한 집안 사정등을 이야기하며 제발 장사만 할 수 있게 해달라고 사정하듯 하였습니다.
처음 당해보는 건물주의 갑질은 충격 그 이상이였습니다.

며칠이 지나고 건물주가 원하는 게 돈이었다는 사실을 알게 되었고 
장사를 유지하는 조건으로 1억이 넘는 터무니 없는 금액을 요구 하였습니다 저희는 어려운 집안 사정등을 이야기하며 빌다시피하여 8천이란 금액으로 조정을 받았으나 삥뜯기듯 돈을 주며 고마워 해야하는 너무 어처구니 없고 황당한 상황이 되어버렸고 이것이 끝이 아닌 피박의 새로운 시작이었습니다

종전 160만원이던 가게세는 270만원으로 인상을 요구하였고 최초 
계약기간(2년) 이후 부터는 1년 단위로 계약하며 기간이 끝나기가 무섭게 찾아 와 터무니없는 금액을 제시하며 압박하다 을에 입장인 저희가 다시 사정하듯 부탁하면 너희 사정이 그렇다고 하니 30만원만 올리겠다고 인심쓰듯 하는 건물주의 치졸하고 얄미운 모습에 속이 썩어들어가듯 한 세월이 너무 비참하고 원통합니다.

처음 인수할 당시에도 빚을 지고 인수했고, 또 다시 새로 온 건물주의 욕심과 배를 채워주기 위해 빛을지게 되고 괴로움 과 고난의 연속은 끝이 없는 듯 하였습니다

이런 부당함에도 이 가게를 놓지 못한 이유는 이모부 때 부터 대략 15년을 넘게 장사해온 터라 많은 단골을 확보한 곳이었고 3시 출근하여 익일 7시까지 하루 16시간을 넘게 피나는 노력으로 지켜온 일터입니다 

설령 다른곳으로 옮긴다 하더라도 많은 돈이 필요했고 잘 된다는 보장도 없었기에 억울하지만 저희 입장에서는 선택의 여지가 없었습니다.  

그런데 사건의 발단은 전 건물주 (최 **씨는) 저희들에게 8천만원이란 돈을 부당하게 받고 건물을 다른 사람에게 넘긴것이였습니다. 

새로온 임대인의 관리인(20년 03월19일 방문)분을 통해 건물 소유주가 바꼈다는 일방적인 통보를 받았습니다. 

저는 30대 청춘을 받쳐 좁디좁은 가게에서 새벽 잠 설쳐가며 어머니와 쉬지도 잘 먹지도 않고 열심히 살았습니다. 그런데 결과적으로  고생해서 모은 수고는 결국 건물주의 뱃속으로 그대로 들어간 상황입니다. 누구를 위해서 무엇 때문에 자지도 쉬지도 않고 일했을까?를 생각하면 가슴에 피멍이 드는 것 같습니다. 

또한 본 건물주는 자신의 가족들의 이름을 이용하여 부동산을 취득하고 그곳을 임대하는 과정에 저와 비슷한 방법으로 금전을 착취하여 재산을 늘리고 있다는 사실을 알게 되었습니다

몇 달동안 잠도 못자고 괴로움에 시달리다 또 다른 피해자가 발생
되는것이라도 막아보자는 심정으로 청원글을 올려봅니다

부디 이글을 읽은 기자님들 혹은 자영업자들의 고충에 귀를 기울여주시는 분들게 간곡히 부탁드립니다.

더 이상 억울하게 고통 받는 사람이 발생되지 않게 선례를 남기고자 합니다. 염치없지만 작은 희망의 불씨라도 찾을 수 있도록 간청 드립니다.",NaN,기타,2020-06-09,2020-07-09,kakao
589712,청원종료,"비상시국인 대한민국, 2021년 최저임금 동결을 요청합니다.",991,"안녕하세요.
식당을 운영하며 가족의 생계를 책임지고 있는 평범한 가장입니다.

2020년 코로나 사태로 대한민국 뿐 아니라 전세계가 비상재난사태인
지금 현재,  2021년 최저임금 심의가 이루어 지고 있습니다.
국내외 정세와 현재 대한민국 자영업자와 노동자가 처한 상황을 고려했을 때 
최저임금은 동결되는 것이 최선이라는 생각에 이렇게 청원을 올립니다.

물론,
우리 사회의 최취약계층인 최저임금 노동자의 처우개선은 무엇보다 중요한 가치이지만
지금 우리사회가 직면하고 있는 다음과 같은 상황들을 두루 고려하여
부디 현명한 결정을 내려주시길 바랍니다.

먼저,
지금 우리나라는 수년간의 경기침체의 늪에 빠져있습니다.
거기에 2018년~2019년에 거친 급격한 최저임금 인상으로 인해 
현재 자영업자들이 느끼는 인건비 부담은 심각한 수준입니다. 
최저임금 노동자 고용주의 대부분은 그들 조차 취약계층 중 하나인
소상공인들입니다. 그들의 인건비 지불능력은 한계치에 다다랐고
실제로 최저임금의 급격한 인상 이후 수많은 일자리들이 사라졌습니다.
그로 인해 최저임금 노동자들이 받는 고통은 더 심해졌고
경영계와 노동계 모두 그 폐해를 인정하여 2020년 최저임금은 소폭 인상에 그쳤습니다.

엎친데 덮친격으로,
2020년 코로나19 사태로 인해 소비자들의 소비심리는 얼어붙었고 대한민국 경제는 멈춰서버렸습니다.
자영업자들의 영업환경은 한치 앞도 안보이는 나락으로 떨어져 버렸고 그나마 고용을 이어오던 업체들도
근로일 축소, 근로시간 쪼개기 등으로 생존을 위한 버티기에 들어갔습니다.
그들이 살아야 일자리도 있는 것이므로 그들의 긴축을 탓할 순 없습니다.
이런 상황에서 최저임금이 또 다시 인상이 된다면,
근근히 버티고 있는 자영업자들의 폐업이 줄을 잇고 일자리는 더 없어지지 않을까 걱정이 됩니다.  

만약,
지금 최저임금이 현재의 대한민국 물가에 견주어 봤을때 최저생활을 보장할수 없다면,  
사용자의 지불능력 여부와 관계없이 인상이 되어야 마땅할 것입니다.
허나, 물가상승률을 크게 상회하는 지난 2개년의 인상으로 
지금수준으로 최저임금이 동결이 된다하더라도 최저수준의 생활을 보장 못할 수준은 아니라 생각합니다. .
또한 사회, 경제적으로 받아들일 준비가 되지 못한 최저임금 인상은 
일자리 감소, 쪼개기 일자리 등으로 인해 최저임금 노동자의 실질적인 소득상승으로 이어지지 않습니다.
무리한 최저임금 인상은 고용인과 피고용인 모두에게 독이 되는 인상이 될 수 있습니다.

최저임금 심의는
흔히 을과 을의 싸움이라고들 합니다.
최저임금이 올라서는 안된다고 말씀드리는 것은 아닙니다.
최저임금은 꾸준히 올라서 사회적 격차와 불평등을 해소해야 합니다
다만, 지금이 오르기에 시의적절한지는 생각해봐달라는 것입니다.  

부디 
이번 비상시국에는 최저임금 동결이라는 특단의 조치로,
계속되는 경기침체와 코로나 사태로 몸살을 앓고 있는 대한민국 경제에
쉬어갈 시간을, 다시 2보 전진할수 있는 에너지를 충전할 여유를 주시기 바랍니다.",NaN,경제민주화,2020-06-16,2020-07-16,naver
589736,청원종료,이태원은 슈퍼 전파자가 아니라 최대 피해자입니다. 도와주세요.,2343,"저는 이태원을 지역구로 의정활동을 하고 있는 시의원입니다. 

주민의 대표로서 서울시와 언론인, 서울시민들께 다양한 방법으로 이태원이 겪고 있는 어려움을 알려 왔습니다. 

서울시도 여러 지원 방안을 고민하고 있고 이태원을 응원하기 위해 일부러 찾아주시는 고마운 시민들도 늘고 있지만 아직 역부족입니다.  

지난 8일 보도에 의하면 이태원역의 이용객 수가 코로나 이전에 비해 주중 64%, 주말 77% 급감했다고 합니다. 5월 초 황금연휴 이후 한 달 동안 회복된 수치가 3분의 1토막, 4분의 1토막입니다. 

지하철만이 아닙니다. 택시를 타고 이태원을 가자고 하면 기사님이 불안해하는 것이 느껴집니다. 이태원에 가도 되냐고 되묻는 경우도 있습니다. 

그뿐만이 아닙니다. 클럽 발 전파의 역학조사가 어려워 통신사와 카드사의 휴대전화와 카드 사용내역까지 동원되면서 이태원 방문객 전체가 요주의 인물이 되기도 했습니다. 

이태원 상인과 주민 중 상당수가 지인으로부터 이태원에 다녀온 이후 검진 안내 문자를 받았다는 하소연을 들어야 했습니다. 

양복점 사장님은 이태원에 가는 것이 꺼려진다며 예약을 취소한 손님에게 치수를 재러 가겠다고 했더니 이태원 사람은 우리 회사에 들어올 수 없다는 얘기를 들었다고 합니다. 

그러다보니 경조사로 결혼식장이나 장례식장을 방문한 주민들은 출입자 명부에 주소를 거짓으로 쓰기도 했다고 합니다. 

이처럼 물류센터와 방문판매업체 발 집단감염 발생 전까지 5월 한달 내내 국민들은 불안하고 싸늘한 눈초리로 이태원을 바라봤습니다. 

이태원은 신천지와 동일하게 슈퍼 전파자로 인식되었습니다. 집단 감염의 발원지라는 굴레를 쓴 채 유령의 거리가 되었고 상인과 주민은 접촉해서는 안 될 보균자 취급을 받았습니다.

클럽 발 집단감염이 이태원의 문제입니까? 왜 이태원 발 감염입니까? 

이태원은 확진자들이 다녀간 이동 경로에 불과한 것 아닙니까. 2,500개소 자영업을 운영하는 상인들과 1만6천명의 주민들에게 무슨 죄가 있습니까. 오히려 가장 큰 피해자 아닌가요? 

이태원의 상인들은 손님은커녕 사람 구경조차 못한 채 5월 한달을 보냈습니다. 정부 긴급재난지원금이 지급된 이후 일부 상권은 설, 추석과 마찬가지의 특수를 누린다는 보도도 이태원 상인들의 상대적 박탈감만 키울 뿐이었습니다. 

문을 연 가게보다 문을 닫은 가게가 더 많습니다. 이태원에 등록된 노점상이 51개인데 요즘은 하나도 보기 어렵습니다. 

오늘 문을 안 열면 영원히 못 열 것 같고, 손님이 없다고 불을 끄면 상권이 영원히 죽어버릴 것 같아 문을 열고 불을 켜지만 개점휴업일 뿐입니다. 

건물주는 임대료를 반으로 내리고 종업원들은 월급의 70%만 받으면서 버티고 있습니다. 상생을 위한 노력이지만 매출이 아예 없으니 서로에게 미안할 따름입니다. 

감염자가 다녀간 클럽은 진작 폐쇄됐고 이태원 상인과 주민들 모두 진단검사를 완료했습니다. 양성 판정은 한 명도 없습니다. 

오늘도 이태원 상인과 주민들은 때 이른 폭염 속에 방역복을 입고 클린 이태원, 다시 찾는 이태원을 위해 구슬땀을 흘리고 있습니다. 

하지만 언제까지 버틸 수 있을지는 어느 누구도 장담하지 못합니다. 아무 죄도 없이 속수무책으로 폐업 위기를 맞고 있는 상인들은 정부의 특별재난지역 선포를 요구하기도 합니다. 

이태원 발 감염이라는 억울한 누명을 썼지만 정작 확진자가 한 명도 없습니다. 그래서 특별재난지역 지정 주장의 설득력이 떨어지는 아이러니한 상황입니다. 

하지만 상인들이 겪고 있는 어려움은 특별재난지역에 못지않습니다. 특별재난지역에 준하는 지원을 검토해주시기 바랍니다.",NaN,기타,2020-06-16,2020-07-16,facebook
