number,progress,title,like,contents,answer,category,sday,eday,proponent
588794,청원종료,"1종업소관련 생계비,월세 지원부탁드립니다.",1417,"코로나19 여파로 인하여 많은 분들이 피해를 보고 있습니다.
시국이 시국이니 만큼 모든 소상공인 분들과 모든 자영업자 분들께서도 다들 힘이 드실껄 압니다.
불과 몇주전만해도 2주간 유흥업소 집합 금지명령이 내려와 더많은 자영업자 분들이 피해를 보셨지요.
이번 이태원클럽 사건으로인하여 다시금 확진자가 발생하고 있는 상황으로 인하여  다시 모든 국민이 코로나19여파의 불안을 느껴야하는 상황이 만들어졌습니다.
제가 청원을 올리게된 이유는 유흥시설 집합금지 명령으로 인한 1종유흥관련 종사자들에 대해서도 생계 지원이나 월세 지원을 바라기 때문입니다.
1종 업소도 나라의 허가를받고 장사를하는 가게입니다.
소위 말하는 헌팅포차나 일반 2종 일반 술집들도 사람들이 모여 여흥을 즐기는 가게입니다.
그렇게 따지자면 그런곳에 방역만으로 끝 내야 하는것이 아니고 전국에 있는 모든 술집과 음식점들 사람이 모일수 있는 곳도 같이 폐쇄해야 안전한거 아닙니까.
저의 청원에 대한 요지는 그 만큼 다시금 나라가,전국민이 힘든 상황에있어 최악을 대비하고자 업소정지 명령이 떨어진것에 대해서는 수긍을합니다.
하지만 대한민국에 1종 유흥관련 종사자들이 몇명인지는 아십니까? 그사람이 한가정에 가장 일 수도있고,자식 일 수도 있습니다. 
무작정 금지명령만 내릴께아니고 그뒤에 오는 피해에 대한 책임은 한순간 실업자가 되어버린 사람들이 감당하기엔 너무 크다고 생각합니다. 
묻고싶습니다 그 분들은 대한민국 국민이 아닌겁니까? 왜 배제를 하는지 저는 그게의문입니다.
착한건물주 임대료 낮추기 그런글을 많이보았습니다.
하지만 모든건물주 분들이 그렇게 임대인들에게있어 아량을 배푸시는건 아닙니다.
처음 집합 금지명령이 내려왔을때도 많은 관련자분들이 돈을 빌리거나,대출까지 받아가며 월세를 냈다고들 합니다. 
유흥에대한  인식이 좋지않은건 알지만 그분들에게 있어선 일이고 또 생계가 관련 되어 있습니다.
무슨 대책을 마련해 주셨으면 좋겠습니다.
언젠 끝날지도 모르는 코로나19 여파를 어떻게 저희 서민들이 나라의 도움도 받지 못하고 언제까지 스스로 버티라는겁니까?
한 순간 실업자가 되어버리고 당장 생계가 막막합니다.
하루빨리 좋은방안을 만들어 주시길 부탁드립니다!",NaN,일자리,2020-05-12,2020-06-11,naver
588829,청원종료,코로나19로 인한 고등학교 학비 감면  해주세요,4909,"이제 고등학교 1학년이 된 아이가 있는 학부모입니다. 
코로나19로인해  모두가  힘든건  다  알고있습니다. 학교 선생님도 힘드시겠죠. 그런데  학부모들은 더 힘듭니다.고등학생이 되어 온라인 개학이 된지 한달  밖에  되지 않았는데  6,7,8월 교육비를 내라고 공지가 내려왔습니다.   아이가 학교도 가지않았는데  3월은 하물며  온라인 수업도 없었습니다. 이 교육비를 다 내는것이  타당한가요.  전액  면제른  해달라는것이아닙니다. 적어도 지금 실직하거나, 자영업에 타격을 입은 학부모님들도 있을건데 이렇게  고지식하게  교육비를  다 받아가는것이 맞는걸까요.
더욱이 2학년 3학년은 무상인데  좀  더  당길수는 없는걸까요.  고1학생은 나라에서 혜택을 거의 못받은 2004년생입니다. 어린이집 유치원 다닐 나이에는 나라에서  지원도 못받았습니다. 이렇게   작은 금액도 아닌 40~50만원 (공립기준)교육비를  받아야하나요? 3월은그럼 환불해주시나요? 이것은 진짜 부당합니다.교육비 감면  또는 면제를 원합니다",NaN,육아/교육,2020-05-12,2020-06-11,naver
588835,청원종료,"코로나19로 가장 많이 힘들어진 사업장임차인을 위해, 벌금 & 구상권 공동책임 및 손해배분 등으로 임대인과 임차인이 코로나19 방역문제에 공동으로 책임지는 정책을 제안합니다.",320,"안녕하십니까 저는 서울에서 지금의 일을 시작한 이후 가장 힘든 나날을 보내고 있는 자영업자 중 한명입니다.

1. 코로나19로 많은 자영업자와 소상공인들이 힘든 상황을 보내고 있습니다. 

매출감소.월세납부. 방역수칙에 대한 잡무증가. 거기에 확진자라도 다녀가면 장기간 휴업, 확진자가 다녀갔다는 이유로 매출 회복이 안되는 상황. 그리고 지금 또 다시 행정명령으로 많은 다중이용업소가 다시 휴업을 하거나 일반사업장마저도 위험을 무릅쓰고 영업을 힘들게 해야 하는 상황이 3개월째 이어지고 있습니다. 

거기에 방역관리행정명령 대상에 있는 많은 소상공인들은. 본인 매장에서 확진자가 발생하면  업주에게 내려지는 구상권 및 벌금도 감당해야 합니다. 

2. 그러나 한 건물의 공용구간의 방역 관리의무는 임대인에게 있고. 그 건물 전체의 방역의무는 임대인에게 가장 큰 책임이 있음은 누가봐도 확실합니다.

만약 그 건물에서 확진자가 발생할 경우, 해당 건물방역을 제대로 관리하지 않은 임대인에게도 분명 책임이 있음에도 불구하고. 임대인은 전혀 책임을 지지 않고. 임차인의 마음을 헤아리기는 커녕 월세까지 다 받는 상황이 왕왕 일어나고 있어, 소상공인들의 마음과 주머니를 더더욱 힘들게 합니다. 거기다 임대인은 임차인이 언제 가게를 비울지 몰라 전전긍긍하고 있습니다.

3. 이에 
  1) 임차인에게만 전적으로 부과되는 구상권 청구금액 및 벌금의 반을 임대인 및 임대법인에게 함께 부과해. 업주와 건물주가 힘을 합쳐 방역에 신경쓰도록 해주세요. 

 2) 벌금의 반을 부과하는 것이 절차상 힘들다면, 그 방역의 책임을 다하지 않은 임대인 및 임대법인에게도 ""임차인의 영업을 막지 못한 책임에 대한 벌금 및 구상권청구""를 따로 청구하는 정책을 펴주세요. 그래서 상황이 좋지 않은 기간 또는 지역에는, 임차인과 임대인이 함께  임대료등을 합의할수 있도록 하여, 위험한 기간에는 영업을 안할수 있게 해주세요.

 3) 임대인에게 ""(건물의) 감염병 차단을 위한 방역수칙"" 을  통해. 확진자 발생으로 인한 휴업기간에는, 또는 행정명령으로 인한 휴업기간동안에는 그 매장을 정부 및 지자체관리 산하에 있는 것으로 규정해주세요.
그래서 임차인이 사용안하는 기간에는 임대인도 그 기간동안 그 매장에 사용료를 받을 수 없게 해, 서로 함께 손해를 부담하게 해주세요.

 4) 행정명령과 상관없는 일반 사업장의 경우, 코로나19 정국 기간에, 임대인에게 ""(건물의) 방역의무 준수에 대한 행정명령"" 을 통해. 그 임대구역의 실제방역담당자인 임차인에게 ""방역비""를  인건비 또는 관리비 형태로 의무적으로 지불하거나, 또는 그만큼의 월세감면을 해주는 것을 의무화 하는. 실질적인 생활방역정책을 해주세요.

4. 그래서 사업장 임차인과 임대인이 합의하여 방역에 힘쓰고. 소상공인의  가장 큰 부담인 월세를 조금이나마 줄이거나 조절할 수 있도록.  임차인과 임대인 양쪽이 함께 상생하는 정책을 펴 주세요.

1)  임차인 입장에서는, 위험한 상황에서는 월세를 내지 않고 휴업을 할 수 있게. 그 책임을 임대인이 함께 지도록 하고 임대인과 월세합의등을 쉽게 이끌어 낼수 있도록 될 것입니다.

 2)  임대인의 입장에서는 그 업장의 월세를 휴업기간 동안에만 안받거나 조절하고,  다른 업장의 월세는 그대로 받을 수 있기 때문에. 어느정도 손해는 감수해야 하지만. 업장의 폐업으로 이어지는 더 큰 손해는 막을 수 있을 것입니다.

 3) 정부 및 지자체 입장에서도 코로나 19 정국에서 개체수가 상대적으로 적은 법인 및 임대인을 관리하는게, 여타 많은 업장을 관리하는 거보다 훨씬 쉽습니다. 사각지대를 좀더 쉽게 관리하는 체계도 만들 수 있고요. 임차인과 임대인이 둘이 공동으로 방역관리자가 되니 이중으로 관리도 가능합니다. 


앞으로 한달이라는 청원기간이 있습니다만. 누군가 미리 정부 또는 지자체에서 이 글을 미리 보신다면, 최대한 빨리 이와 같은 또는 비슷한 행정명령을 내려주시길 기대합니다. 

건물주는 여전히 돈을 벌고. 소상공인은 나자빠지는 이 상황을 방치하지 말아주세요. 지금 코로나19의 최대엄중한 시기에, 임차인과 임대인이 함께 힘을 합하여 코로나19 를 잘 극복할 수 있도록 해주시고.  양쪽이 함께하는 진정한 생활방역이 될 수 있도록 만들어주셨으면 합니다.

부탁드립니다.",NaN,행정,2020-05-12,2020-06-11,naver
588854,청원종료,“신용회복중이거나 개인회생중인 소상공인과 자영업자들도 이번 코로나 긴급 재정대출 지원 대상에 포함될 수 있도록 확대해 주세요”,489,"저는 두 아이를 키우며 열심히 살아가고 있는 평범한 4인 가족의 가장입니다.
온 국민이 코로나19로 인하여 고통 받고 있는 이 시국에 너무나도 힘이 들어 “청와대 청원”이라는 방법을 통하여 하소연 하고자 합니다.

저도 자영업을 하고 있는 1인 하도급사업자입니다. 코로나로 매출자체가 줄어들고 점점 일하는 날도 줄어들어 언제 나아질지 모르는 불안한 마음으로 하루하루를 살아가고 있습니다.
코로나로 인한 힘든 시국에 정부에서 자영업자나 소상공인을 위한 지원(저리대출)을 해준다고 해서 그나마 힘드신 많은 분들의 숨통이 조금이라도 트일 것 같아 다행입니다.
저도 부푼 마음으로 창구에 문의 했지만 자격이 안 된다고 합니다.
전 개인회생 중이기 때문이랍니다. 애초부터 큰 기대는 않고 갔지만 실망은 점점 절망으로 치닫고 있습니다.
예전 사업실패로 인하여 카드며 사채며 모두 연체되어 신용불량자가 되었고, 오랜 기간 방황하다가 결혼을 하고 아이를 낳아 키우면서 열심히 용기를 내어 지금에 이르렀습니다.
“개인회생”이란 제도를 통하여 새롭게 신용회복을 모색하게 되었고, 지금 37개월째 연체 없이 갚아나가고 있습니다. 그렇지만 여전히 살림살이는 팍팍하기만 합니다. 
아직까지 신용카드도 발급되지 않아 목돈을 지출 할 때가 되면 여기저기 알아보다가 결국엔 사채(연24%)를 또다시 내고 갚고를 반복하고 있는 실정입니다. 저희 같은 사람에게 손을 내미는 사람들은 사채업자 밖에 없다보니까 이자가 비싸도 사채를 내고 갚기를 반복할 수밖에 없고 그러다보면 빚이 계속 늘어날 수밖에 없는 악순환이 반복되는 것입니다.
더구나 요즘같이 코로나로 인한 전국적인 재난 수준의 경제공황 사태는 당장의 수입저하와 미래가 담보되지 않는 불안감에 한가족을 책임져야 하는 가장으로서 어깨가 너무나도 무겁습니다.

“저와 같이 신용회복이나 개인회생을 진행하고 있는 소상공인에게도 지원해 줄 수 있는 정책은 없는 것입니까?” 
연체 없이 열심히 갚아 나가고 있고 직장이나 수입원증명이 가능하다면 그 수입정도에 따른 얼마만이라고 대출 받을 수는 없는 것입니까? 고리의 사채를 우선 갚는 대환조건 대출도 괜찮습니다. 물론 도덕적 해이(moral hazard)가 문제가 될 수도 있겠지만, 다시 한 번 기회를 주고 그 기회의 약속에 대한 담보를 확실히 한다면, 누가 쉽게 생각할 수 있겠습니까?

전국민에게 재난지원금을 준다는 정부의 발표가 고맙기도 합니다. 
하지만 저희 가족은 그냥 안주셔도 되니깐 제발 저리로 받을 수 있는 대출이라도 해 주시면 오히려 감사하겠습니다. 은행권은 신용등급 때문에 못해준다고 하니까 정부에서 보증이라도 서주면 안 되는 것입니까?
이번에 소상공인 대출이 연1.3%로 아주 저리로 지원된다고 들었습니다. 저희 같은 신용회복중이거나 개인회생중인 자영업자들을 위한 지원정책도 마련 해주셨으면 하는 간절한 바램으로 청원합니다. 

물론 신용을 지키지 못했던 과거 저의 잘못도 있지만, 지금은 열심히 세금도 내고 있고, 약속한 회생절차도 착실히 지키고 있습니다.
국민의 일원으로서 열심히 살아가고자 하는 절박한 미생의 가장들에게 다시 일어설 수 있는 국가적인 정책이 있었으면 좋겠습니다. 
너무나 힘이 들어 “마지막”이란 극단적인 생각까지 해 봤던 과거의 생각이 최근들어 불현 듯 자주 떠올라서 너무 괴롭습니다.
가끔 신문지상이나 뉴스로 일가족 극단적인 선택들을 종종 접하곤 합니다.
그들이 그런 선택으로 갈 수밖에 없는 현실의 뒤에는 항상 “생활고 비관”이란 말이 따라 다닙니다.
누군가에게는 크지도 않은 수십만원, 수백만원이 “한가족”에겐 절박한 목숨값이 되곤 합니다. 너무나 슬프고 화가 나는 일이 아닐 수 없습니다.
지금 코로나19로 인한 재난상황이 언제 끝날지도 장담 못하며 이런 상태가 계속 지속된다면, 아니 어쩌면 이미 힘겹게 버티고 있을지도 모르는 그 “한가족”에게 그러한 안타까운 일이 발생하지 않으리라고 누가 장담할 수 있겠습니까?

“진정 누군가의 그 한가족에게 도와줄 정책은 만들어 질 수 없는 겁니까?”
우리 사회 경제의 사각지대에 놓인 많은 소상공인들과 자영업자들을 부디 안타깝게 생각하시어 그에 따른 정책이 나왔으면 합니다.
청원글을 올리면 바로 청원게시판에 올라가는 것이 아니라, 일단 100명의 동의를 얻어야 게시판에 등재가 된답니다. 부디 청원게시판에 올라가서 전국민의 동의를 얻을 수 있도록 많은 동의 부탁드립니다.
부디 이 청원글을 읽으신 여러분들의 가정에 코로나19를 극복할 수 있는 “행복바이러스”만 가득하시길 기원 드리며 간곡하게 동의를 부탁드립니다. 도와주세요^^

“신용회복중이거나 개인회생중인 소상공인과 자영업자들도 이번 코로나 긴급 재정대출 지원 대상에 포함될 수 있도록 확대해 주세요”",NaN,기타,2020-05-12,2020-06-11,kakao
588861,청원종료,소상공인들은 어떻게 살아야 합니까,226,"얼마전 이태원클럽 사건을 보고 정말 분통이 터집니다  
자기 몸에 이상을 느끼는 분,열이 난다거나 피곤하다던가 코로나19가 의심이 되는 분을
거리에 활보를 못하도록 강력하게 막아주십시오.
코로나19 확진이 의심되는 한두사람 때문에 얼마나 많은 소상공인들이 고통을 받습니까? 
모든분야의 종사자들이 일을 해야 먹고사는데 확진자가 왔다가면 모든 자영업자들이 문을 닫아야 한다면 한,두달만에 끝나는것도 아니고 소상공인 어떻게 살아야 합니까?
더불어 얼마전 이태원 다녀온 사람들이 하루빨리 검사에 응할수 있도록 조취를 취해주세요",NaN,보건복지,2020-05-13,2020-06-12,naver
588894,청원종료,이태원 클럽 및 다른 클럽에서 코로나19에 감염된 확진자 치료를 자비부담으로 해야합니다.,1117,"정부 지침에도 불구하고 이태원 클럽 및 다른 클럽과 주점에서 감염된 확진자의 치료비에 대해서 자비부담과 정책적 과징금으로 처벌 원합니다.
이어려운 시기에 모든 사회구성원들이 힘들게 버티고 있었습니다. 학생들은 등교하기를 손꼽아 기다렸고 자영업자들은 이제야 숨통이 트기시작했습니다.
하지만 지난주말 상황이 다시 악화되기 시작했습니다.
정부의 청년수당, 취업수당등 20대에게 세금을 쏟아부어도 이들은 상황을 외면했습니다.
더이상의 관용보다는 처벌을 받아야 한다고 생각합니다.
치료비 자비, 행정명령등 모든 사회의 기반에서 피해를 보게된 것을 요구해야합니다. 
적극적인 정부의 움직임이 있어야 할때라고 생각됩니다.
그래야 또다른 코로나19감염의 집단발생을 막을수 있을꺼라 봅니다.",NaN,보건복지,2020-05-14,2020-06-13,naver
588898,청원종료,경제 위기에 처한 국민을 두번 울리는 경제 n번방을 잡아주세요.,291,"안녕하세요?
저는 서울에서 교육관련 자영업을 하고 있는 영세상인입니다.
수능 이후부터 시작된 영업 부진이 코로나 19로 인해 거의 영업 정지 상태가 되다보니 월세와 관리비로 나가는 1000만원이 매달 빚이 되어갔습니다. 또한 은행 펀드와 채권 수익률도 코로나19로 인한 경제 악화로 마이너스 상태에 빠져 있고 헤어날 길이 보이지 않았습니다. 그래서 언론에서 개미 투자자들의 주식 투자 이야기가 나오자 저도 폐업 위기를 막아볼까하고 주식을 시작하게 되었습니다. 그때부터 저에게 주식리딩, fx, 해외 선물 투자, 재테크 관련 많은 카톡방 초대와 문자들이 왔습니다. 그중 원금 보장에 수익률 200~400%를 보장한다는 회사들 카톡들이 여럿 왔고, 수익 인증 카톡방에 초대를 받았습니다. 그들이 주고받는 수익인증을 보니 점점 믿게 되었고, 저도 이 재정난을 해결할 수도 있겠다는 희망이 생겨 4/23일 채권 담보 대출을 받아 1억 5000만원을 그들 사이트 계좌에 입금했습니다. 그들은 본인들이 ai기법으로 수익률이 올라가는 종목을 잡아 투자하니 그 전문가들이 시키는대로 홀짝언더오버를 누르면 된다고 하였습니다. 태어나 로또 한장을 사본적도 없기에 그게 뭘 의미하는지 전혀 모른체 진짜 투자라 믿고 시키는대로 했습니다. 그러나 한시간도 안되어 9000만원이 사라졌고, 제가 돈이 다 사라졌다고 이게 왠일이냐고 하니 오늘은 흐름이 안 좋다고 내일(4/24) 다시 하겠다고 카톡방에서 나갔습니다. 그때야 잘못 되었구나 하는걸 느끼게 되었습니다. 그래서 바로 다음날 4/25 수서 경찰서에 신고를 하러 갔으나 이런 카카오톡을 통한 건은 투자라는 말이 있고, 투자는 본인 선택에 의한거니 사기가 성립하지 않는다. 고로 형사고소의 의미가 없다고 하였습니다. 또한 보이스피싱도 스미싱도 아니라 카카오톡을 통한 것은 계좌정지신청을 할 수도 없고, 고소될 수 없다고 법원에나 가라고 했습니다. 저는 바로 교대 법원으로 갔고 인근 변호사 사무실로 가서 자문을 구했으나 변호사도 이들은 해외에 주둔해서 잡기 힘들다고 별수 없는 사건이라고만 했습니다. 그래서 저는 남은 6000만원을 그 사이트 고객센터에 출금신청했으나 '프로젝트가 끝나지 않아서 출금 불가다'라고 하고, 또한 전문가라는 사람은 반드시 프로젝트를 마쳐야 출금가능한게 회사 규정이라고 했습니다. 원금을 다시 찾고 싶은 저는 달리 도리가 없어 그들이 말하는 대로 다시 사이트에 들어가서 시키는대로 하자 한번에 6000만원이 날라갔습니다. 그 후 그들은 자신들 돈을 넣어서라도 반드시 원금을 찾아주겠다고 하더니 아예 카톡을 끊었습니다. n번방이 어린 미성년자들에게 씻을 수 없는 상처를 줬다면 이 재테크 사기단은 경제적 어려움을 어떻게든 극복하고 싶은 영세한 국민들을 더 깊은 수렁으로 몰아 넣어 자살 위기까지 밀어넣고 있습니다. 제가 이 일을 겪고나서 죽도록 인터넷을 뒤져보니 저와같이 똑같은 수법으로 피해를 당한 사람이 최근 정말 많지만 그들 모두 카카오톡을 이용한 사기를 당한거라서 경찰의 보호도 받지 못하고, 수사 진행도 되지 않고 있고, 범인도 찾을 수 없고, 피해액을 받지도 못하고 자책과 원망만 하고 있습니다. 
 문재인대통령님! 제발 정부가 나서서 카카오톡을 이용하여 투자라는 이름으로 이 어려운 경제적 위기를 어떻게든 벗어나고자 발버둥쳤던 영세한 국민과 검찰과 정부를 기망하여 수십 수백억원을 사기치는 이들을 범정부차원으로 수사하여 잡도록 도와주세요. 지금도 그들은 너무나 뻔뻔하게 어려운 국민을 기망하고 사기를 치며 어려운 사람들을 울리고 있습니다. 제발 빠른 수사가 착수될 수 있도록 도와주세요. 

카톡을 주시면 관련된 카톡내용 모두 보내드리겠습니다.
●해당 사이트: ********(**********.com)
●입금된 계좌 정보:
○은행명: **은행
○회사명: 주식회사 *** **점
○계좌번호: ***-******-**-***",NaN,경제민주화,2020-05-14,2020-06-13,naver
588900,청원종료,유흥주점허가라는 이유로....,464,"저는 서울변두리에서 30평두안되는 소규모 유흥주점을 운영하고있습니다
처음 코로나 확진자가 발생한곳은 결코  유흥주점이 아닙니다 
그렇지만 저희는 국민의 한사람으로써  사회적 거리두기에 적극 동참하였고
인명부작성, 손소독제, 마스크, 체온계비치 및 실내 방역을 열심히 하였고 
정부방침에 적극 동참하여 한달 동안  휴업을하고 코로나 확진자 감소 소식에 마냥 기뻐했습니다   
그러면서 손목 안심밴드까지 만들어서 코로나 확진자 관리를 잘 해주리라 믿었습니다 
그런데 또 코로나 확진자는 전파를 시키며 활보하고 다녔습니다 
저희는 정부와 방역당국을 믿고 할수 있는 협조를 다했는데 이제 누굴 믿고 살아야 합니까? 
저희들 유흥업소에서 코로나가 발생한게  아니라 정부에서 코로나 확진자를 관리 못해서 일어난 일이라고 생각합니다
유흥주점 허가라는 이유로 소상공인대출 정부지원금 혜택에서는 모두 해당사항이 없습니다
저도 한가정의 가장이고 부양해야하는 노모와 어린자식이있습니다
대출이자와 가게임대료는 어디서 어떻게
해결하란 말입니까?
죽으라는 것입니까?
우리4가족쯤이야 이나라에서 존재감도
없는 것인가요?
코로나 확진자에게는 관대하고 피해를 입은 자영업자들에게는 너무나 냉정하고 엄격한 나라입니다
날마다 눈물로 한탄하며 이코로나19가
종식되기를 기도하고있습니다
언제까지 돌아다니며 전파시키는 코로나 확진자에게 자영업자들은 다녀갔다는  이유하나만으로 대책없이 당하고 
유흥업소들만 잘못한 것처럼 국민의  혐오감이 되고 기약없는 영업중단을  해야 합니까???
*저희처럼 30평미만의 소규모 유흥주점은
집합금지명령에서 제외 시켜주십시요!!!",NaN,행정,2020-05-14,2020-06-13,naver
