number,progress,title,like,contents,answer,category,sday,eday,proponent
594925,청원종료,층간 소음으로 인한 피해자를 위해 법적인 보호조치 강화를 부탁합니다.,665,"아는 것이 미천하여 글이 부족하니 천천히 읽어주셨으면 합니다.
국민과 정부 모두에게 고하는 청원문입니다.


1. 불이 꺼지고 눕자마자 잠들 수 있다면 좋겠지만, 그렇지 않으니 자정 시간대와 새벽 사이에 바닥 소음은 자제해야 합니다. → 하지만 이 부분이 해결이 어려울 경우 제도적으로 증거를 수집해 대응할 수 있는 법안을 만들어 주세요.


2. 아이들이 뛸 수도 있습니다. 요즘은 밖에 못나가니까요. 다만 아랫집을 생각해서 방음매트를 고려해주세요.
→ 하지만 이 부분이 해결이 어려울 경우, 층간소음 민원이 몇 회 이상 발생할 경우 가해자 가정에 방음매트 설치 의무화를 통지하여 꼭 설치하게 한 뒤, 설치 후에도 층간 소음이 해결되지 않을 경우 피해자를 보호할 수 있는 법안을 만들어 주세요.


3. 집에서 느끼는 개인의 소리는 원래 무디게 느껴집니다. 다만, 소음이 바닥을 통해 전달이 될 때는 ""울림""이 생기기 때문에 집에서 체감하는 소리보다 크고 날카로운 저음이 상대 층으로 전달됩니다. 부득이하게 야간 작업을 해야 해서 새벽에 무거운 것을 내려 놓거나, 발을 강하게 딛는 행동은 자제해 주시고, 기타 물건을 내려 놓을 때(예: 쇠구슬 수 십 개가 굴러가는 소리, 책을 던져 바닥에 울리는 찢어지는 소리)에는 꼭 조심해주시거나 미리 양해를 구하시면 좋겠습니다. 무엇보다 밖이 어두워 모두가 잠들 시간이오니 낮에 작업해주시면 좋겠습니다. 건강을 위해서도 주무시는 것이 좋을 겁니다. 
→ 하지만 이 부분이 해결이 되지 않을 경우에 역시 위 1번에서 언급한대로 시간별 층간소음 증거 확보 및  신고를 통해 피해자를 보호할 수 있는 법안을 만들어 주세요.


4. 층간 소음의 항의는 스트레스로 인해서 피해자가 가해자에게 항의하는 방식입니다. 정중하게 전달이 되기도 하고, 혹은 감정적으로 전달이 되기도 하겠지요. 이 부분에 대해서 해당 지역의 관리사무소 뿐만 아니라 동사무소, 구청, 시청등에 생활소음 관련 전담부서를 마련해서 정부를 통해 층간소음에 대한 피해를 전달할 수 있게하여 피해자를 보호해 줄 수 있는 과정을 만들어 주세요.


5. 코로나 사태로 자영업에 임하시는 분들 중에 따로 사무실을 임대하지 못해서 집에서 작업을 하시는 분들도 계신다고 합니다. 아파트 내 갈등과 소음으로 인한 스트레스를 없애기 위해서 이 내용에 해당하시는 분들을 모아 관리사무소나 상가 내 공실 공공 임대를 통해서 작업실로 쓸 수 있는 방안을 모색하는 것도 좋을 것 같습니다. 혹은 시와 국가에서 작은 개인 작업실을 저가로 임대해주어 가정에서 작업하는 것이 아니라 밖에서 작업할 수 있도록 유도하여 층간소음을 줄이는 방안도 도움이 될 것 같습니다.


6. 아래 내용을 좀 더 법적으로 강화해서 피해자가 일방적으로 고통을 감수해야 하는 상황을 해결해 주셨으면 합니다.
(1) 데시벨 측정기를 통해 생활 소음 이상의 반복소음 측정 및 기록 (예: 동영상으로 촬영)
(2) 위 (1)번을 바탕으로 야간 및 새벽 소음 발생시 데시벨 측정기를 통해 동영상으로 촬영하면 증거로 활용 가능
(3) 층간 소음 공간을 잡기 위해서, 기타 가정에 같이 협조를 구하여 소음 시작점을 찾기
(4) 관리소 입회 하에 해결방안 협상 후 협의가 되지 않을 경우에 법적 절차 이행
→ 여기서 피해자가 피해자임에도 집을 떠나야 하거나 피해자가 일방적으로 참아야 하거나 신경안정제를 복용해야 하는 억울한 일이 생기지 않도록 꼭 피해자를 보호해줄 제도가 필요합니다.


7. 층간 소음은 협의가 안될 경우, 가해자측이 피해자측을 정신적 강간을 하는 것과 마찬가집니다. 스스로의 자유를 위해서 상대의 고통을 당연시하는 것은, 육체를 범하지 않는 것일 뿐 정신을 고통스럽게 하는 일이니까요. 
민주주의의 자유는 마음껏 누리되 책임이 뒤따르는 개인의 도덕성에 기반을 둔 시스템입니다. 나의 자유뿐만 아니라 서로의 자유와 행복을 위해서 같이 배려해야 하는데, 이 관계가 일방적으로 가해가 일어나는 경우는 우리의 이념으로도 법적으로도 문제가 충분하다고 사료됩니다. 

층간소음은 이제 어디서나 볼 수 있는 생활불편이자 정신적 고통이 되어버렸습니다.
부디 가벼이 여기지 마시고, 피해자들의 고통을 덜어줄 수 있도록 도와주셨으면 합니다.


개인적인 상황을 조금 남기면, 8월부터 10kg가 빠졌습니다.
밖에서 들리는 둔탁한 소리에도 집에서 나는 층간소음처럼 반응하게 되어 스트레스가 더하고
공황장애가 더욱 심해져서 일상 생활과 직장 생활이 어려워지고 있습니다.
층간소음 피해자 카페가 존재할 정도로 사회적 이슈가 되어 있으니, 꼭 이 부분에 대해서 국민 중 하나인 저의 얕은 지식보다 현명한 분들의 지혜로 해결방안을 마련해 주셨으면 합니다.

이만 줄이겠습니다.

 [본 게시물의 일부 내용이 국민 청원 요건에 위배되어 관리자에 의해 수정되었습니다]",NaN,안전/환경,2020-12-23,2021-01-22,naver
594947,청원종료,자영업자 촛불 집회라도 불사하겠습니다.,369,"코로나 상황에 집회의 자유를 막는거 민주주의의 기본 원리이지만 당연하다고 이해했습니다.  제가 아는 대통령님은 누구보다 법을 잘 아시는, 항상 약자의 앞에 서계셨던 분이었기에 그저 믿었습니다.

대통령님,
저는 포차를 운영하는 자영업자입니다. 약자의 편에 서서 운동하시던 젊은 시절에 포차에서 동료분들과 술 드셔보셨죠? 포차보고 저녁 9시에 문을 닫으라고요? 많이 당황했지만 국민을 위하는 대통령님 말에 따라 4년을 동거동락하던 직원을 눈물로 보내고 그렇게 이번 년도에만 3번의 빚을 냈습니다. 내년이 되면 국가에서 코로나로 내어준 빚에 대한 이자는 물론이고 분할상환까지 해야합니다. 

그렇게 밤잠도 못자고 걱정만 하고 있었는데 정부에서는 배달을 하면 된다는 식의 말을 하는 것 처럼 들리더군요. 그건 우리가 할 선택이지 정부가 무슨 방법인냥 말해서는 안됩니다. 스트레스 때문에 저만 그렇게 들렸다면 죄송합니다. 어쨋건 원래부터 안주에 대한 배달수요가 적다보니 배달을 안하던 차에 갑자기 배달을 하면 마법처럼 주문이 들어오지는 않습니다.

구구절절 사연 길게 말할 필요 없다고 생각합니다. 그동안의 대통령님을 국민의 한 사람으로 지켜봤을때 대를 위해 소는 마구잡이로 희생시키는 분도 아니며, 오히려 반대로 약자의 앞에 서주시는 분이라는걸 알고 있습니다.
그리고 누구보다 우리의 심정을 잘 알고 있는 분이라는 걸 믿고 있습니다.

코로나 당연히 음식점 집합제한 필요합니다. 저는 국민의 한사람으로서 대를 위해 희생해야하고 희생할 수 있습니다. 하지만 우리가 믿고 기다릴 수 있게 해주세요. 자살하면 우리 가족은 어쩌지라는 진지한 고민을 그만할 수 있도록 뭐라도 대책을 내어주세요. 

일개 자영업자가 감히 대통령님깨 어찌 대책을 내놓으라며 강요하겠습니까. 이건 그냥 유언장이라고 생각하셔도 됩니다. 이렇게 강경하게 나오는 상황이 이해가 안되시지 않으리라 믿습니다. 뭐라도 좋습니다. 코로나로 인한 대출에 한해 신혼부부 아파트담보대출처럼 상환기간을 10년으로 늘려주겠다거나 아니 현실적인 방안이 아니어도 좋습니다.

제발! 전면에 나오셔서 지금은 코로나를 종식시키는 것이 최우선이니 ""자영업자님들, 어떤 방식으로도 살려는 드릴테니 믿고 기다려달라""는 말 한마디만이라도 해주시기 바랍니다.

1월까지만 기다려보고 저는 혼자서라도 촛불을 들겠습니다. 방역수칙 지키겠습니다. 
코로나로 죽나 가게에 앉아서 죽나 똑같습니다. 

옆집 사장님이 그러더군요. ""내가 이번에 진 빚은 내가 죽지 않으면 내 아들까지 갚게 생겼다""고... 
이기적이라고 생각되시면 돌을 던지셔도 됩니다.

대통령님 간곡히 부탁드립니다. 살려주세요.",NaN,미래,2020-12-23,2021-01-22,naver
594955,청원종료,종교 행사도 5인 이상 사적 모임 금지 대상에 포함시켜 주시기 바랍니다.,2341,"수도권은 23일 00시부터 내년 1월 3일 24시까지 5인 이상 사적 모임이 금지됩니다.
하지만 서울시는 교회 예배는 사적 모임에 해당하지 않는다고 답변했고, 거리두기 2.5단계 기준을 적용받습니다.
이 경우 비대면 예배만 가능하고, 예배 준비 인원을 20명 이하로 유지해야 합니다.
하지만 예배당마다 20명씩 현장 예배를 드리는 등 이를 악용하려는 교회가 많습니다.
수도권의 3만 여개 교회가 이런 식의 편법 성탄절 예배를 드린다면 집단 감염이 늘어날 우려가 큽니다.  
자영업자는 생존의 위협에도 영업 제한을 받는데 집단 감염이 주로 일어나는
종교 행사는 20인이 모일 수 있게 허용하는 건 납득할 수가 없습니다.
종교 행사도 5인 이상 행사 모임 금지 대상에 포함시키거나 거리두기 3단계를 적용해서 모임과 식사 등을 전면 금지해주시기 바랍니다.",NaN,보건복지,2020-12-23,2021-01-22,naver
594965,청원종료,관광업계 종사자들에게도 도움을 주십시오.,206,"안녕하세요. 저는 관광버스기사 일을 하시는 아버지 딸 입니다.
본론부터 말씀드리자면 코로나로 인해 자영업자, pc방, 노래방 등 힘든거 압니다. 하지만 정부의 대책이 거기까지인게 제가 말 하고싶은 문제점 입니다. 저희 아버지처럼 관광버스기사님들도 피해지만 더불어 관광업계에 종사하시는 모든분들께서 어려움을 겪고 있다고 생각합니다. 그 중 관광버스는 항공사, 호텔처럼 대기업이 아닙니다. 다 개인이 소유하는 버스로 회사의 이름을 걸고 운영하는것이지 기업에서 버스를 빌려주고 운전만 대신해주는것이 아닙니다. 한달에 집에 들어올까말까 하시던 아버지가 이젠 집에 맨날 계십니다. 초반에는 자주 뵐 수 있어 좋았지만 후엔 아버지께서 힘들어하시고 대출까지 여러군데 알아보는게 너무 마음이 아팠습니다. 뉴스에서는 맨날 자영업자의 어려움만 보도가 되고 정작 제일 피해를 입은 관광업 종사자들의 어려움은 알아봐주지도 않는다는게 정말 마음이 아픕니다. 저희 아버지 친구분 회사는 파업했다는 소리도 들었습니다. 저희 아버지께서는 하도 안되서 오래해오시던 관광버스 일을 관둬 버스를 팔아 돈을 마련 할 생각까지 하고 계십니다. 부디 관광업 종사자들에게도 도움을 주세요.",NaN,일자리,2020-12-24,2021-01-23,naver
594966,청원종료,불합리한 코로나 방역 기준 제발 재검토 부탁드립니다,260,"코로나 19의 종식을 위하여 사회적 거리두기를 시행하는 것은 잘못된 일이 아니나, 실제 소상공인들의 운영 실태를 제대로 파악치 못한 채 탁상공론만을 통하여 내려진 정부 지침으로 인하여 집합금지 시설로 분류된 몇몇 시설을 운영하는 수많은 소상공인들이 고통 속에 힘든 나날을 보내고 있습니다. 

사회적 거리두기 2.5 단계 시행 시 , 다같이 모여 게임을 하는 공간인 PC방은 9시 까지 영업이 가능하고, 150평에 방5개에 방 하나 당 8평, 10평정도 되는 공간에, 1인만 개인적으로 운동할 수 있어 거리두기기준에 충족되는 요건의 시설은 실내 체육시설로 분류되었다는 이유만으로 영업이 불가합니다.
카페의 경우에도 휴게음식점으로 분류된 카페는 똑같이 샌드위치를 판매하고 있음에도 배달과 포장만 가능한 반면, 브런치, 샌드위치 등 식사가 가능한 메뉴를 취급하여 일반음식점으로 등록한 카페의 경우 9시까지 실내에 손님을 받으며 영업이 가능합니다. 

이는 소상공인들의 실제 운영 상황을 전혀 파악하지 못한 엉터리 사회적 거리두기 집합금지 조치라고 생각합니다.
우리나라의 경우 , 자영업자의 비율이 전체 취업자에서 차지하는 비율이 25.1%로, 자영업으로 생계를 유지하고 있는 국민들이 많습니다. 4명중에 1명이 자영업자인 상황입니다.
이렇게 높은 비중을 차지하고 있는 자영업자들이 무너진다면, 우리나라 경제에도 큰 타격이 있을 것입니다. 

현재 사회적 거리두기 2.5단계가 시행중인데, 이후 또 다시 3단계 격상으로 인하여 가게 문을 열지 못할까 너무나 두렵고 막막하기만 합니다. 
실제로 매장을 운영하고 있는 현장에서 실태 조사를 해보셨습니까? 
어떤 손님들이 어떤 방식으로 머물다 나가는지 조사해보셨습니까? 

제발 책상에서 높으신 분들끼리만 의논치 마시고, 현장에 나오셔서 국민들의 목소리에 귀를 열어주시고, 국민들 일상에 어떤 고통이 도사리고 있는지 보아주십시오.
그리고 그것을 토대로 합리적이고, 이해가 가는 사회적 거리두기 지침을 내려주시기 바랍니다... 

사회적 거리두기 2.5단계 격상으로 인하여 집합금지 조치를 당한 업종들이, 연이은 3차 격상으로 인해 더 큰 피해를 겪지 않도록, 더 큰 아픔을 겪지 않도록 제발 부탁드립니다. 

당장 이 달에 임대료와 관리비, 대출 이자 및 가게 시설 운영비, 직원의 급여와 4대 보험, 전월 가게 운영비 등 숨만 쉬어도 1천 400만원 이상 지출이 발생하는 상황에서 저희는 당장 이번 달 생계비조차 빠듯한 상황입니다. 

이러한 어려움 속에서도 코로나19의 종식을 위해 정부의 지침을 따르고 있는 소상공인들의 고통이 더 지속되지 않도록, 헛되지 않도록 합리적인, 이해할 수 있는 사회적 거리두기 정책을 시행하여 주시기 바랍니다. 

대통령님... 정말 너무 힘이 듭니다. 저희를 살려주세요.",NaN,기타,2020-12-24,2021-01-23,kakao
594969,청원종료,3차 재난지원금은 보편지급으로 결정해주십시오.,1029,"3차 재난지원금은 보편지급으로 결정해주십시오.

 코로나 재확산으로 다수 국민들이 시름에 빠져 있습니다. 하지만 청와대는 이런 국민들의 마음을 헤아리고나 있는지 모르겠습니다. 김상조 청와대 정책실장의 언론인터뷰를 보면, 보편지급은 효과적이지 않다 하고 선별지급을 예찬하고 있어 이미 선별지급으로 결정한 것으로 보입니다.

 하지만 2차 선별지급은 허점이 너무 많았습니다. 끼니를 해결하려고 열흘 일했던 알바 때문에 지원금을 받지 못한 사람이 허다했습니다. 주변에 어려운 사람은 많은데, 지원금 받은 사람을 보기가 힘들었습니다. 그리고 무슨 기준으로 지급하는지 공정성 시비가 일었습니다. 권력층과 밀접한 직능단체들 위주로 선정된 것이라는 소문도 돌았습니다.

 정부는 거리두기하라고 합니다. 모이지 말고 활동을 멈추라고 합니다. 정부 관료들은 그렇게 해도 월급 따박따박 받으며 살아갈 수 있겠지만, 대부분의 국민은 일을 멈추고 활동을 멈추면 입에 풀칠도 할 수 없습니다. 멈출 것을 요구한다면, 먹고 살 대책도 마련되어야 합니다. 

 지금은 온국민에게 비상상황입니다. 코로나는 정부의 선택을 받은 직종에만 피해를 입히지 않았습니다. 공무원, 정규직을 제외한 대부분의 노동자 서민에게 영향을 미치고 있습니다. 자영업자들도, 다수 국민도 보편지급을 원하고 있습니다. 국민의 고통을 외면하지 말고, 3차 재난지원금은 반드시 보편지급으로 결정해주십시오.",NaN,경제민주화,2020-12-24,2021-01-23,naver
594976,청원종료,수도권에서 어린이 전용 수영장을 운영하는 사업주입니다.,3589,"저 혼자만의 어려움이 아닐 것이라는 생각으로 묵묵히 버텨왔습니다. 하지만 더는 버틸 여력이 없으며 사회의 구성원으로 짊어져야 할 책임과 희생은 충분했다고 판단되어 지금부터는 정부의 적극적인 관심과 대처를 요구하는 바입니다.

 분명 평등하고 공정하며 정의롭고 사람이 먼저인 이번 정부에서 내놓은 정책들을 의심하는 건 아닙니다.
다만, 어린이 전용 수영장을 운영하는 사업주로서 몇 가지 호소하고 싶은 내용이 있어 이렇게 청원 글을 올리게 되었습니다.

 생활체육 저변에서 가장 많은 활동인구를 보유한 종목은 수영이라고 할 수 있을 정도입니다. 좀 더 전문적이고 안전한 전용시설로 파생된 것이 어린이 전용 수영장입니다. 세월호 사건 이후 아이들의 수상안전에 대한 관심이 폭발 적으로 늘어나고 그 필요성이 대두되어 생존 수영이 필수 교과목으로 선정되는 과정에서 공공기관으로 감당할 수 없는 수요를 어린이 전용 수영장이 대체하고 있으며 지역사회에서도 환영받는 시설로 자리 잡고 있습니다. 또한 체육 업계의 불안정한 고용 형태를 완전고용 형태로 자리매김하고 적게는 20명 많게는 100명 단위의 직원을 채용하며 고용 창출에도 크게 이바지하였습니다.

 하지만 현재 어린이 전용 수영장은 머지않아 폐업 절차를 밟게 될 상황입니다. 영업성과는 당연히 말할 것도 없으며, 사업자 대출 및 사업주 개인의 돈까지 융통하여 버티고 있었지만, 반복적인 체육시설 집합금지 조치로 인해 그마저도 한계인 상황입니다. 정부에서 지원하는 다양한 재난 지원금들과 융자제도는 애석하게도 지원 대상에 해당하지 않았고, 그 사유의 대부분은 5인 미만의 고용인원과 일정금액 이하의 매출 조건으로 단순히 사업장의 규모로만 평가하여 지원 대상을 두고 있기 때문입니다. 코로나로 인한 피해는 같은데 사업장의 규모로 지원대상을 선정한다는 건 납득이 가질 않습니다. 특히 어린이 전용 수영장은 겉으로 보기에 사업의 규모가 커 보이지만 실제 매출에 비해 영업이익은 굉장히 낮은 편입니다. 매출 규모는 작지만 영업이익이 더 높은 다른 사업장이 지원금 대상에 선정되었을 때 큰 박탈감을 느꼈습니다.

 또한 영업이 중단되어도 시설을 유지하는데 필요한 자금이 일반 사업장보다 규모가 큽니다. 임대료와 각종 세금 수수료 및 고정비용 외에도 수질관리 난방 수도 전기등은 일반 사업장에 비해 몇 배 이상의 요금이 부과되며 운영을 하지 않아도 멈출 수 없는 설비들입니다. 시설유지 외에도 고용유지를 위해 급여의 일부분을 보전해줘야 하며 본 급여의 70% 이상을 지급해야 고용유지 지원금을 받을 수 있습니다. 하지만 지원금은 100%가 아닌 일정 부분이며 그마저도 사업주가 선지급을 해야 추후 받을 수 있습니다. 현재로서 선지급할 자금 역시 없습니다. 그리고 고용유지 지원금은 특별한 재난 지원금 정책이나 혜택이 아닙니다. 이런 상황을 대비해 사업주와 근로자가 납부한 고용보험료를 정당하게 받는 것입니다. 

 지금까지 그 어떤 재난지원금이나 혜택을 받을 수 없었고 지원대상이 되었다 해도 큰 도움이 되지 못하는 액수인 게 사실입니다. 제한 조치에 대한 재검토나 세제 혜택 또는 지원금 대상 확대 및 증액 등 현실성 있는 대책을 즉시 마련해 주셨으면 합니다. 

정리하자면

1. 어린이 전용 수영장은 환영받는 시설이며 지켜져야 할 필수 시설입니다
2. 많은 제제의 대상으로 제한을 받지만 정작 코로나 이후 시행된 수많은 재난지원정책 중 단 한 가지도 지원을     받을 
     수 없었습니다.
3. 책임과 권한은 동시에 따라오는 것이라 생각됩니다. 어린이 전용 시설로 특히 그 어떤 체육시설보다 철저한      
     방역과 정부 정책에 솔선수범하여왔으며 지역사회와 공공의 이익에 이바지하여 왔습니다. 그렇다면 국가로부     
     터 보호받을 권리 역시 적극 주장하는 바입니다.

 이번 코로나 사태로 인한 국가적 혼란과 경기침체, 자영업자들의 몰락... 앞서 말씀드린 바와 같이 저 역시 사회의 구성원으로 혼자만의 어려움은 아니라고 스스로를 위로하며 하루하루를 버티고 있었습니다. 하지만 가장으로서 그리고 회사의 대표로서 내려놓을 수 없는 책임감의 무게는 너무도 무거웠고 더는 버틸 수 없을 것 같습니다. 
저는 살고 싶습니다.",NaN,문화/예술/체육/언론,2020-12-24,2021-01-23,naver
