number,progress,title,like,contents,answer,category,sday,eday,proponent
595762,청원종료,재개발 세입자 두번 죽이는 서울시,160,"이제 5일이 지나면 용산 재개발지역에서 참사가 일어난지 12주년이 됩니다.
갈곳이 없어 남아있길 원하는 사람들과 내보내려는 사람들과의 충돌로 인해 여러분들의 아까운 희생이 있었던
가슴아픈 참사였습니다.
저의 직장은 얼마전까지 을지면옥같은 노포를 철거하냐 아님 보존해야하나했던 청계천을지로입니다.
가게을 임차하여 운영하고있는 세입자로써 개발을 한다면 어쩔수 없이 나가야만 합니다.
고박원순시장은 19년도에 세입자대책을 세워준다고했는데 이행하지 못하시고 20년에 바람처럼 떠나셨습니다.
이곳 세운재정비 3-2,6,7구역에 세입자에 대해 서울시는 대체임대건물을 지워주기로했는데 올해 착공예정인 
대체건물에는 제조업체만 입주할 권리를 준다고합니다.   
이곳에는 제조 유통 납품업체 식당등등 여러종류의 업체들이 공존해 있습니다.
제조업체만 입주하면 나머지 업체들은 어디로 가라는 말인가요? 바로앞 재개발구역이었던 3-1,4,5구역에서도 폐업하신 분들이 많이 있었습니다.    
이것이 돌아가신 고박원순시장의 세입자대책이란 말입니까? 제조만 살리고 나머지업체는 폐업시키라고요.
서울시는 재개발지역의 세입자들을 찢어놓지말고 공평하게 평등하게 대책을 세워야하는것 아닙니까?
지금 이곳 청계천 을지로 퇴계로에는 8곳이상이 재개발지역으로 지정되었습니다.한꺼번에 서울시가 너무 많은곳을 지정하다보니  이곳 수천의 세입자들은 갈곳이 없습니다.직원과 가족들까지 포함하면 수십만이 될것입니다.
 정말로 폐업이란 방법밖에 없는건가요? 폐업하면 그 가족들은 어떻합니까?
그리고 3-2,6,7중에 6,7세입자는 19년도에 나가라하여 20년 5월에 쫓겨났는데 서울시는 쫓겨났기때문에 입주할 자격을 주지않겠다고합니다. 3-2구역은 20년 5월부터 나가라고하여 준비 단계입니다.
 서울시는 대체건물을 적게지을려고 많은 사람들이 나갈때까지 기다렸단 말밖에 안됩니다.
인허가 내주어 한번 죽이고 대체건물에 못 들어가게해 두번 죽이는 겁니다.
청계천은 하나의 몸과 같습니다.   이곳도 같이 있어야 청계천을지로가 될수 있습니다.     
문재인대통령님! 대통령님께서는 자영업자 보호육성하신다고 하셨는데 서울시는 전혀 다른곳으로 가고있습니다.
지금도 코로나때문에 죽기 직전인데 제발 살려주세요. 정말 갈곳이 없습니다. 폐업할수 밖에 없나요?
힘든 코로나 이겨내면서  영업할수있게 제발 도와주세요. 부탁드립니다.",NaN,일자리,2021-01-18,2021-02-17,naver
595782,청원종료,보상없는 영업제한은 위헌,527,"코로나 19로 인해서 국민들 한명한명 예외없이 힘들어하고 있습니다.
1여년의 기간동안 끝이 없는 싸움에 모두들 힘들고 지치지만 대부분의 국민들은 국가의 방침을 잘 따르고 있습니다.
하지만 정부의 방침을 따르기 위해서 많은 것을 포기해온 국민들은 삶을 포기할 정도로 힘들어지고 있습니다.

금방 끝이 보일거라는 믿음으로 하루하루 버텨왔지만 아직도 끝은 보이지 않습니다.
그래서 요청드립니다.
헌법 제 23조3항에  '공공필요에 의한 재산권의 수용,사용 또는 제한 및 그에 대한 보상은 법률로써 하되, 정당한 보상을 지급하여야한다.'  라고 되어 있습니다. 
""정부의 방역지침을 국민들께 발표하시기전에 먼저 정당한 보상체계를 발표해주세요.""
소상공인, 자영업, 골목골목 장사하시는분들은 매주 주말이면 사회적거리두기 단계가 어떻게 바뀔지? 또 무엇이 강화될지? 방역지침은 어떤게 변하는지? 알르바이트생을 다시 불러야하는지? 숨죽여 바라보고만 있습니다. 
하루하루 피가 마르고 속이 타들어갑니다.

이제는 정부에서도 무작정 정부 방침을 따르라는 식의 방역수칙 발표에 앞서서 정당안 보상을 먼저 수립한 후 발표해주세요.  아주 간단한 '식당 테이블 한칸 거리두기' 한가지도 식당 하시는 분들에게는 손실입니다. 이러한 사소한 것도 재산권의 제한이므로 정당한 보상이 이루어져야합니다. 또한 ,피트니스 센터에 미성년자만 가능' 같은 지침도 마찬가지구요.
이번주 주말에도 정부 방역수칙만을 기다리고 있습니다.

다시 한번 눈물로 간곡히 호소드립니다. 
정부 방침을 잘 따를수 있게 그리고 코로나19가 조기에 종식될수 있게  도와주세요.

마지막으로 불철주야 코로나19 종식을 위해 고생하시는 방역 관계자분들께 고개숙여 감사드립니다.",NaN,보건복지,2021-01-18,2021-02-17,naver
595794,청원종료,건물임대인의 갑질횡포로 생계를 위협받아 거리에 몰리게된 소상공인을 살려주세요!,290,"새 건물에 입주하여 인테리어포함하여 시설비 5천만원을 들여 미용업을 시작하였습니다 
2년가까이 임대료 밀린적은 없었습니다   저의 인건비는 챙기지 못했지만 희망을 갖고 열심히 했으며,   
상황이 좋아질 무렵 코로나19 사태와 건강 문제가 겹쳐 2020년 2월 임대료를 보내주지 못한게 있었고,  
부득이한 사정으로 7.8 월(2달) 임대료는 기일이 며칠 지났지만 보냈습니다   임대료 미납도 아닌데 8월 12일 까지  임대료 3기 연체라면서 계약을 해지 하겠다는 통보를 보내왔습니다 
문자로 코로나사태 이유와 건강악화로 병원에서 수술받은 사진 첨부하여 사정을 설명하고 퇴원하여 보내겠다고 했고, 현재 가게를 내놓은 상태이니 새로웅 임차인이 들어오고 나가면 안 되겠냐고 부탁하였으나 건물주는 법데로만 하겠다고 급기야 10월 7일 미용실에  부동산 점유이전 금지가처분이란 듣도 보지도 못한 고시문을 붙여 
업장을 비우고  원상복구 하라는 소송을 받게 되었습니다 
저는 임대료가 3번 밀렸다해서 내 쫒기는 신세가 되는 줄은 무지해서 몰랐구요  설령  우리나라 정서상 이렇게 할수있다고는 미처 생각지도 못했는데  이런 건물주가  얼마나 있겠습니까?
법을 이용하여 악의적으로 임대료 날짜 지나자마자  내용증명을 보내 힘없는 자영업자에게 이렇게 피를 말리는 법이
존재 하는줄도 무지하여  몰랐던 게 죄라면 죄입니다  
임대료 6개월까지는 법의 보호를 받고  공포전 3기연체는 법의 보호를 받을수 없다는게 모순이지 않을수 없습니다 
상가 개정법이 만드어진 취지는 코로나19사태로 어려워진 경제난 때문에 만들어진 거로 압니다 
법이 공포되기전에 이미 경제난에 허덕이던 소상공인들은 정녕 구제 받으수 없는건지 ........
저희같은 소상공인들에게도 길을 열어 주셔서  빛을 볼 수있게 해주세요!!!",NaN,기타,2021-01-18,2021-02-17,kakao
595806,청원종료,피해보상청구권,211,"존경하는 대통령님 그리고 국회의원 그이하 방역정책담당자여러분~저는 이제 이나라에 감사하면서 살수가 없는 자영업자 당구장 주인입니다
저의삶이 이제 나락으로떨어지고 저의삶이 헤어나올수없는 빚더미에 앉아야하는 이 일상생활이 너무나 억울하고 분해서참을수가없어 두드리게 되었습니다  이나라 코로나 방역지침이 어느누구의기준인가요 누구를위한방역지침인가요 
공평성과 형편성에 맞는 방역지침인가요~
집합금지를하려면  강력하게 다 해서 잠시멈충으로 코로나를 잡고 연장되지않은 선에서 모두가 일상으로 돌아가야 모두가 살수있을텐데 누구는 열고 누구는닫고 마스크쓰고 거리두기만해도 되는 실내체육시설당구장은 닫고 마스크벗고 밥먹고말하는 식당 백화점 술집은~열고 말이 됩니까~이래서 무슨 코로나 유행을 잡는다는건지 모르겠습니다  전파력이 많은 단체로인해 왜 자영업자 아무 죄없는곳이 큰 피해를 봐야합니까~~왜 전국이~~왜 전곳이~~집합금지대상이 안뎌고 왜 자영업자들만 집합금지가 됩니까~~방역당국~~무슨기준으로 집합금지를 나누셨나요~~저는 이나라와 방역지침책임자들에게 우리가 잚못해서 문닫음이 아니라. 이나라가. 강제집합금지로인해 자영업자들에게막대한 피해를 보게 했음으로 이나라와 방역지침책임자는 이에따른 피해를 전액보상해주실것을 청원드립니다
자의에의한것이아닌 타의에인한 고통은 그 어느누구에도 줘서는 안되는거아닙닙까 누구는 편히 있으면서 돈받고 누구는 죽어라죽어라 해도 벌고싶어도 못벌게. 강제로 집합금지시키고~~
적절한시기와 적절한 방침을 시행치않은 것에 나라는 
이에 따른 피해전액을 보상해 주실것을 청원하는바입니다",NaN,정치개혁,2021-01-18,2021-02-17,kakao
595817,청원종료,코로나 19 2.5단계 5인이상 사적모임금지는 유지하더라도 영업시간제한 해지 좀 해주세요.,1014,"저는 24시간 영업 식당을 운영하는 자영업자입니다.
9월 2주를 포함하여 1월 말까지 12주째 21시~5시 매장내 취식 금지를 하고 있습니다.
코로나로 인하여 매출 감소가 심한데 제한 영업까지 하고 있으니 더이상 견디기가 힘듭니다.
집단감염이 발생하는 곳들은 제한을 덜 시키고 집단감염 발생이 적은 음식점들을 제한 영업 시키는건 
이해하기 힘듭니다.
계속 대출만 늘어가고 더이상 대출하기도 힘듭니다.
코로나 기간동안 손해가 너무나도 큽니다.
지금까지 수많은 자영업자들이 폐업을 하고 있습니다.
이러다간 정말 대부분의 자영업자가 폐업을 하게 될겁니다.
음식점들 방역도 잘하고 환기도 잘 시키고 정부 지침에 잘 따르고 있습니다.
테이블도 대각으로 거리두기하여 손님도 받고 있고 홀이 꽉찰 일도 없습니다.
5인 이상 손님 오시면 너무나도 마음 아프지만 절대 받지 않고 있습니다.
5인 이상 사적 모임 금지만 유지해도 집단 감염이 일어나지 않으니 시간제한만큼은 풀어주세요.
정말 더이상 버틸 여력이 없습니다...
제가 폐업하면 우리 직원들도 실업자가 됩니다.
지금 폐업하는 곳도 많아서 취업할곳도 부족합니다
저희 자영업자들을 좀 살려주세요..",NaN,보건복지,2021-01-19,2021-02-18,naver
595822,청원종료,대통령께 요청합니다,485,"대통령께 드리는 청원의 글 

저는 대전 소상공인 및 자영업자분들이 주로 회원으로 있는 대전경제 살리기 시민운동본부 상임대표 *** 입니다

저희는 코로나로 인한 소상공인 자영업자의 심각한 현실을 함께  보고 느끼고 있습니다

이미 문을 닫은 유흥업은 말할것도 없고, 5인이상금지 및 저녁 9시까지의 시간 제한으로 음식업 및 외식업체의 피해 역시 이제는 더이상 버틸힘이 없습니다

이미 근 1년간의 장기적 적자에 긁어 모을수 있는 돈은 다 털어넣어 이제는 더이상 적자를 메꿀수도 버틸수도 없는 지경에 이르릅니다

몇십만원 일 이백만원의 한두번 지원된 재난지원금은 저희같은 소상공인 및 자영업자에는 임대료 및 관리비 등 수백만원의 적자에 도움이 되질 않습니다

이에 음식업등의 업소 영업 시간 제한을 저녁 10시까지만 더 허용해주시길 간절히 요청 합니다",NaN,경제민주화,2021-01-19,2021-02-18,naver
595829,청원종료,결혼식장 웨딩홀 면적당 인원으로 변경해주세요,460,"안녕하세요.
당장 이번주 예식인 예비신부입니다.

매일매일 속상함에 눈물짓고있는 신부들이 얼마나 많은지 대통령님도 알고계실거라고 생각합니다.
코로나로 인해 1년넘게 결혼준비를 하면서도 축하받을 자리를 죄인처럼 눈치를 보는 2020~2021년의 예비 부부들이 있습니다.

이번 거리두기 2.5단계를 유지하면서 카페와 실내운동의 일시적 완화를 해주신것 감사하게 생각합니다.
제 친한 언니는 카페를 하는 자영업자이고 다른 언니는 요가원을 하는 언니이며 친한 동생은 클라이밍장 직원입니다.
이 완화를 해주심에 주변의 이웃들 얼굴이 환해져서 매우 축하해줬습니다.
그리고 조금은 기대를 가졌습니다.
결혼식장도 웨딩홀과 연회장을 별도로 관리하여 입장인원을 면적당으로 변경해주지 않을까?

결과는 암담했습니다.
수도권 50인 비수도권100인 제한...

비수도권이 본가여서 본가에서 했으면 차라리 100인이라도 들어갈 수 있었을텐데..
이렇게 49인 제한인채로 할거였으면 비싼 서울에서 하지 않았을텐데...
직장 동료들과 초중고 친구들과 양가 친지 가족들이 조금이라도 오기 편하게 하려고 교통의 요지에 잡았는데, 과거의 내 자신이 너무 싫어졌습니다.

존경하는 대통령님.
예전 웨딩홀은 식사를 하며 예식하는곳도 있지만 코로나 시대에는 그렇게 진행 할 수 없어졌습니다.
현재 웨딩홀은 오로지 신랑신부의 결혼식만 진행되며 행사를 하는동안 마스크를 벗는 일도 없고 원판사진을 촬영할때에도 마스크를 벗지 않습니다.

거리두기 단계를 연장하며 세부지침을 형평성있게 조절하신다고 들었습니다.
2단계~2.5단계에서 식사를 하는 장소인 연회장 인원은 기존처럼 제한하시되 예식이 진행되는 홀 안에 들어갈 수 있는 인원은 면적당 인원으로 변경해주시면 안될까요?

사실상 출근하는 지하철 한 칸만 해도 49명이 넘어가는데 그 넓은 연회장에 49명만 들어갈 수 있다는 사실이 너무나도 괴롭습니다.
결혼식이 1주도 안남은 지금, 매일같이 지인들에게 연락이 옵니다.
결혼식장에 내가 가도 되는거냐, 밥 안먹고 얼굴만 보고 축하해줄건데 사진도 못찍고 가서 너무 미안하다.
지인들이 미안해 하니 저도 미안해 합니다.
이 시국에 결혼을 해서 너무 미안하다구요, 결혼식 중계하는 링크를 알려주며 멀리서나마 축하해달라고 합니다.

출산율도 낮은데 결혼하는것조차 너무 힘들어졌습니다.

정총리님이 이 어려운 상황에 힘들게 결혼하는 신랑신부가 대견하여 주례를 해주셨습니다.
앞으로 대한민국의 미래를 짊어진 청년들과 신랑신부에게 부디 응원과 격려의 정책 조절을 부탁드립니다.",NaN,보건복지,2021-01-19,2021-02-18,kakao
595872,청원종료,‘규제 법안’으로부터 소비자의 권리를 지켜주십시오,196,"더불어 민주당이 이번 2월, 정기국회에서 ‘유통산업발전법 개정안’을 처리한다고 예고하였습니다. 지금 우리 모두는 몇 차례의 코로나-19 위기를 견뎌내고 있습니다. 우리나라가 타국에 비해 이 시기를 잘 이겨내는 원인의 한 축에는 대단히 기민하게 발달된 유통업이 있다고 여실히 느낄 수 있었습니다. 이런 코로나-19 대유행의 시기를 살아가는 한 명의 소비자로서 이번 개정안에 대하여 반대 의견을 전하고 싶어 이렇게 청원을 하게 되었습니다.

대기업의 공격적인 유통업 확장에서부터 소상공인을 보호하겠다는 명분 아래 유통산업발전법이 시행된 지 10년이 지났습니다. 저는 지금 대기업과 소상공인이라는 양측의 거대한 담론이 아닌 그것을 선택하고 이용하는 소비자의 입장에서 본청원을 작성하고 있습니다. 이 경쟁에서 소비자의 입장은 늘 소외된다는 기분을 지울 수가 없었습니다. 그럼 개정안의 내용을 하나씩 놓고 반대하는 입장을 설명드리겠습니다.


1. 온라인 유통업 품목 규제 및 영업시간 제한

**, ***, **** 등 온라인 유통판매 플랫폼에 대하여 품목규제 및 영업시간(배달시간)을 규제하겠다는 내용입니다. 소비자의 선택은 쾌적한 시설, 믿고 먹을 수 있는 먹거리, 편리한 주차시설, 접근성 등의 이유로 전통시장에서 대형마트로 옮겨갔습니다. 이제 그런 오프라인의 소비활동을 넘어 더욱더 접근하기 용이하고 이용하기 편리한 온라인 시장으로 옮겨가고 있는 와중에 이런 규제는 시대를 역행하고 있다고 볼 수 밖에 없습니다. 특히나 펜데믹 시기를 잘 견딜 수 있었던 이유 중 하나인 이런 비대면 온라인 시장이 잘 발달된 우리나라가 자랑스럽기까지 했던 소비자로서 대단히 실망스러운 내용입니다. 오히려 모순적이기도 합니다.


2. 복합쇼핑몰 규제

2012년부터 시작된 대형마트 월 2회 휴무의 대상을 복합 쇼핑몰까지 확대한다는 내용입니다. 혹시 ‘몰링’,‘몰들이’ 같은 신조어를 알고 계십니까? 단순히 물건을 구매하는 소비행태가 아닌 외식, 휴식, 문화생활, 영화관람 등 다양한 문화활동을 하나의 복합 쇼핑몰에서 한번에 즐기는 문화활동을 일컫는 신조어입니다. 이런 시설을 갖춘 복합 쇼핑몰은 마치 유럽의 관광형 전통시장처럼 외국에서 우리나라로 관광을 올때, 관광코스로 지정될 정도로 성행하고 있는 우리나라의 문화이자 특징이 되었습니다. 소비자들은 미세먼지를, 극서기의 더위를, 한파를 피할 수 있는 복합 쇼핑몰을 선호하게 되었습니다. 이렇게 이미 많은 시민들이 다양한 이유로 선호하는 복합 쇼핑몰을 규제하는 것이 과연 옳은 것일까요? 소상공인을 보호하겠다는 명분이라지만 이러한 쇼핑몰에 입점한 업체들도 소상공인이지 않습니까.


청원을 작성하며 여러 기사와 인터뷰들을 접했습니다. 누구는 규제의 대상이 되는 유통업계를 대변하기도 하고 누구는 재래시장의 상인들을 대변하기도 했습니다. 그러나 그 어느 누구도 지난 10년 동안 이어진 규제가 성과를 냈다고 말하지는 않았습니다. 더 강한 규제가 법안의 취지인 ‘상생’을 이뤄낼 수 있다고 생각하지 않습니다.


청원을 작성하는 저 또한 그런 소상공인의 입장을 외면하고 싶지는 않습니다. 저 또한 한 명의 자영업자이기 때문입니다. 그렇지만, 이렇게 산업구조가 빠르게 변해가는 와중에 규제가 모든 것을 바로잡을 수 있다고 생각하지는 않습니다. 진정 소상공인 자영업자들과 전통ㆍ재래시장을 돕고 싶다면 부디 소비자의 입장에서 고민해 주십시오. 국회에서 단순히 규제 법안으로 결정하지 마시고, 지자체와 정부가 함께 현장에서 고민해 주십시오.

 [본 게시물의 일부 내용이 국민 청원 요건에 위배되어 관리자에 의해 수정되었습니다]",NaN,미래,2021-01-21,2021-02-20,facebook
