number,progress,title,like,contents,answer,category,sday,eday,proponent
597191,청원종료,자영업을 두번 죽이는 새로운 거리두기 개편안을 반대합니다!!,1558,"저는 서울에서 자영업으로 생계를 꾸려가고있는 국민입니다.
현재 수도권은 작년 11월 24일부터 시작된 방역규제로 인하여, 4달이 지난 현재까지도 규제를 당하고 있습니다.
저희의 생활은 암담함을 넘어서 참혹함 그자체입니다.

폐업을 한다는건 저희에게 꿈같은 이야기입니다.
폐업을 하고 싶어도 임대차 계약기간으로 인하여 폐업을 마음대로 하지도 못합니다.
계약기간에 상관없이 폐업을 진행한다 하더라도, 대출금이 있을시 일시상환을 해야하므로 폐업을 하고싶어도 하지 못하는 처지입니다.
저희에게 폐업 역시 꿈입니다.
폐업하는 사장님조차도 부러울 따름입니다.

대한민국의 자영업자들은 단순히 매출이 줄어든게 아닙니다.
매출이 줄어듬과 더불어, 순이익이 마이너스인 상황입니다.
한달을 장사해도 매달나가는 고정비는 규제이전과 비슷하지만, 저희의 수입은 마이너스인 상황입니다.
1금융권에서 대출을 받으려고해도 하늘의 별따기입니다.
결국 2,3금융권에서 대출을 받아 급한불을 껐다고해도, 신용도하락과 부채증가로 신용불량 및 개인파산으로 내몰리고 있습니다.

3월 9일 정세균 총리께서는 새로운 거리두기 개편안을 내놓는다고 발표하셨습니다.
덧붙여서 “방역현장과 전문가 의견까지 충분히 수렴해 4차 유행을 막을 수 있는 거리두기 조정안을 신중히 결정하겠다.”고 말씀하셨습니다.
저희는 이번에 새롭게 발표될 거리두기 발표안을 이해할수도 수용할수도 없습니다.
새롭게 발표될 개편안을 살펴보면, 업종별 특수성을 고려하지 않은 주먹구구식의 개편안입니다.

1단계에서는 영업시간 자율, 6㎡당 1명의 인원제한.
2단계에서는 영업시간 자율, 8㎡당 1명의 인원제한.
3단계에서는 영업시간 9시까지, 8㎡당 1명의 인원제한.
4단계에서는 영업시간 9시까지, 8㎡당 1명의 인원제한.

새로운 개편안은 자영업자들이 볼때 지금의 방역기준보다 더 강화된 규제이며, 불합리한 이중규제의 성격이 짙습니다.
영업시간의 제한과 인원수의 제한. 두가지를 모두 규제당하게 되는셈입니다.

예를들어.
카페,식당,호프의 경우는 대다수가 10-20평 내외의 매장이 주를 이룹니다.
10평의 경우 4명의 손님 밖에는 받을수 없습니다.
20평의 경우 8명의 손님 밖에는 받을수 없습니다.
이게 합리적이라고 생각하십니까?
이번 새로운 개편안은 휘트니스, 운동시설과 같은 넓은 평수의 매장에 적합한 규제안입니다.
백번,천번 양보해서 국민의 안전과 건강을 위해 협조한다는 명목에 따른다고 하더라도, 저희의 희생에 상응하는 소급적용된 손실보상은 해주셔야 마땅하다고 생각합니다.

현재 정부에서는 그동안의 손실은 재정적한계로 인하여 소급적용은 불가하다고 천명하셨습니다.
소급적용이 불가하다면, 헌법23조에 나와있는 개인의 재산권을 무슨권리로 정부에서 규제를 한다는 말입니까?
정부에서 자영업자들에게 지급해준 재난지원금은 ‘언 발에 오줌누기’ 수준이며, 저희 자영업자들이 입은 피해의 10-20% 수준도 되지 않습니다.

국세청 자료를 참고하시면, 대한민국의 자영업자들이 코로나19 기간동안, 정부의 방역규제 기간동안 얼마나 힘든 상황인지 알수 있습니다.
왜 정부는 국세청 자료를 공개하지 않는지도 묻고 싶습니다.
제가 듣기론 국회의원이 요청해도 국세청에서 자료를 거부한다고 들었습니다.
국세청에서 자료제출을 거부한다면, 국세청을 코로나19 관련한 TF팀에 넣어주십시오.
대한민국의 자영업자들이 얼마나 힘든 하루하루를 살며 버티고 있는지 국민들게 알려야 한다고 생각합니다.

이번 새로운 개편안은 업종별 실제 운영자의 목소리를 담아서 만든 개편안이 아니기에 동의할수 없고 반대합니다.
전국의 어디든 자영업 매장에 가셔서 의견을 물어보십시오.
새로운 개편안에 수긍할 자영업자가 몇 명이나 될까요?

이렇게 피눈물을 흘리고 있는 자영업자의 눈물을 누가 닦아주시겠습니까?
저희는 누구를 믿고 따라야합니까?",NaN,행정,2021-03-26,2021-04-25,naver
597212,청원종료,세무서의 가산세 유예기간 및 고금리를 저금리로 조정을 청원합니다,288,"금천구 가산동에서 소규모 자영업을 하고있습니다
2019년 말경 코로나 사태 발발시점에 대금을 받기위하여 발행한 세금계산서가있습니다  발행후 결재가 안되어 아직까지 대금을 받지 못하는 상황입니다  대금이 1억4천만원 정도이며 부가세가 1천4백만원에 입니다 많은분들이 어려운 2020년을 보낸 가운데
일을하고 싶어도 일이없는 상황입니다 부가세를 안내고싶은게 아니라 결재를 못받는 상황에 업친데 덮친격으로 
코로나로 인하여 일이 적어지고 그중에서도 한달에 100만원~200만원씩을 납부하였으나 15%이상의 가산세를 물어야하는 상황입니다 가산세가 매달 150만원정도 나오니 세금이 줄어들지 않고있습니다
조금 일해서 직원 월급주고 부족하면 부가세로라도 직원 급여를 주고있는 상황입니다 어려운 경기현실속에서 
15%이상의 금리는 너무한거 아닌가 합니다 
유예기간 과 저금리로 조정이 필요하다고 보여지는 시기입니다
도와주세요",NaN,행정,2021-03-26,2021-04-25,naver
597223,청원종료,금소법 6대판매원칙중 광고에 대한 부분이 불합리적입니다,650,"안녕하세요 저는 보험설계사라는 직업을 8년동안 하고 있습니다.

최근 금소법 시행으로 인해 이쪽 업계는 어수선합니다
6대 판매원칙 적합성, 적정성, 설명의무, 불공정행위금지, 부담권유금지, 허위/과장광고금지가 시행되는걸로
알고 있습니다. 

당연히 소비자를 위해서 시행되는것은 좋지만 이중에서 저는 광고에 대한 부분이 아직 가이드라인이 나오지도 않았고
어떻게 시행될지 윤곽이 나오지 않았다고 들었습니다.

광고라는 부분이 우리가 원하지 않는 상태에서 갑자기 원치 않은 부분이 나올때 광고라고 알고 있습니다.

저는 8년동안 블로그에 정보성글을 올리며 일을 하고있습니다.
(제 글로 인해 도움을 드렸던분들도 엄청 많습니다)

여기서 말씀드리고 싶은것은 블로그나 유튜브의 경우 고객이 원하는부분을 검색해서 정보를 찾고 영상을 볼수 있는것이고 여기서 내가 원하지 않은 부분이 나왔을때는 언제든지 바로 클릭해서 그 화면에서 나올수가 있습니다.
즉 일반적인 광고랑은 다른부분이 있다는것이지요

그리고 만약 모든 광고가 심의를 봐야한다고 공지가 되었는데.. 이 부분도 일처리에 있어서 합리적이지 않습니다

전국에 몇십만명에 보험설계사가 있는데 그 많은 블로그글과 영상의 심의를 바로바로 해줄수 있는 인력도 없을것이고 만약 심의를 올릴때 그 1건당 일주일이상 걸린다면 한달에 4번을 올릴수 있거나, 그 광고심의가 거절된다면 온라인상으로 일을 하는 설계사들은 실망감 + 일처리를 바로바로 할수 없게 될것입니다.

차라리 블로그나 유튜브 같은경우 일일이 확인이 힘들기떄문에 가이드라인에만 지켜서 글이나 영상을 올릴수 있다면
신고를 당해도 문제가 없는것으로 정해져도 좋을듯합니다. ( 일반적인 보험싸이트 이런부분은 당연히 심의를 받고 진행하는게 맞다고 생각됩니다)

또한 이런부분들떄문에 블랙컨슈머라는 사람들과 많은 불량신고 업체들이 생겨날겁니다 (이 부분도 큰 문제입니다)

그리고  코로나로 인해 자영업자, 취업을 못하고 있는분들 등 많은분들이 힘들어하고 있습니다.
대통령님이 말씀하신 일자리창출이 아닌 많은 보험설계사들이 더 힘들어질거라 생각됩니다 

두서없이 긴글을 작성했지만 아직 금소법에 광고부분이 가이드라인이 안나온상태에서 이부분 꼭 검토할 필요가 있습니다.  부탁드립니다.",NaN,일자리,2021-03-29,2021-04-28,naver
597254,청원종료,엄벌해주세요,390,식당을운영중인자영업자입니다 오늘낮에단체로여럿이마스크도안쓰고들어와나눠앉겠다고하니까아들이마스크착용해주세요말하고4인이상단체는받을수없다고말했다가폭행을당했읍니다지금코로나로인해모든국민이힘들고방역수칙잘지켜서빨리일상을회복하고싶은이런시국에이런개념없는사람들로인해방역이무너지고또한방역수칙을묵묵히지키는모든자영업자들이더욱힘들어집니다이자들은오히려저에게구청에지속적으로민원넣어서가게문을닫게만들겠다고협박까지하더군요이러한이기적이고반사회적인사람들은엄벌에처해서방역의엄격함을세워야합니다,NaN,보건복지,2021-03-29,2021-04-28,kakao
597274,청원종료,인테리어사기!! 강력한 처벌법 만들어주세요??,403,"최근 허술한 법을 악용한 인테리어 사기로 소비자는 물론 관련업종 자영업자들까지 
금전적 피해는 물론 정신적 피해가 심각해 법개정을 통한 강력한 처벌이 필요합니다.

급기야 인테리어 사기로 피해를 본 소비자들이 자구책으로 인테리어 사기꾼 공유 
카페까지 만들어 인테리어 관련 사기꾼들과의 법적대응을 공유하는 실정에까지 
이르렀을 정도로 사기가 광범위하고 무차별적으로 자행되고 있습니다.

피해자들을 가장 분노케 만드는 것은 분명히 금전적, 정신적, 육체적 피해 사실이 
명백함에도 충분한 법적 보호를 전혀 받지 못하는데서 오는 허탈감입니다.

퇴직금을 털어 카페 차린 정년퇴임 선생님, 아이들이 좀 더 쾌적한 환경에서 자랄 수 
있게 한 푼 두 푼 모아 집꾸밀 꿈에 부풀어 있던 엄마, 시골에 계신 부모님에게 작은
입식 부엌선물을 기대했던 딸, 보금자리를 꿈꾸던 신혼부부. 다 우리 이웃이고 내 
가족일 수도 있습니다.  

그런데 각자 희망에 부풀어 있던 소비자들은 일단 공사가 시작되면 자기 돈 을 
쓰면서도 또 어떤 이유를 들어 불시에 공사가 중단될지 몰라 사기꾼들 비위를 
맞추려 전전 긍긍하며 을이되야하는게 현실입니다.     

수법으로는 크게 계약금이나 중도금 받고 공사 자연 또는 중단 잠적, 계약 외 
추가공사비 지급요구, 저급자재 사용으로 인한 부실공사후 잠적, 불법 편법 
개조 유도 공사 후 신고 협박, 하청업체 공사비 미지급 및 잠적 등으로 법이 
허술해 수법도 다양하고 대범해 지고 있습니다.

사기꾼들이 이처럼 점점 대범해지는 데에는 허술한 법적용도 한몫하고 있습니다.
일단 웬만한 피해로는 인테리어 업자를 사기로 형사고소가 결코 쉽지않다는것입니다.

법률적 의미로 사기란 '그릇된 사실을 통해서 남들을 기만하고 이를 통해 금전적인 
이익을 편취하는 것을 말함'이라고 되어있습니다.

당초 합의한 인테리어의 차질 없는 진행을 전재로 소비자들이 지급한 돈을 받고
고의 공사지연과 연락두절, 공사기간 초과, 부실공사 등은 명백한 사기 아닌가요?
게다가 부실한 공사로 인해 사람까지 다쳤다면 이는 사기를 넘어 명백한 미필적
고의에 의한 범죄행위입니다.

그러나 대부분 형사건 적용이 않되 민사로 지루한 싸움을 이어가다 중도 포기하고 
있는 실정입니다. 
이유는 단 하나 공사가 일부라도 진행돼 있다는 이유에서 입니다. 다시 말해 계약금
받고 시멘트 몇 포대 현장에 싸놓고 대충 하는 척만 해도 이는 사기적용이 안되고 
심지어 전체 공사비에 80%가 넘게 지급됐는데 반해 공정률이 20%여도 이는 사기죄가 
적용 안 됩니다.  

배고픔에 빵을 훔친 청년도 징역을 살게 하는 법치국가에서 이게 무슨 말도 안 되는
유권해석입니까?
이러는 사이 인테리어 사기꾼들은 어느새 우리이웃 내 가정에까지 마수의 손을 뻗고
있습니다. 지금 주위를 한 번 둘러보세요. 내 주위에 피해자가 얼마나 많은지.... 

인테넷 검색만해도 수백건의 피해 사례들이 올라오고 있는데 대체 관련부처는
손을 놓고 있는건지 알면서도 묵인해주는건지 모르겠습니다.

대다수 많은 피해자들은 지금 이 시간에도 금전적 손해와 정신적 트라우마에 하루 하루를 
괴로워하고 있는데 반해 사기꾼들은 지금 이시간에도 새로운 먹이감을 찾는 하이에나처럼 
우리 주변을 어슬렁 거리고 있는현실입니다.

관련기관과 국회는 하루속히 우리 사회의 신의와 믿음을 깨버리는 암적인 존재 인테리어 
사기꾼들에 대한 처벌법 개정을 강력히 촉구합니다!!",NaN,교통/건축/국토,2021-03-30,2021-04-29,kakao
597278,청원종료,4차 버팀목 플러스는 지원금인가요 보상금인가요?,3557,"오늘 4차지원금 소상공인 버팀목자금 플러스 신청이 시작되었습니다.

영업제한업종에 속한 사업자중 매출이 오른경우 미지급이라고 
오늘 정확하게 안내가 되었네요.

영업제한은 나라에서 사업자의 영업권리를 강 제 적으로 제한한건데요,

이 버팀목 플러스가 '지원금'이라면 매출이 오른 사업자는 못받는게 맞다고 생각하지만

영업제한에 대한 '보상금'이라면 매출감소여부 상관없이 모두 지급되는게 맞다고 생각합니다.

영업제한이 되어도 매달 돌아오는 대출금납입날짜, 월세, 공과금등을 벌기위해
쉬지않고 이리저리뛰며 매출 올려놓았습니다. 
그로인해 순이익은 줄고 매출만 올랐네요.

이럴줄알았다면 문닫고 한달 쉬고 지원금 받는게 더 현명했을 것 같습니다.

질문합니다. 오늘 신청시작한 소상공인 버팀목자금 플러스는 지원금인가요? 보상금인가요?

만약 긴급한 상황에 놓인 사장님을 위한 지원금이라면
나라에서 강행한 영업제한에 대한 보상금은
언제 지급이 되나요?

사업자들이 나라에서 강제적으로 진행한 영업제한을 그래도 따른 이유는 코로나를 빨리 종식시켰으면 하는 바램으로
지켰습니다. 부디 올바른 행정을 하시어 자영업자들이 이런 제한을 잘 따를 수 있도록 해 주세요.",NaN,행정,2021-03-30,2021-04-29,naver
597326,청원종료,단기 고용보험가입자도 4차 재난지원금을 지급해주세요.,796,"저는 작년까지 지방 고등학교에서  시간 강사로 일한 사람으로 현재는 실직 상태인 프리랜서 강사입니다. 

중,고등학교의 시간강사는 주로 중,고등학교의 파트타임으로 수업을 하거나  1년 단위 계약으로  여러 가지 경우의 채용이 있으나, 일반적으로 학교에서 급하게 기간제 교사를 채용 못 하거나 선생님들의 병가, 혹은 결손으로 인해  단기적으로 채용으로  보통 이전 담당 선생님의 수업시간을 이어 받아 단기간으로 수업을 진행하게 됩니다.
대부분 학교의 시간강사는 고용보험에 가입되지 않은 방과후 교사, 학습지교사, 보험설계사....등 과 별반 다르지 않는 특수고용 형태이나 특별한 경우 단기적으로 고용보험에 가입되는 경우도 존재 하게 됩니다. 
이전 담당 선생님의 시수가 주당 14시간을 초과하거나 월 60시간 초과 시 자동으로 고용보험 및  4대보험을 가입하게 됩니다. 
그런데 이때 고용보험에 가입되더라도 사실은 실업급여를 받을 수 있는 조건이 되지 않지만, 현재는 단기적 고용보험 가입자들은 특고 프리랜서 재난지원금 지급에서는 배재되고 있습니다. 

물론 저보다 더 힘들고 지친 영업 제한 피해 자영업자분들이나 특수고용층이 있다는 걸 모르는 것은 아니나,  
지금까지 지급 된 2차 3차는 물론 이번 4차 재난 지원금 또한 받지 못하는 단기적 고용보험 가입 특고-프리랜서 강사, 혹은 다른 직종의 단기 고용보험 가입자들에게 재난 지원금을 지급해주시길 청원합니다.

실업급여 지급조건은 이전 18개월간 6개월 이상(가입일수 180일)의 근무기간과 비자의적 퇴사를 통해 지급되는데 그 조건에 해당 되지 않지만 코로나19의 피해로 어쩔 수 없이 1-2개월의 단기 고용보험 가입이나 단기적 근무로 인해 계속 2 차, 3 차, 4 차, 지급되는 재난지원금의 수령을 제한하고 있습니다.

아래링크의 기사에서와 같이 방과후강사 노조가 지난 해 방과후강사를 대상으로 한 설문조사에 따르면 응답자 1500명 중 2차재난지원금을 신청하지 못한 사람은 67%, 그 중 696명의 사유가 고용보험가입 이라고 답했듯이 현재 지급되는 재난지원금의 사각지대가 너무 많습니다. 물론 정부는 재난지원금이 실업급여의 성격을 가져 고용보험 가입자에겐 지급할 수 없는 입장이라고는 하지만 고용보험의 해택은 분명히 위의 조건과 같은데 일회성,혹은 단기적 1-2달의 고용보험 가입이 현재 지급되는 재난지원금의 무슨 관계가 있는지, 혹시라도 단기적 가입기간에 따른 실업급여가 지급이 되다면 재난지원금 배제사유가 되지만 특정 1-2달 고용보험가입으로  실업급여도, 재난지원금도 못 받게 된는 특고-프리랜서는 너무 불공평한거라 생각됩니다. 

지난 10월-11월에 고용보험가입 하지않고, 현재는 이전보다 수입이 현저히 줄은  기존 특고-프리랜서를 50만원씩, 신규는100만원 씩 지급하는 방식은 2, 3 ,4차 동일하게 적용되고 있고 매번  신규 수급자가 늘어 4차에선 70만 명 정도라 뉴스에서 보고, 지난 3차와 이번 4차 재난지원금은 왜 기준 날짜(지난해 10월-11월)가 같은지 알 수 없습니다.

물론 좋은 방식이고 선별의 시간이나 담당 공무원들의 고충은 이해가 되나, 고용보험 가입기간여부, 고용보험 가입 사실 확인서, 실업급여 수령 여부,등 간단한 서류로도 이전 1년이상의 기간을 고용보험의 가입,상실 이나 이후 해택을 확인 할 수 있는데 ,왜 굳이 고용보험 가입일수를 특정한(기간) 달 10일 20일 이렇게 제한해서 지급해야 되는지 알 수 없습니다.
실업급여를 수급하면 더 좋지만 실업급여 수급조건이 안되는 특고층 또는 타 직종 단기 고용보험 가입자이라도 현재는 무직이나 수입이 현저히 감소한 사람도 포함시켜서 재난지원금을 지급해주세요. 

정부의 재난지원금은 코로나19 피해로 인해 현재 소득이 없는 혹은 소득이 감소한 대상을 위해 지급 되어야 함에 단순비교는 아니지만 1-2개월 단기 고용보험가입 실직자가 힘든 것인지 현재 소득이 감소한 것이 어려운 상황인지 판단하기 힘듭니다.   

2021년 3월 26일 20조가 넘는 금액의 4차 추경에 특고층-프리랜서도  재난지원금을 지원하겠다고  발표 후 시행공고문을 확인해 본 결과 역시 2020년 10월 11월 고용보험 가입 20일 이상인 사람은 3차와 같이 재난지원금을 받지 못하게 되어있고 이는 지난 3차 재난 지원금의  고용보험 가입 시기와 동일하여 혹여 지난 2020년10월 11월에만  일할 수 있었던 나와 같은 사람은 3차 4차 재난지원금에서 제외되고 12월 -1월에만 일한 고용보험 가입자는 받게 되는 말도 안되는 경우가 만들어 집니다. 이처럼 10월,11월 가입자는 재난지원금에서 제한되고 비슷한 경우로 8월- 9월, 12월- 1월 가입자는 지급되는 이런  불공평한 특고 프리랜서 재난지원금의 지급 경우를 다시 확인해 공평하고 최대한 사각지대가 없는 지급을 바랍니다.

1년이 넘는 코로나 19로 전 국민이 힘들고 국민의 세금으로 재난지원금을 지급하는데 혹시  사각지대와 불공평함은 없어야 됨을 생각해주시고 빠른 코로나 19 종식을 위해 힘쓰시는 모든 분들께 감사한 말씀을 드리며  긴 글 읽어주셔서 감사합니다.",NaN,보건복지,2021-04-01,2021-05-01,naver
