number,progress,title,like,contents,answer,category,sday,eday,proponent
587963,청원종료,**항공 좌석배정의 투명성확보과 항공권가격결정의 기준을 알고 싶습니다,130,"미국에서 유학중인 제 자식이 코로나19 사태때문에 미국에서 최대한 빨리 귀국을 해야 하는 형편에 처해 있는 평범한 대한민국 국민입니다. 대한민국 국적기인 **항공의 항공권발매의 투명성 결여와 이러한 위급한 상황에서 국민의 안전보다는 항공권가격을 무지막지할 정도로(5배이상)인상하는 것을 보고 국민의 한 사람으로서 화가 치밀어 글을 올립니다. 저는 아들의 항공권을 마일리지로 구매를 했습니다. 미국내의 코로나19 확산이 무서울 정도로 번지고 있는 상황이라 저의 애가 타고 올 정해진 항공권 날짜보다 하루라도 앞당기고 싶어서 **항공에 전화를 걸었습니다. 홈페이지 상으로는 아직 앞선 날짜의 좌석이 여유가 있는데 날짜를 앞당길 수 있는지를 직원에게 물어보니 그것은 시스템상의 문제라 알 수가 없다는 황당한 답변이었습니다. 그렇다면 우리 고객의 입장에서는 미리 판단하고 예견할 수가 없는지를 물어보니 돌아오는 답변은 ""알 수가 없다"" 라고 합니다. 또한 워싱턴에서 인천으로 오는 항공권가격을 알아보니 황당할 정도로 가격을 높아서 마일리지표를 포기하고 현금으로 구매해서라도 아들이 하루라도 빨리 귀국시키겠다는 생각은 포기했습니다. 편도기준으로 일반석 (400만원~500만원), 프레스티지석(1000만원~1300만원)가격은 경악할 정도의 가격이어서 말문이 막힐 정도였습니다. 더구나 좌석이 남아 있더라도 판매석과 마일리지석은 구분되어 있기 때문에 판매되지 않고 자리가 있다하더라도 마일리지석으로 대기한 고객에게는 기회가 없을 수도 있다고 답변을 들었습니다.
극단적으로 판매되지 않은 빈자리가 10석이 있다하더라도 마일리지석으로 대기되어 있는 사람에게는 좌석부여의 기회가 없을 수도 있다고 합니다. (좌석배정이 시스템으로  운영되기 때문에 직원들도 알 수가 없다는 답변만 반복함) 첫째, 고객의 입장에서 바라는 바는 고객의 입장에서 납득할 수 있는 항공권 발매의 투명성 확보(판매석, 프레스티지석, 1등석, 마일리지석 포함/ 고객의 좌석배정 순번포함)는 최소한 **항공이 제공해야한다고 사료됩니다.둘째, 코로나19와 같은 세계적 대재앙에서도 돈을 벌려는 국적기인 **항공의 행태에 너무 화가 납니다. 최소한 어느 누구도 예측하지 못한 이런 사태에서 정치 경제적으로 온 국민이 단합해야 할 시기에 자본주의의 최첨단을 치닫는 **항공의 자세는 분명히 대한민국 국적기 회사로서의 행동은 아니라고 생각합니다. 

국민청원자 대한민국 국민올림

 [본 게시물의 일부 내용이 국민 청원 요건에 위배되어 관리자에 의해 수정되었습니다]",,교통/건축/국토,2020-04-10,2020-05-10,naver
587964,청원종료,폴란드 현재,177,"안녕하세요 
코로나 19때문에 고생들이 많으십니다.
다름이 아니라 헝가리 에서 일끝내고  폴란드 브로츠왓츠 **화학에 도와달라는 요청에 출장을 와서
일을 끝내고 한국에 귀국하려니 폴란드 LOT항공사는 한국에 못간다며 항공편을 취소하고 요금은 돌려주질않고
폴란드 정부는 모든이동 수단을 차단했고 **화학 공사현장은 코로나 19 확진자가 발생을해도 공사를 진행하는 중이라 하청 업체들은 눈치만 보는 상황이고 업체 직원들은 불안해 하면서 일을하지만 빨리 귀국하고 싶은 심정으로
하루하루 보냅니다.
다른나라에 있는 교민 및 출장자들은 정부에서 귀국시켜주시는 것을 뉴스에서 상황을 파악하며 지내는 중입니다.
일은 끝냈지만 귀국하는 교통수단이 막혀서 오도가도 못하고 숙소에서 대기하며 있습니다.
폴란드쪽에도 대책을 부탁드립니다.

 [본 게시물의 일부 내용이 국민 청원 요건에 위배되어 관리자에 의해 수정되었습니다]",,교통/건축/국토,2020-04-10,2020-05-10,naver
587965,청원종료,정부 무상복지 혜택 전혀 못받는 성실납세 국민 등에 대한 특별수당 신설을 제안합니다.,240,"문재인 정부 들어서서 취약계층이다
저소득층이다 해서 갖가지 명목으로 국가에서 혜택을 많이 부여하고 있습니다. 
그런데 정작 경제활동 열심히 하고 국가에 조세납부 성실히 하는 국민계층 중엔 정부 혜택이라곤 전혀 못받는 국민들도 많이 있습니다.
사실상 이런 국민들이 있기에 나라재정이 지탱해 나가는 건 분명한 사실 아닙니까?
이들에게도 복지형평성 차원에서 자긍심 느끼도록 국가에서 일정부분 혜택을 부여하는 게 맞다고 봅니다!
하다 못해 1인당 연간 10~20만원 이라도  무상복지 혜택 부여할 것을 정부에 건의 제안
합니다! 
국가에 대한 재정부담 의무만 있고 희생만 강요당하고 혜택은 전혀 없는 건  어찌보면 형평성에도 맞지않고 일종의 역차별이 될 수 있다고 봅니다.
수당으로 하든 다른 명목으로 하든 취지에 맞게 지급하면 될 것이고..
지급대상은 국세 지방세 등 조세와 건강보험료 등 준조세, 차량범칙금  등 범칙금과 국가와 지자체에서 부여한 과태료 등 각종공과금 성실납부자를 대상으로 하면 적절할 듯 싶습니다.
기존에 국가나 지자체에서 지급하는 각종 무상복지 혜택을 입는 자, 노령수당 수령자, 실업급여 수령자 등 혜택을 받는 국민은 제외
합니다.
대상을 이렇게 정하면 성실납부를 유도할 수도 있고 국가의 각종 체납도 상대적으로 줄어 드는 효과도 기할 수 있을 것입니다.",,보건복지,2020-04-10,2020-05-10,naver
587966,청원종료,아직도 입원중인 **번 확진자의 병원비 구상권 청구 청원합니다.,2109,"대구 경북에 코로나 확산을 시작했던 신천지 **번째 확진자가
기침이 있다. 열이 나는 것 같다. 기운이 없다. 이런 말을 하며 44일 넘게 퇴원을 안하고 있습니다.
현재 병원비로만 3000만원이 넘게 나왔는데
이를 국민들의 혈세로 낼 수는 없습니다.
안그래도 신천지 **번 확진자로 인해 더 심해졌는데
반성은 없이 자신 덕분에 경각심을 얻었다는 파렴치한 말을 하고 있습니다.
이 신천지 확진자로 일상생활이 무너졌는데 우리의 혈세로 이사람의 치료비까지 전부 대줘야 한다고 생각하니
너무나 억울합니다.

 [본 게시물의 일부 내용이 국민 청원 요건에 위배되어 관리자에 의해 수정되었습니다]",,보건복지,2020-04-10,2020-05-10,naver
587967,청원종료,도와주십시요~~국민여러분 한분 한분의 도움이절실합니다~~,1480,"안녕하세요
저는 울산L택배회사에서 
배송을 맡고있는 택배기사의 와이프입니다 


도와주세요 아니 살려주세요


하루하루가 너무 고통스럽고 초조하고 심장이 두근거립니다 
매일같이 초점없는 눈빛으로
힘없이 배송을 다니는 신랑을 보면
가슴이 갈기갈기 찢어집니다
해맑게 웃으며 
자전거가 갖고 싶다는 아들을 마주하면
피눈물이 쏟아집니다 


저희부부는 택배기사로 근무한지 올해로 4~5년쯤되어갑니다 
그동안 지속적으로 
초기와는 다른 단가하락이 수차례 이루어졌고 
최근에는 개당 수수료 80원인하 재계약 제의를 받았습니다 
당연히 그만 둘 거라고 생각하셧겠지만 
저희부부 포함 대리점 식구들은
짜르지만 말아 달라며 발버둥쳤습니다 


그럼에도 불구하고 
얼마전 저희 대리점은 L택배 관계자로 부터 
열흘정도의 시간을 두고 총3차례
각기 다른내용의 내용증명서를 받게 되었습니다 
그 내용은 이러했습니다 
1. 영업실적저조 분발요청 내용증명 
2. 재계약수락내용증명 
3. 계약해지통보내용증명
영업실적이 저조하니 힘쓰자
얼마 있지않아 재계약하겠다 열심히 하자말하더니 
갑자기 어떻게 무슨이유로 나가라고 할수가 있는걸까요  


저희는 매일을 센터에 설치된 
수십대의 CCTV로 감시를 받아왔습니다 
L택배 관계자분께서 CCTV를 휴대전화로 보며 청소지시를내리시면
지게차로 들어올리는 
무거운파렛트를 여럿이서 손으로 옮겨가며 청소를 했고
센터내에있는 화장실청소 쓰레기 분리수거 등 
시키는 대로 열심히 일해왔습니다 
배송 반품 집하등 할일이 넘쳐나는상황에서 
부당한 갑질에도 묵묵히 일만했습니다 


여름엔 살인적인 무더위를 선풍기 한대에 의지해야했고 
겨울에 찬바람을 맞으며 
핫팩을 온몸에 두르고 여려명이 기름난로 하나에 의지하며 
길게는 7시간씩 분류작업을 하고
다시 배송을 나가고 생계를 위해 열심히 뛰어왔습니다 
L택배 관계분이 센터 안전점검 나온다고 하시면
그 난로 마져도 
저희는 택배차에 싫고 배송을 나가던게 한두번이 아닙니다 


저희는 아파도 다쳐도 맘편히 쉴수 조차도 없었습니다 
용차를 부르게 되면 저희가 받는금액보다 높은 금액을 드리고 일을 맡길수밖에 없으니까요   
출근하고부터는 아침밥은 커녕 점심밥도 분류작업에 치이고 
배송시간에 쫏겨 삼각김밥 하나 먹고 배송을 갑니다 
이런생활이 하루이틀이아니다보니 배도 고프지 않습니다 
그마저도 일할수 있어 
감사했습니다 행복했습니다 


저희는 대체 무슨잘못을 한걸까요..


이 일이 있고부터는 아침에 출근이 너무 괴롭습니다 
다른대리점 택배기사님들은 
저희와 인사하는것조차도 눈을 마주치는것 조차도 
슬금슬금 눈치를 보며 피하십니다 
왜들 그러시는걸까요? 저는 알고 있습니다 
혹시나 계약해지된 저 지점식구들과 가깝게 지내면 
다음엔 내가 되지않을까 하는 마음에서죠
저 또한 이번상황이 아니라면 똑같았을겁니다  
그분들도 한가정의 가장이고 
아이들의 아빠엄마이기 때문입니다 
같이 나서서 부당함에 대해 목소리를 내고 싶어도 
다음계약해지는 자신일수도 있다라는 것도 
분명히 알고들 계실테지만
나설수 없는 심정 백번 이해가 됩니다 


이제는 신경안정제가 없이는 잠도 못자고 
대낮에도 심장이 이유없이 두근거려 
청심환을 트럭에 항상 가지고 다닙니다
이 모든일이 여느날처럼 악몽이길 
신랑이 등을 토닥이며 별꿈을 다꾼다고 
환하게 웃어줬으면 좋겠습니다
개인사업자 특수노동자라는이유로 
법적인 보호조차 받지 못하는 상황이 너무 한탄스럽습니다  


사랑하는 한 아이의 엄마로써 
이런생각하면 안된다는 것 알고 있지만
하루 열두번도 죽고싶은 생각이 들고
내가 이러면 안되지 하며 매번 마음을 다잡습니다 
직장을 잃게 되면 
저희는 이제 무슨일을 하며 생계를 유지해야 할까요 
너무 막막합니다 


사랑하는 가족들 동료들 지켜주고 싶습니다
그러나 제겐 아무 힘이 없습니다
여러분들이 제발 제발.... 도와주세요",,일자리,2020-04-10,2020-05-10,naver
587968,청원종료,선거 시에 일회용 비닐장갑 사용금지합시다!,331,"코로나로 택배가 늘고 배달음식에 쓰레기가 넘쳐나고 분리수거 환경도 갖춰져 있지않고 
재활용 시스템도 환경규제도 없다고 볼 만큼 미비한 상황에서..

국회의원 선거 때 코로나 19 바이러스로 일회용 비닐장갑을 사용한다고요????????
최소 몇 천만의 비닐쓰레기를 생산하고 시작하는 국회의원 선거에 조금만 생각을 하더라도 환경오염을 최소화할 수 있습니다.
손 세정제를 입구에 비치해 들어오는 시민들에게 제대로 닦기만 해도 충분합니다. 비닐장갑 쓴다고 밀폐된 공간 안에서 바이러스에 안전하지 않습니다.

환경은 이미 급속도로 악화돼가고 있습니다. 
위기에 한 몫 더 보태지말고 
일회용 사용, 나라가 나서서 규제 좀 합시다!!!",,안전/환경,2020-04-10,2020-05-10,naver
587969,청원종료,쌀 수출 반대 및 사재기 방지 국가 정책 수립 요청,518,"메뚜기떼로 인해 
베트남 등 각국에서 
쌀 수출 금지령이 떨어졌습니다. 

곧 식량난이 다칠 것입니다.
여러분!! 
유튜브에서 '메뚜기' 검색해 보세요. 

정부는 
빨리 수출 금지 및 사재기 방지를 위한 신속한 국가 대책을 수립으로 국가적 혼란을 막아주십시오. 

꼭 전문가들을 동원하여 신속하고, 
심도 깊은 논의를 하여 
국가적 혼란과 형편이 어려운 복지 사각지대의 국민들이 어려움을 당하지 않게 해주세요. 

특히, 
특정 기업 몰아주기, 
중국 기업 끌어들이기 하지 말고 
순수 국가 시스템을 활용해 주세요. 

지금 서두르지 않으면 
마스크처럼 수출 다되고 
나중에 부족현상이 오도록 정부가 
방치했다고 생각할 겁니다.
제발 서둘러 주세요. 

국민들은 덮어놓고 정부를 믿기만 하지 않고 
항상 살핀다는 사실을 잊지 말아 주십시오.",,행정,2020-04-10,2020-05-10,naver
587970,청원종료,주거용 위반 건축물 적법하게 양성화하고 전세금 대출 승인 청원,718,"안녕하십니까.  
공공의 복리와 국민의 삶의 질 향상을 위해 다양한 건축 관계법 규정을 마련하시는 
노고에 감사 인사를 드립니다.

다름이 아니옵고, 주거용위반 건축물(빌라)에 그동안 허용 되었던 전세금대출을 승인하고 적법하게 양성화해야만 서민들이 잘살 수 있습니다.
2019년 바뀐 부동산 정책을 경제적으로 빈곤한 서민들을 위하여 수정하여 주시기 바랍니다

저는 강동구 천호동에 작은 빌라를 개인 소유하고 있습니다. 
매입 당시 창고 일부가 확장되어 건축물의 위반된 사실을 모르고 임대를 준 실정입니다
현 세입자가 OOB년동안 살다가 자가주택을 매입하여 이사를 가고자 새로운 세입자를 찾고 있으나, 
2019년에 바뀐 부동산 정책으로 인해 주거용 위반 건축물의 전세금 대출이 전면 금지되어 현 세입자가 새로 이사갈 집의 계약금 6천만원을 고스란히 날릴 위기에 처해 있습니다.  

해당 주택의 경매 절차를 세입자가 준비하고 있기에 빌라 소유자인 저도 고충을 겪고 있지만 세입자의 고통이 날로 가중되고 있습니다. 

제가 세입자 입장에서 해결해줄 수 있는 상황이면 좋겠으나 그럴수 있는 상황이 아니기에
이렇게 간곡히 청원을 올립니다.

국민의 삶의 질 향상을 위해 바뀌는 부동산 정책이 되어야 하나, 선의의 피해자가 발생하는 서민이 있어서는 안된다고 생각합니다.

현재 이러한 이유로 많은 서민들이 고통을 당하고 있고, 서민들이 주로 이용하는 주거용까지 확대하여 정책을 적용시키는건 너무 가혹하다고 생각합니다.

다시 한번 간곡히 청원드립니다.  

부디 현 상황을 파악하시어 개선해 주시면 감사하겠습니다",,행정,2020-04-10,2020-05-10,naver
587971,청원종료,"""Drive in Concert""를 활성화 시켜주세요!",129,"보릿고개를 겪고 있는 공연, 예술, 영화계를 위해 ""Drive in Concert"" 장을 만들어 주세요!

문화체육관광부에서 공연 피해 업계에 긴급생활자금을 지원하고 있으나, 코로나 사태의 장기화가 예상되는 만큼 생계에 어려움을 겪는 공연예술인들은 점점 더 늘어날 것입니다.
이를 조금이나마 해결하기 위해 곳곳의 공터와 광장, 공공기관 및 공항 등의 주차장, 공원, 야외 스포츠 경기장 등을 ""Drive Concert"" 장으로 만들면 어떨까요? (자동차 극장 같이요!)

영화, 연극, 무용, 음악회에 종사하는 분들에게는 희망을, 그리고 시민들에게는 안전한 문화생활을 선물해주세요!!

(추가로 코로나 바이러스와 관련한 참신한 아이디어를 받을 수 있는 청원 카테고리도 별도로 개설해주세요!)


- 주말에는 이런 식으로 드라이브인 예배로 활용할 수도 있을 것 같습니다.
http://www.hani.co.kr/arti/area/capital/933628.html
- 성동구 살곶이 공원 자동차 극장 변신! 너무 좋은 모범 사례입니다.
https://www.yonhapnewstv.co.kr/news/MYH20200328009800038?srt=l&d=Y

- 많은 공연이 전멸 수준이라네요 ㅠㅠ
https://www.yna.co.kr/view/AKR20200304147900005
https://www.edaily.co.kr/news/read?newsId=01289046625703320&mediaCodeNo=257>rack=sok

- 자동차 극장을 참고해 주세요
https://news.joins.com/article/23737466

- 문체부 지원 문화예술계 지원 관련 기사입니다.
https://www.classian.co.kr/news/articleView.html?idxno=4153",,문화/예술/체육/언론,2020-04-10,2020-05-10,kakao
587972,청원종료,동물학대 유발하는 동물약국 백신 판매 막아주세요.,1643,"이 기사 보셨나요?

부산에서 끔찍한 동물학대 사건이 발생했습니다. 

https://news.naver.com/main/read.nhn?mode=LSD&mid=sec&sid1=102&oid=421&aid=0004525054

무려 고양이 253마리를 불법 사육하던 불법 업체가 적발되었고, 경찰이 압수수색한 결과, 일회용 주사기와 동물용 백신을 이용해 고양이에게 수차례 주사행위를 하는 등 무자격 진료행위를 일삼았다고 기사가 나왔습니다.

어처구니없게도 동물약국에서 누구나 주사기와 반려동물 백신을 살 수 있어서 이런 일이 벌어졌다고 합니다.

기사를 꼭 읽어보세요.

개와 고양이 전용 일부 백신 등 약물은 처방전 없이 동물약국에서 구매가 가능한 게 현 상황이라고 합니다. 
주사기를 이용한 진료행위는 불법이지만, 약물 구매는 가능한 아이러니한 상황이 벌어지고 있다고 합니다. 

4년 전 강아지공장 사태 기억하시나요? SBS 동물농장에 나왔던 그 아주머니 말이 생생히 기억납니다. 주사기로 인공수정시키고, 무자격 제왕절개 수술을 했던 그 아줌마도 불법이 아니어서 처벌받지 않았어요.

어떻게 4년이 지나고 정권도 교체됐는데 바뀐 게 하나도 없을까요. 너무 안타깝습니다.

제발 부탁드립니다.

부디, 동물약국에서 반려동물 백신 판매를 금지해서 끔찍한 동물학대 사건이 재발하지 않도록 해주세요.",,반려동물,2020-04-10,2020-05-10,naver
587973,청원종료,일부단체의 채용관련 고소.고발및 각종민원을 바로잡아주세요,249,"청원인은 건설업에 종사하는자입니다.
현재우리나라는 일부단체의 힘에 의하여 건설현장의 인력및 장비수급등이 이루어지고있습니다 이에 단체에 속하지 못한 근로자는 현장에 들어갈수도없고 어렵게 들어간다고 해도 얼마 못가 실직을 하는 현실입니다  또한 건설기계는 단체들의 힘에 의하여 계약을 파기당하기 까지 하고있습니다
이들 단체는 현장이 개설되면 현장 또는 시공사 본사에 집회신고를 시작으로 인력또는 장비투입을 종용합니다 이후 토목공사시에는 세륜기를 타고 나가는 차를 조사하고 근로자들이 건축물을  올리기 시작하면 각종안전관련 사항을 현장근처에 상주하며 망원렌즈카메라로 증거를수집 하여 산안법 고발을하고  현장쓰레기통을 뒤져 분리수거 위반을 찾아 고발 합니다 이모든 민원과 고발은 본인들의 요구 조건이 관철될때까지 지속적으로 법이 허락하는 범위내에서 그공정이 끝날때까지 이어집니다 . 건설현장이나 우리생활준변에 잘못한 것이 있으면 그에 상응하는 제재를 받는것은 당연하다고 생각됩니다 또한 대한민국 국민누구라도 위법한 사실을보면 위법사실을 신고할수있습니다 하지만 본인들 단체의 이익을 위해서 이러한 법을 이용하여 자신들의 요구조건을 관찰시키는것 또한  잘못된일이라고 생각됩니다 . 단채의 이익을 위해 벌이고있는 건설현장의 고소.고발및 민원등에 대하여 바로잡아 주시기바랍니다",,일자리,2020-04-10,2020-05-10,naver
