number,progress,title,like,contents,answer,category,sday,eday,proponent
588048,청원종료,대구시장 탁핵을 요청합니다,2801,"저는 대구에 살고 있는 대구 토박이 대구 시민입니다.

코로나19 사태로 인해 대구를 사랑하는 대구 시민의 한사람으로서 정치에 관심없던 제가 이렇게 나마 지금 대다수의 대구시민들이 느끼고 있는 마음을 대변하고자 합니다. 

지금 대구는 다른 지역주민들은 헤아리지 못할만큼 끔찍한 하루 하루를 살아내고 있습니다.
정말 버텨내고 있다는 말이 이상황을 가장 잘 대변해줄 수 있는 말인것 같습니다.
눈을 뜨면 코로나 관련 뉴스를 보는것이 일상이 되었고 확진자 사망자를 확인하고 각자의 동네에 확진자가 더 생겼는지 걱정하며 수치를 확인하는게 하루의 시작이 되었습니다.
어쩔 수 없이 생계를 책임져야하는 가장들을 제외하곤 집밖을 나가지 않고 있습니다. 
감염의 불안함을 가지고 출퇴근하는 가장들, 종일 집안에 갇혀 답답해하는 아이들, 이런상황에 어쩔수 없이 아이 맡길곳을 찾아 아둥바둥하는 맞벌이 부모들 ... 누가 감염자일지 모르는 상황에 생계를 위해 아이를 타인의 손에 맡겨야하는 부모의 심정을 아실까요. 
눈뜨면 이 상황들이 꿈만같고 반복되는 일상의 소중함을 느끼는 하루를 살아내고 있습니다. 

대학병원들은 감염자들로 인해 응급실이 폐쇄된지는 오래되었고 당장 아파도 갈수있는 의료시설이 없습니다. 코로나 환자들로 인해 응급환자들이 의료서비스를 이용하지 못하는 최악의 사태까지 벌어지고 있습니다. 

의료진들이 sns상에 기재해 놓은 글을 본적이 있습니다. 거짓 뉴스일지는 모르나 부실 도시락부터 방호복,마스크 부족사태까지 앞으로 쓸수있는 마스크등 의료용품이 5일치 뿐이라는 내용들이었습니다. 정말 마음이 아파왔습니다. 사비로 옷이며 마스크를 수급하며 고생하시는 의료진들도 있다는 이야기도 들려왔습니다. 감염의 위험을 인지하고도 불철주야 수고해주고 계신 의료진들과 관계자들께 지원은 불구하고 
어찌되어 의료진들 스스로가 스스로를 보호해야하고 감염방지 물품까지 스스로 수급해야하는 상황이 온건지 이나라에 여쭙고 싶습니다.
이나라는 누구를 위한 나라이며 우리가 내는 세금은 다 어디로 간것일까요? 

대구시장에게 묻고 싶네요. 
대구를 대표하고 대구를 제일 아껴야 하실분이 지금 뭘하고 계신지 스스로에게 질문해보십시요. 
지금 하고 계신게 최선이십니까? 대구 시장으로써 책임감있게 이사태를 헤쳐나가려는 의지가 있는분 맞으십니까? 감성팔이만 하고 있다는 생각이 드는건 왜일까요? 다만 저만 그렇게 느끼는 걸까요? 

인터넷상에서 거론되고있는 대구시장의 지금 행태와 신천지를 결부시켜 많은 소문들이 양성되고 있습니다. 진실 거짓을 떠나 그러한 소문들이 나오는 이유가 무엇일까요. 바로 무능함때문입니다. 
대구 신청사 건축비로 3000억이 들어간다죠.
그것은 누굴위한 신청사입니까? 

마스크 의료용품도 수급이 어려운 이상황에 3000억이라뇨. 대구시민의 목숨보다 신청사가 중요하십니까? 본인 업적만들기 입니까?아님 본인 주머니 채우기 용도 입니까? 신공항이전,신청사건축 여기에 들어가는 돈은 시민의 혈세 아닙니까? 정작 쓰여야하는 곳엔 제정이 없다는 말만 반복이고 중앙정부에 지원요청...참.. 근데 혈세로 본인의 관사비용은 6억사용. 이시국에 대구시공무원 연수 말이나 되는 상황입니까.
신청사로 인해 필요한 다른 제정은 다 삭감하시고 현사태가 벌어졌으니 어찌하실겁니까?역학조사원도 제정부족으로 대구시에는 의무적으로 두명을 둬야하는 곳에 한분밖에 두지못해서 코로나 초기 발생시 역학조사가 힘들었다고 하더군요. 
이사태는 무능한 정부가 만든것입니다. 
대구에 따스한 손길들이 모이고 있습니다. 작은 도움의 손길부터 큰 기부까지 대한민국의 크고 작은 도움의 손길들이 닿고 있어 아직 따스한 정이 남아 있음에 감사하고 위로가 됩니다.
근데 이 기부금들이 투명하게 필요한곳에 쓰여질지 의문부터 드는게 사실입니다. 기부금은 많은데 그기부금은 다 어디로 간것일까요.피부로 와닿게 나아진것이 하나도 없습니다. 마스크는 여전히 구하기 힘들고 방호복 수급도 여전히 안되고 있습니다.

중앙정부에서 대구경북권을 사태를 총지휘하러 내려왔다는건 대구시장과 경북도지사의 무능함을 확인시켜주는 정부의 처사가 아닌가 싶습니다.

대구시민의 혈세를 마음대로 이용하는 대구시장.
무능한 대구시장.
뒷짐지고 탁상행정, 감성팔이만 하는 대구 시장.
이사태에 책임을 지고 물러나야 할것입니다.
대구시장의 탄핵을 청원합니다.

대구시는 제정과 기부금들의 사용처를 명확히 밝혀주시고 투명한 관리 부탁드립니다.",,정치개혁,2020-04-13,2020-05-13,naver
588049,청원종료,유튜브 크리에이터 스토커에게 처벌을 내려주세요,278,Sns유튜브 에서 집 주소를 알아내고 사적으로 사생활을 침해아는 이들을 처벌해주세요,,기타,2020-04-13,2020-05-13,facebook
588050,청원종료,**건설,173,"작은꿈하나로 2016년양산물금 **건설에서 시행하는 상가하나를 분양받았는데 공사는 중단되고 무이자대출이라던 이자는 개인부담에다 은행에 수억의 빛을 억울하게 떠안게 될위기에 내몰린 억울한 사연을 청와대에 호소해봅니다 ~
문제는 저같은 피해자가 양산물금에서만도 천여명에 육박하고 전국에 수천수만명이 되지만 ** 오**대표는 편법으로 또다른 협력업체를 바꿔가며
계속 공사를 진행하며 또다른 피해자를 양성하고 있다는겁니다~제발 정부에서 현실을 직시하고 적극 나서 주시길 간절히 청해봅니다~저는 컴맹에다 밤잠을 설치며 억울한 사연을 호소할데가 없어 어렵게 여기 까지 왔읍니다~0제발 저같은 피해자가 더이상 생기지
않도록이라도 현상황을 직시하시고 정부에서 적극 나서 주시길 간절히 간절히 청해봅니다 ㅠㅠ

 [본 게시물의 일부 내용이 국민 청원 요건에 위배되어 관리자에 의해 수정되었습니다]",,교통/건축/국토,2020-04-13,2020-05-13,naver
588051,청원종료,"""치료제 제품설명회에서 물 한잔 제공받지 못하는 간호사""를 글로벌의약협회 '보건의료인' 규정에 포함시켜 주세요.",236,"안녕하세요
코로나바이러스 19(COVID 19)로 인하여 많은 의료인 분들이 자원하여 봉사를 하고 있는 모습과 마스크를 쓴 얼굴에 난 흉터를 보고 깊은 생각이 들어 청원하게 되었습니다.   글을 쓰는 저는 간호사로 대학병원 암병동에서 근무를 하였고, 현재는 외국계 제약회사 연구개발팀에서 근무하고 있습니다. 전국에서 코로나 바이러스로 감염된 환자 치료를 위해 많은 간호사가 애쓰고 있습니다. 많은 매체에서는 간호사를 믿는다고 이야기하고 감사하다고 이야기하는 것 같습니다. 그리나 저는 이면에 있는 이 분들의 처우와 현실에서의 괴리에 대해 생각해보게 되었고 몇 가지 수정이 필요한 부분과 한계에 대해 이야기 하고 싶습니다. 
이에  ""치료제 제품설명회에서 물 한잔 제공받지 못하는 간호사""에 대한 배경을 공유하고 아래 내용의 해결 촉구를 청원 합니다. ""대한간호협회"", ""한국글로벌의약산업협회(이하, 글로벌의약협회(KRPIA)"" 관계자 분들 그리고 보건복지를 위해 애쓰시는 모든 의료인 여러분들께서 관심을 갖고 글을 읽어 주시면 좋겠습니다.

[주제] 
의료인으로써 치료 약제 설명회에 참석한 간호사는 글로벌의약협회(KRPIA)가 정한 ""보건전문가(의료인)""에 속하지 못하고 생수 하나도 먹지 못하는 이 상황의 괴리에 대해 공유하고 관계자의 해결을 촉구 합니다. 그 속에서 의사와 약사만이 식사를 할 뿐 입니다. 글로벌의약협회(KRPIA) 규정 중 “보건의료전문가”에 의사, 치과의사, 한의사, 약사, 한약사와 함께 간호사를 포함시키고 환자 치료의 접점에서 치료 약제 설명회에 더 많은 참석을 할 수 있도록 해주세요. 미국을 포함한 유럽에서는 보건의료전문가를 'Health Care Provider (HCP)'로 한정하고 이에 간호사를 포함하고 있습니다. 그러나 우리나라에서는 보건의료전문가의 그 구분이 달라 협회의 규정이 법규를 앞서고 있는 실정 입니다. 최신 약제에 대한 이해를 높이고 높아진 이해가 환자 치료에 도움이 될 수 있도록 보건의료전문가의 범위 조정을 요청 합니다.

[배경]
제약회사에서는 치료제의 효능, 효과와 부작용 등에 대한 이른바 '제품설명회'를 진행합니다. 새로운 치료제로써 식약처 승인을 마치고 환자 치료에 사용이 시작되었기 때문에, 병원에 근무하는 의료인을 대상으로 치료제에 대해 설명하는 것 입니다. 바쁜 병원 스케쥴 때문에 주로 아침 7시나 점심시간 그리고 외래가 끝난 시간에 병원에서 이루어 집니다. 이때 의료인에게 식사와 음료 포함하여 3만원 이하에 해당하는 도시락을 제공할 수 있습니다.  대한민국 의료법에 따라 ""의료인""이란 보건복지부장관의 면허를 받은 의사·치과의사·한의사·조산사 및 간호사로 한정하고 있고(참고 1), 많은 의료인이 최신 치료제에 대한 설명회에 참여를 합니다.

[문제]
대부분의 항암치료제를 비롯한 치료제는 미국이나 유럽에 본사를 둔 다국적제약회사에서 만들어져 사용되고 있습니다. 한국에서도 허가를 받아 치료제를 상품화하여 판매하는 다국적제약회사 ""글로벌의약협회(KRPIA)""에 회원사로써 규정을 만들고 그에 따라 활동을 하고 있습니다. 그러나 한국다국적의약산업협회 규정에서 “보건의료전문가”라 함은 의사, 치과의사, 한의사, 약사, 한약사를 말한다고 규정하고 있습니다(참고 2). 
문제는 한국다국적의약산업협회에서 정하 규정에 따라 보건의료전문가에게만 식음료를 제공하게 되어 있기 때문에 간호사에게는 어떠한 것도 제공할 수 없다는 것 입니다. 이에 한국의 의료법에서 정하는 의료인의 규정과 상충이 벌어지게 되는데, 바로 간호사가 빠져 있기 때문 입니다. 치료제 설명회에 참석한 간호사들이 도시락에 손을 대는 순간 ""죄송하지만 보건의료인이 아니기 때문에 식사를 드실 수 없다""고 양해를 구한 뒤 제약사 직원들이 도시락을 수거하는 상황 입니다. 그 이유는 간호사는 보건의료전문가에 속하지 않으며, 의료인으로 병원에서 환자와 의사 최접점에 있기 때문에, 제약회사에서 제공하는 음식을 먹게 되면 회사에서 식음료를 제공 받기 때문이라고 합니다. 국가에서도 인정하는 의료인 중 전문간호사, 선임 간호사 들이 식사를 빼앗기고 참석을 하고도는 애써 태연한 척 슬라이드만 보며 공부를 하고, 나머지 의사와 약사들은 식사를 하고 있는 실정이 계속 되고 있습니다. 소위 간호사 그룹은 식사 못하는 그룹이 되는 것 입니다.

[결론]
""Nursing Pharmacology Conference"" 등의 학회에서는 전 세계의 간호사들이 모여 치료제와 최신의학 지견에 대해 서로의 견해를 나누며, 간호사 연간 보수교육으로 인정하고 있습니다(참고 3).   이들은 모두 간호사이고 다국적제약회사에서 지원하는 프로그램에 참석을 하고 있습니다. 한국 간호사의 수준이 외국 간호사에 미치지 못하는 것이 아닙니다. 한국의 간호 대학 교과 과정이 수준에 미달하는 것이 아닙니다. 진정 '한국다국적의약산업협회'에서 원하는 것이 간호사가 치료제에 대한 정보에 대해 알지 않기를 원하는 것은 아닐 것 입니다. 이 부분은 단지 밥 한끼의 문제가 아니라, 해당 부분에서 필요로 하는 지식을 간호사는 치료 접점에서 알고 있어야 한다는 것 입니다. 대체 왜 국가 비상 시에는 나라의 영웅에 속하는 전문 인력이, 평범한 상황에서 식사를 못하는 그룹에 속해 있어야 하는지 의문 입니다. 간호사의 힘이 아닌 대한간호협회, 글로벌의약협회(KRPIA) 관계자 분들 그리고 보건복지를 위해 애쓰시는 모든 의료인 여러분들께서 관심을 갖고 힘을 보태 주시면 좋겠습니다. 

[마치는 글]
최근에 한 제약회사에서 ""심장질환 관련 간호사 교육""을 열었습니다. 미국에서 전문 간호사를 초빙하여 교육을 하는 프로그램이 이었습니다. 이 교육에 참석한 간호사는 약 100명이 넘었습니다. 이 교육은 점심시간 포함하여 6시간 이상 진행되었지만, 식사는 물론 주스나 심지어 물도 없고, 보수 교육으로 인정도 되지 않았습니다. 별도의 확인증 같은 것도 없습니다. 참석한 간호사에게 주어진 것은 치료에 대한 이해가 다 입니다. 순수히  환자 치료에 어떤 치료제가 어떤 방식으로 쓰이는지 알고자 참석한 것 입니다. 현재의 간호 수준은 표적항암부터, 면역치료제에 이르기까지 최신 의학, 약학을 전반적으로 이해하고 있어야 합니다. 혈액암 치료 경험 상 간호사는 밤 새 환자의 상태를 살피고 주기적으로 치료제와 혈액제가 정확하게 공급 되도록 합니다. 그로 인한 부작용은 없는지 계속해서 살피고 변화를 모니터링 합니다. 암 환자에게 치료보다 무서운게 부작용 입니다. 그래서 신규 간호사로 배정이 되면 질환과 치료제의 관계에 대해서 달달 외울 정도로 암기를 하고 이해를 한 상태에서 치료 환경에 임합니다. 이런 것들이 환자의 치료에 직접적으로 연결이 된다는 것을 이해하고,  치료제와 예상되는 부작용과 결과에 대해 명확히 알아야 비로소 직업 의식을 갖춘 의료인으로써 거듭날 수 있을 것이고 저희 가족이 아파도 믿고 맡길 수 있을 것 입니다. 

국가에 어려운 일이 터졌을 때 얼굴에 흉이 지도록 일을 하는 모습을 보고 또 이번 코로나 사태에서 간호사의 모습을 보고 이런 괴리를 나 혼자만 알고 있으면 안될 것 같아 청원을 합니다.
모쪼록  한국다국적의약산업협회 규정에서 “보건의료전문가”라 함은 의사, 치과의사, 한의사, 약사, 한약사의 규정에 간호사를 포함시키고 환자 치료의 접점에서 치료제에 대한 이해를 높여 우리나라 의료의 수준을 더 높일 수 있도록 해주시기 바랍니다. 

참고
1. 대한민국 의료법규 제2조
2. 한국글로벌의약산업협회 공정경쟁규약 및 실무운용지침 
3. https://pharmacology.nursingconference.com/",,보건복지,2020-04-13,2020-05-13,kakao
588052,청원종료,5G 보안 양자암호통신 관련 법 및 예산지원 건의문,536,"5G 보안 4차산업 핵심인 양자암호통신 관련 법 및 예산 건의문(2020.4.6.)

1. 현 상황
4차산업 핵심인 양자암호통신 관련 법 및 R&D예산이 부족합니다.
현재 양자암호통신 관련 정보통신 진흥 및 융합 활성화(ICT특별법) 등에 관한 특별법 개정안이 국회에서 국회 법사위에서 계류중이며,
이번국회를 통과시 자동폐기될 상황입니다.
또한 2020년 국회 과학기술정보방송통신위원회의 예산 요구에도 불구하고 2020년 기획재정부에서 양자암호 베타 관련서비스 100억 예산 삭감되었습니다.

현 상황은 관련 기술을 연구해도 '인증'에 막힌 양자암호...국내 인증 없어 현장 적용 못하고 있는 실정입니다.

지난해 ‘데이터 3법’이 가까스로 국회 문턱을 넘으면서 숨통이 트이는가 싶었으나 예기치 못했던 코로나19 사태가 업계를 덮쳤다. 설상가상으로 2월 임시국회에서 처리될 것으로 기대됐던 ‘ICT 5법’이 끝내 무산되면서 상황은 더욱 심각하게 흘러가고 있습니다.

정보통신진흥 및 융합활성화 등에 관한 특별법에는 기존 법조항의 정보통신 정의에 양자응용기술을 추가해 정부가 양자 관련 산업을 지원할 수 있는 근거가 담겨져 있습니다. 현재 미국·일본을 비롯해 유럽 선진국들은 양자정보통신을 신성장 동력으로 지정하고 정부가 주도해 육성 중입니다.

‘ICT특별법’은 모두 여야 간 쟁점이 없음에도 현재 국회에 발이 묶여 있다. 국회 과학기술정보방송통신위원회 전체회의를 통과하고도 지난 5일과 본회의 의결이 무산됐습니다. 21대 총선은 다음 달 15일, 20대 국회 임기는 5월 29일까지입니다. 만약 그전까지 본회의 처리가 이뤄지지 않을 경우 해당 법안들은 모두 자동 폐기됩니다.

이와 관련해 코리아스타트업포럼은 2020년 3월 12일 발표한 입장문을 통해 “5개 법안은 스타트업 성장에 지대한 영향을 주는 법”이라며 “20대 국회에서 통과되지 않아 폐기된다면 스타트업 성장의 골든타임을 놓칠 수 있다”고 지적했습니다.

2. 주변국 상황
미국 국회는 지난해 12월 5년 동안 12억달러(약 1조4000억원)를 양자 컴퓨팅 기술에 투자하는 ‘국가 양자 이니셔티브 법안(National Quantum Initiative Act)’을 통과시켰고 트럼프 대통령이 이에 최종 서명했다.

중국 정부는 2020년까지 100억달러(약 11조8000억원)를 투자해 안후이성에 양자컴퓨터 연구 클러스터를 만들 계획이다. 리진빈 안후이성 서기는 “양자 컴퓨터가 제조, 바이오, 금융 등과 융합되면 산업 지형이 완전히 바뀔 것”이라며 양자 컴퓨터 개발에 대한 강력한 의지를 밝힌 바 있다.

EU 오픈 QKD 프로젝트를 추진하는 양자 플래그십은 ‘유럽이 양자암호 기술 리더가 되겠다’는 비전으로 지난해 시작했다. 현재 양자암호 기술에 투자를 집중하는 미국, 대대적인 정부 지원을 등에 업은 중국을 따돌리고 양자 시장 패권을 확보하겠다는 것이다.

EU가 오는 2028년까지 추진할 양자 플래그십 예산은 10억유로(약 1조3000억원)다. 통신, 컴퓨터, 센싱, 시뮬레이션 등 총 4개 분야에 적용할 양자암호 기술을 연구, 개념화, 상용화, 보급, 교육까지 전 주기를 EU가 추진하고, 지원하고, 육성한다.

세계 주요 선진국들이 양자암호통신 기술을 선점하기 위해 막대한 연구개발(R&D) 투자와 다양한 정책지원들을 펼치고 있지만 우리정부의 예산과 지원책은 턱없이 부족합니다. 관련법안 또한 전무해 양자기술 R&D를 뒷받침할 정책지원 법안도 시급한 상황입니다.

과기정통부 관계자는 ""해외 양자기술 격차를 좁히기 위해 미국의 공군연구소와 공동연구 프로그램을 협의하고 있다""고 말했습니다. 이 프로그램은 올해 양자기술 3개 과제를 바탕으로 각각 연간 1억원을 지원해 2년간 진행할 계획이라고 합니다.

과학기술정보통신부는 지난해부터 953억원의 예산을 투입해 2024년까지 진행하는 양자컴퓨팅 R&D 사업에 착수했다고 합니다.
과기정통부 관계자에 따르면 2019년부터 5년간 460억이 투입해 5큐비트급 양자컴퓨터를 만드는 것이 핵심입니다. 이와함께 올해부터 5년간 493억원을 투입하는 양자컴퓨팅기술개발사업은 주로 인력양성과 인프라구축 등 기반조성사업으로 이뤄져 있습니다.

3. 앞으로의 필요성

상임위를 통과한 법안들은 법제사법위원회(법사위)를 거쳐 본회의에서 의결을 거쳐야 입법이 완료된다. 5일 열린 법사위에는 상정되지 못했다. 본회의를 통과하지 못할 경우 법안은 4월 총선 이후 폐기됩니다.

코로나19로 인한 빠른 법안 통과가 반드시 필요합니다.

다만, 5월 말 20대 국회 끝나기 전에 법사위가 개최되면 통과가 가능합니다.

5G 보안 4차산업 핵심인 양자암호통신 관련 법 및 예산이 필요합니다.",,성장동력,2020-04-13,2020-05-13,naver
588053,청원종료,코로나19 진단키트를 전략물자로 지정하여 국가에서 통제해 주세요.,467,"일본은 우리나라에 작년 7월 불화수소, 포토레지스트, 플루오린 풀리이미드등 반도체 핵심소재 3가지를 전략물자로 규정하고 수출을 제한하면서 경제 보복을 감행 했습니다.
다행이 우리나라 정부와 반도체 업체가 일본 경제보복에 휘둘리지 않고 잘 대처 해주고 있고, 지금도 경제보복은 진행 중에 있습니다.
일본은 독도, 교과서 역사왜곡 등 끈임 없이 우리나라를 무시하고 있습니다.
코라나19에 대처하는 우리나라 드라이브 스루 방식을 전 세계가 극찬하면서 모범국 사례로 칭송하고 있는데 일본은 우리나라 드라이브 스루 방식은 검사 정확도가 낮다며 애써 깍아 내리고 있습니다.
그런 일본에 코로나 19 진단키트 생산 업체인 ***가 일본 독점판매권 계약을 체결했다는 기사를 봤습니다. ""일본의 펜더믹 상황을 조기 종료할 수 있도록 기여하겠다고""도 합니다. 

***는 우리나라를 무시하는 일본에 대하여 돈만 벌면 되는 것인지 의문스럽습니다.

정부는 전세계로 판매하고 있는 코로나19 진단키트를 전략물자로 규정하고 판매를 통제할 것을 건의합니다.  

우리나라에 호의적인 국가와 우리나라를 무시하는 국가를 구분하고 우선순위를 정하여 진단키트를 배분, 판매해야 된다고 생각합니다.

우리나라 정부, 보건복지부, 질병관리본부를 응원하겠습니다.

 [본 게시물의 일부 내용이 국민 청원 요건에 위배되어 관리자에 의해 수정되었습니다]",,외교/통일/국방,2020-04-13,2020-05-13,naver
588054,청원종료,서울시 긴급재난생활지원금에서 실업급여 수급자 제외는 부당합니다.,697,"저는 작년까지 일하다 올해 사업장폐지로 퇴사하고 실업급여를 받고 있습니다.
80대 부모님과 51세로 중증질환 (암환자로 등록)인 제가 같이 살고있는데 실업급여를 받고 있다고 지원금대상에서 제외되었습니다. 
실업급여는 고용보험에 가입했던 직장인이라면 언제든 회사퇴사 시 받을 수 있는 것인데,어쩔 수 없이 현 시점(국가적 재난)에 실업급여를 받는다고 재난긴급지원금을 못 받는 것은 이해가 되지않습니다.
급여 300-400만원 받는 세대는 지원을 받고, 실업급여 168만원 받는 세대는 지원을 못 받는게 정당한지 모르겠습니다.
전 기저질환을 가지고 있어 현재 코로나19가 잠잠해지지 않는 이상 취직도 불가합니다. 
저의 현 상황이 다른 실업급여수급자 중에는 그나마  좋을 수도 있습니다. 저보다도 실업급여를 못 타시는 분도 있을거고 가족 중에 큰 돈이 들어가는 환자가 있을 수 있을테니까요.
지금의 현 상황이 일반적인 상황이 아닌 만큼 이런 복지정책을 급하게 만드느라  놓치는 부분도 생길 수 있다고는 생각합니다.
실업급여를 수급한다고 긴급재난지원금 수급에서 제외하는 것은 잘못된 정책입니다. 
국가적 재난이 매년 오는 것도 아니고. . .
빠른 정책수정을 청원합니다.",,보건복지,2020-04-13,2020-05-13,naver
588055,청원종료,버려지는 인체유례 폐지방을 활용하여 코로나19를 치료 할수있게 규제를 풀어 주세요,165,우리 나라에서 매년  지방흡입술을  통하여  버려지는 폐지방이 200톤이 넘는다고 합니다. 이 버려지는  폐지방을 활용하여 줄기세포를 배양하여 치료할경우 코로나19를 치료 할수 있습니다. 출기세포가 가장 먼저 폐를 건강하게 하여주기때문에 바이러스를 이길 면역세포를 만들어서 바이러스를 극복하게 됩니다. 의사의 책임하에 줄기세포를 배양 치료하는 길을 열어 주세요,,보건복지,2020-04-13,2020-05-13,kakao
